"category_id","category_name","press","title","content","reporter","date","link","timestamp"
"100","정치","동아일보","SCMP “中 J-20 스텔스 전투기 대한해협 통과…韓·日에 보고 안돼”","실전배치된 중국 인민해방군 5세대 스텔스 전투기 J-20. 방위사업청전략포럼 캡처중국이 세계에서 세번째로 개발해 배치한 5세대 스텔스 전투기 ‘J-20’이 대한해협 동수로(일본명 쓰시마 해협)를 통과했다는 보도가 나왔다. 우리 군과 일본 자위대는 이를 파악하지 못했을 가능성이 있다는 의혹도 제기됐다. ■ 중국 관영 방송 “中 전투기 바시·대한해협 초계임무” 29일 홍콩 사우스차이나모닝포스트(SCMP)는 지난 27일 중국 공군 전투기가 대한해협 동수로를 통과했다는 내용을 관영 중국중앙TV(CCTV)가 방영했다고 전했다. SCMP에 따르면, 당시 방송은 중국 인민해방군 공군의 정예 부대인 제1항공여단이 바시 해협(대만·필리핀 간 공해)과 쓰시마 해협(대한해협 동수로) 상공에서 임무를 수행하며 대만 전역을 순찰(초계·CAP)했다고 보도했다. ■ 中 제1항공여단’은 스텔스 전투기 배치 부대 CCTV에서 전투기 기종과 비행 시점을 직접 언급한 것은 아니다. 하지만 임무 수행 부대가 ‘제1항공여단’이라는 점에서 SCMP는 전투기 기종을 스텔스 전투기 J-20이라고 짚었다. 제1항공여단은 중국이 가장 먼저 J-20 전투기를 배치한 부대다. SCMP는 대한해협 동수로가 한국과 일본의 방공식별구역(ADIZ) 내에 있고 미군의 고고도 미사일 방어체계(THAAD·사드)를 포함해 미국·한국·일본 레이더 시스템 감시망이 밀집됐지만 J-20의 대한 해협 동수로 통과는 한국과 일본 모두에 보고된 바 없다고 주장했다. 실전배치된 중국 인민해방군 5세대 스텔스 전투기 J-20. 방위사업청전략포럼 캡처 ■ 한·미·일 레이더 J-20 탐지 못했을 가능성 ADIZ 내에서 적성국 항공기가 탐지될 경우 ADIZ 소속 국가의 전투기가 긴급 출격해 이에 대응하는게 일반적이다. 하지만 대한해협 동수로의 방공을 담당하고 있는 우리 공군과 일본의 항공자위대가 대응을 하지 않았다는 이유로 매체는 J-20이 탐지되지 않아 보고된 바 없다고 주장하는 것으로 풀이된다. 해당 보도가 사실일 경우 한·미·일 레이더 체계가 중국 인민해방군의 스텔스기를 탐지하지 못했다는 뜻으로 이어질 수 있다. 합동참모본부 관계자는 동아닷컴과의 통화에서 “우리군이 확인해줄 사안은 없다”고 전했다.","최재호 기자","2025-07-30 11:01:09","https://n.news.naver.com/mnews/article/020/0003651363","2025-07-30 PM 12:32:23"
"100","정치","경향신문","안철수 “내란 특검, 이재명도 부르라”···권성동 “하남자” 지적에 “하수인” 반박","권성동 “여의도 대표 하남자” 안철수 “하수인” 권성동 반박 안철수 국민의힘 의원이 29일 국회 상징석 앞에서 내란 특검의 출석 요구와 관련해 기자회견을 하고 있다. 연합뉴스 안철수 국민의힘 의원이 국회의 12·3 불법계엄 해제 표결과 관련해 참고인 신분으로 조사를 요구한 내란 특검을 향해 30일 “무엇보다 당시 민주당 당 대표였던 이재명 대통령 역시 참고인으로 특검의 조사를 받아야 한다”고 반발했다. 안 의원은 이날 페이스북에 “당시의 상황에 대해 누구보다 많이 알고 있는 분이다. 특검은 이 대통령부터 부르기 바란다”며 이같이 밝혔다. 이 대통령은 당시 더불어민주당 대표로서 계엄 해제 표결에 참여했다. 내란 특검은 전날 “국민의힘 의원 중 다수가 (국회의) 계엄 해제 요구안 표결에 불참하게 된 경위 및 국민의힘 내 의사 형성 과정 등에 대해 관련되신 부분의 조사가 반드시 필요하다”며 전날 안 의원에게 참고인 신분으로 출석해 조사를 받으라고 요청했다. 안 의원은 “국민의힘은 내란 정당이 아니다. 다수의 우리 당 의원들이 불법 계엄 시도를 막기 위해 끝까지 싸웠다”며 “당시 표결에 참여하지 않은 의원들을 문제 삼겠다면 민주당 의원들도 조사해야 한다”고 주장했다. 안 의원은 그러면서 “특검의 무차별적 정치 탄압으로부터 앞장서서 당을 지키겠다. 저 안철수만이 그것이 가능한 유일한 사람”이라며 “계엄에 물들지 않고, 당원들이 선택한 대선 후보를 유일하게 돕고, (대선) 출구조사 직후 모두가 다 떠난 뒤에도 마지막 남은 한 사람”이라고 밝혔다. 국민의힘 당 대표 선거에 윤석열 전 대통령 탄핵 찬성파(찬탄파) 후보로 나선 상황에서, 당을 겨냥한 특검 수사와 여당의 정당 해산 추진 움직임에 맞서야 한다는 지지층 일각의 요구를 의식한 발언으로 풀이된다. 권성동 국민의힘 의원은 이날 페이스북에 “어제 안철수 당 대표 후보가 특검으로부터 문자 한 통을 받았다며 호들갑을 떨었다”며 “정작 위헌 요소로 가득한 특검법에 홀로 찬성표를 던지고, 이후에는 동지들을 ‘인적 청산’이라는 이름으로 절벽 끝에 몰아넣은 사람이 바로 안철수 후보”라고 주장했다. 안 의원은 지난 28일 당 혁신안을 발표하며 대선 후보 단일화 추진과 관련해 권 의원을 인적 쇄신 대상으로 지목한 바 있다. 권 의원은 “동지들이 정치 수사의 큰 칼에 쓰러질 땐 미소를 머금고 방관하더니, 정작 본인에게는 커터칼 수준도 안 되는 참고인 협조 요청이 오자 ‘무분별한 정치 수사’라며 목소리를 높이는 모습은 실소를 자아낸다”고 말했다. 권 의원은 “무엇보다, 스스로 만든 상황 속에서 마치 희생자인 양 비장미를 연출하는 모습에 ‘여의도 대표 하남자’라는 별명이 괜히 붙은 게 아님을 다시금 느낀다”고 말했다. 앞서 권 의원과 안 의원은 페이스북에서 ‘하남자’ 논쟁을 벌인 바 있다. 하남자는 ‘아주 남자다운 남자’를 의미하는 ‘상남자’의 반대말이다. 이에 안 의원은 페이스북에 “하수인”이라며 이른바 ‘체리따봉’ 사진을 올렸다. 권 의원이 2022년 7월 텔레그램으로 윤석열 당시 대통령에게 “내부 총질이나 하던 당 대표가 바뀌니 달라졌다”며 ‘체리따봉’ 이모티콘이 담긴 메시지를 받고, “대통령님의 뜻을 잘 받들어 당정이 하나되는 모습을 보이겠다”고 답장한 스마트폰 모습이 포착된 사진이다. 안 의원의 “하수인” 표현은 친윤석열계인 권 의원이 윤 전 대통령에게 지시를 받는 관계였다고 비판하려는 취지로 해석된다.","박광연 기자","2025-07-30 11:00:08","https://n.news.naver.com/mnews/article/032/0003386260","2025-07-30 PM 12:32:23"
"100","정치","연합뉴스","中 생수업체 농푸, 美 0.93㎢ 땅 매입 공장 지으려다 '좌초'","반중정서 작동, 국가안보 이유로 현지 반발…공산당 배후 의심도 (서울=연합뉴스) 인교준 기자 = 중국 최고 갑부 반열에 오른 생수업체 농푸산취안(農夫山泉·농푸)이 미국에서 생수 공장용 땅을 샀다가 반중 정서에 막혀 사업이 좌초 위기에 처했다고 홍콩 사우스차이나모닝포스트(SCMP)가 30일 보도했다. 보도에 따르면 농푸는 미국 내 자회사를 통해 지난 1월 미 뉴햄프셔주 내슈어의 9.3헥타르(0.93㎢, 2만8천평) 규모의 산업 부지를 샀다. 중국 농푸산취안 창업주 중산산 [홍콩 SCMP 캡처. 재판매 및 DB 금지] 농푸는 이 부지를 6천700만달러(약 932억원)에 샀으며, 이는 평가 가치인 1천50만달러의 4배를 훌쩍 넘긴 액수라는 점에서 주목받았다. 농푸는 해당 부지에서 나오는 수자원으로 생수는 물론 음료를 제조하겠다는 사업계획을 알렸으나, 해당 토지 소유자에게 상식 이상의 고액을 주고 땅을 샀다는 점이 관심을 끌었다. 여기에 중국 내 최고 부자 순위 1위를 오르락내리락하는 중산산이 창업한 농푸의 공격적인 미국 진출 사업이라는 점도 현지에서 반중 정서를 불렀다. 배후에 중국 공산당과 정부가 자리 잡고 있는 것 아니냐는 우려도 커졌다. 국가 안보 위협 논란으로 이어진 것이다. 특히 부근에 국방·정보보안·항공 우주 관련 기업인 BAE시스템즈와 연방 항공 통제센터, 우주군 기지 등이 있다는 점이 우려 사항으로 등장했다. 무엇보다 최근 몇 년 새 미국에서 중국 기업들의 진출과 사업 확장이 미국 현지인과 당국의 반발로 삐걱대거나 갈등 끝에 좌초하는 일이 빈번하게 발생한 가운데 농푸 토지 매입 건도 그와 유사하다는 점에서 눈길을 끌고 있다. 실제 중국 전기자동차 배터리 제조업체인 고션(Gotion·궈시안)은 미국 인플레이션감축법(IRA) 등의 시장 진입 규제를 피해 미시간에 24억달러 규모 공장을 지어 전기차용 LFP(리튬인산철) 배터리를 생산·판매하려다 큰 반발을 샀다. 이는 작년 10월 미 대선판 쟁점으로 부각하기도 했으며 현재 사업 추진이 지지부진하다. 중국 최대 배터리업체 닝더스다이(寧德時代·CATL)와 미 포드 자동차가 합작해 미시간주 마셜에 배터리공장을 건립하려던 사업도 2023년 9월 중단됐다. 시중에서 팔리는 중국 농푸산취안 생수 [홍콩 SCMP 캡처. 재판매 및 DB 금지] 중국의 바이오 발효 기업인 푸펑그룹이 옥수수 제분 공장을 짓기 위해 노스다코타주 그랜드포크스 내에서 370에이커(1.49㎢)를 매입하려 했으나, 2023년 2월 노스다코타 시의회의 반대로 매입이 무산됐다. SCMP는 농푸의 시도와 유사한 사례는 최근 몇 년간 완전히 중단됐거나 점점 더 엄격한 조사에 직면한 상태라고 전했다. 이런 상황에서 농푸가 부지를 개인으로부터 매입했다고 하더라도 관련 당국과 현지 주민이 해당 거래에 반발하면서 난관에 직면했다고 이 신문은 전했다. 특히 과거 뉴햄프셔주에선 중국을 포함한 적대적인 외국의 기관 등에 군사시설 부근 토지 매각을 제한하는 법안이 추진됐다가 무산됐음에도 이번 일을 계기로 그와 관련해 정치적 동력이 되살아났다고 한다. SCMP는 뉴햄프셔의 공화당 의원들을 중심으로 농푸의 산업단지 부지 매입을 주 당국이 철회할 수 있는 법안이 추진되고 있다고 전했다. 여기에 공화당 의원들은 연방 정부 차원에서 외국인투자심의위원회(CIFUS)에 국가 안보를 이유로 해당 계약을 취소해달라고 요구하고 있다. 이와 관련해 뉴햄프셔주 내슈어시는 SCMP에 ""농푸가 음료 제조 시설을 설립하려고 신청했으나, 그 계획은 지난 5월 말 철회된 것으로 안다""고 확인했다. SCMP는 농푸의 뉴햄프셔 생수 공장 계획은 여러 여건으로 볼 때 사실상 좌초한 것으로 예상하면서, 이전 사례와 마찬가지로 중국 기업들의 미국 내 사업들에 대해 공산당 배후설 제기와 강한 반중 정서로 인해 가로막히고 있는 점에 주목했다. 이 신문은 이런 추세는 도널드 트럼프 미 대통령이 자국에 공장을 지으라고 외국기업에 강력히 요구하는 것과는 다른 기류라고 비판했다. 중국 기업을 돕는 뉴욕 소재 컨설팅 기업 임팩트(iMpact)의 크리스 페레이라 CEO는 ""중국 기업의 잘못이 없더라도 (반중 정서) 정치화로 인해 프로젝트가 지연·좌초될 수 있으며 농푸가 다음 희생양이 될 가능성이 있다""고 지적했다. 중국 푸펑그룹이 매입하려다 불발된 미국 노스다코타주 농지 [그랜드포크스 지역경제개발공사 홈페이지 캡처] kjihn@yna.co.kr","","2025-07-30 10:53:47","https://n.news.naver.com/mnews/article/001/0015537958","2025-07-30 PM 12:32:23"
"100","정치","헤럴드경제","반기업법 몰아치는 與…내부서도 “성장정책 전 규제강화 성급” 우려 [이런정치]","법인세 1%p 인상 “기업에 심각한 타격” 주식양도세 대주주 요건 완화…당 내부 이견 김병기 더불어민주당대표 직무대행 겸 원내대표가 30일 오전 서울 여의도 국회에서 열린 최고위원회의에 참석해 인사하고 있다. 이상섭 기자 [헤럴드경제=주소현 기자] ‘친기업’을 내세우던 더불어민주당이 정작 ‘반기업법’ 입법을 내달리고 있다는 지적이 나온다. 7월 국회 내 처리를 벼르고 있는 상법, 노동조합법(노란봉투법) 속도전에 더해 세법까지 재계가 우려하는 법안을 밀어붙이고 있기 때문이다. 민주당 내부에서도 “규제 강화 정책을 성급하게 먼저 꺼내 든다”는 우려가 제기된다. 30일 정치권에 따르면 정부와 민주당은 이달 말 법인세를 24%에서 25%로 인상하고 대주주 양도세 기준을 50억원에서 10억원으로 하향하는 세법 개정안을 내놓을 예정이다. 민주당은 다음 달 4일 열릴 국회 본회의에 집중투표제를 도입하고 분리선출하는 감사위원을 확대하는 내용의 상법 2차 개정안을 상정하겠다는 계획이다. 민주당은 세법 개정을 두고 윤석열 정부로부터 ‘정상화’를 내세우고 있다. 김병기 민주당 대표 직무대행 겸 원내대표는 30일 국회에서 열린 최고위원회의에서 “민주당은 윤석열과 국민의힘이 망친 조세기틀을 다시 바로 세우겠다”며 “조세정상화를 이루겠다”고 말했다. 국회 기획재정위원회 여당 간사인 정태호 민주당 의원도 전날 국회 의원회관에서 열린 기획재정부와 실무당정협의회 후 법인세 인상과 주식양도세 대주주 요건 완화를 묻는 기자들의 질문에 “법인세 인상은 2022년으로 정상화하는 것”, “기존 윤석열 정부에서 원래 10억원이던 것을 50억원으로 상향했던 것”이라고 설명했다. 하지만 법인세 인상에 관해 송언석 국민의힘 비상대책위원장 겸 원내대표는 이날 MBC라디오에 출연해 “(2년 전) 여야 합의로 (법인세) 1%p 내린 걸 조세 정상화라고 얘기했는데 지금 와서 다시 세율을 인상하는 것을 정상화라고 얘기하는 건 견강부회”라고 반박했다. 송 비대위원장은 “전 세계적으로 법인세 세율을 내리고 있는 방향에 역행해서 지금 다시 올린다는 건 관세라든지 여러 가지 국내외 환경이 기업의 규제를 굉장히 강화시키고 있는 상황”이라며 “정부에는 세수가 좀 더 들어온다는 이점이 있을지 모르지만 실제로 경제를 운영하는 기본 주체인 기업에는 굉장히 심각한 타격을 줄 수 있다”고 지적했다. 주식양도세 대주주 요건 완화를 두고 민주당 내부에서도 이를 경계하는 목소리도 나오고 있다. 이소영 민주당 의원은 28일 자신의 페이스북을 통해 “서울 아파트 평균 가격이 14억원을 넘는 상황에서 주식 10억원 어치를 가지고 있다고 ‘대주주가 내는 세금’을 부과하겠다는 게 상식적이냐”고 반문했다. 이어 “이런 정책은 코스피 4000을 돌파하고 어느 정도 안착한 시점에 논의해도 충분할 것”이라며 “충분한 성장 정책을 꺼내기도 전에 규제 강화 정책을 성급하게 먼저 꺼내 들어 시장에 찬물을 끼얹는다면 현명한 판단은 아니라고 생각한다”고 주장했다. 개정 한 달 만에 충분한 숙의 없이 상법에 다시 손을 댔다는 우려도 나온다. 지난 28일 열린 국회 법제사법위원회 법안심사제1소위원회에서 민주당이 강행 처리한 이번 상법 개정은 집중투표제와 감사위원 분리선출이 핵심이다. 집중투표제는 선임하고자 하는 이사의 수만큼의 의결권을 부여해 소수 주주의 의사결정권을 강화하는 효과를 낸다. 감사위원 분리선출 확대는 다른 이사와 분리해 선출하는 감사위원을 1명에서 2명으로 늘리도록 해 경영권을 위협할 수 있다는 우려가 제기되는 제도다. 이 두 가지 조항은 6월 임시국회서 상법을 개정할 당시 추가 논의를 이유로 제외됐었다. 민주당은 국회 법제사법위원회 소위와 공청회 등을 통해 숙의를 거쳤다는 입장이다. 다음 달 1일 국회 법제사법위원회 전체 회의를 거쳐 4일 예정된 본회의에 이 법안을 상정해 상법 개정을 밀어붙이겠다는 의지를 보이고 있다. 그러나 민주당 안팎에서는 잇따른 상법 개정에 재계의 우려가 충분히 반영되지 않았다는 지적이 나온다. 한 민주당 관계자는 “상법과 같은 기본법을 고치는 건 신중해야 한다”며 “악용될 여지, 부작용 등을 검토하면서 충분히 숙의를 거치지 않으면 피해는 고스란히 국민에게 돌아갈 수밖에 없다”고 말했다. 특히 감사위원 분리선출에 관해 법원행정처는 “이사 선임에 대한 주주의 의결권 행사는 주주가 회사 경영에 참여하는 핵심적인 수단인 점, 2020년 12월 상법 개정 당시 여러 찬반논의 끝에 타협안으로 ‘원칙적 일괄선출, 최소 1명 분리 선출’로 입법되었던 사정을 고려할 때, 신설된 분리선출방식의 효과 및 부작용 등에 대한 종합적인 검토를 선행하여 분리선출을 확대할 필요가 있는지 검토할 필요가 있다”는 의견을 낸 바 있다.","주소현 기자","2025-07-30 10:50:11","https://n.news.naver.com/mnews/article/016/0002507100","2025-07-30 PM 12:32:23"
"100","정치","YTN","이 대통령, 노동부 장관에 ""직 걸어라""...얼어붙은 국무회의 현장 [Y녹취록]","■ 진행 : 윤재희 앵커 ■ 출연 : 배종호 세한대 교수, 정연국 전 청와대 대변인 * 아래 텍스트는 실제 방송 내용과 차이가 있을 수 있으니 보다 정확한 내용은 방송으로 확인하시기 바랍니다. 인용 시 [YTN 뉴스UP] 명시해주시기 바랍니다. ◆ 앵커 어제 장관들에 대해서 대통령의 강력한 경고성 발언들도 나왔습니다. 특히 산업재해와 관련해서 미필적 고의 살인이라는 표현까지 어떠더라고요. 어떻게 들으셨나요? ◇ 배종호 법률적 용어로는 미필적 고의에 해당한다, 대통령께서 이렇게 말씀을 하셨죠. 그 이유는 똑같은 장소에서 똑같은 사고가 똑같은 방식으로 계속된다는 것은 결국 죽음을 방치하는 것을 넘어서 용인하는 것이다. 그래서 법적으로 보면 미필적 고의에 해당된다고 강력하게 얘기를 했는데. 2024년도에 우리나라 산재 사망자 수가 827명입니다. 그리고 산재와 관련된 질병 사망자가 1200명이 넘고요. 다 합치면 2000명이 넘는데. 이렇게 되면 굉장히 후진국의 모습이다. 특히 이재명 대통령 같은 경우는 본인이 소년공 시절에 직접 산재로 인해서 장애자가 됐지 않습니까? 그런 경험, 본인의 확실한 철학이 반영이 돼서 이 부분이 90분 넘게 생으로 국민들에게 전달된 것 같은데 구체적인 방안까지 제시됐다라는 점에서 저는 굉장히 긍정적으로 평가합니다. 징벌적 배상제를 도입하라. 또 산재 문제와 관련해서 기업 공시를 통해서 투자가 상당히 위축되게 하는, 그리고 대출까지 제한하는. 또 국무위원들은 전담검사 그리고 전담수사본부까지 얘기를 했기 때문에 여기서 거론된 여러 가지 방식들이 구체적으로 행정으로 이어져서 산재사망자 수가 이재명 정부 들어와서는 크게 떨어졌으면 좋겠습니다. ◆ 앵커 고용노동부 장관에게는 직을 걸고 개선하라고 얘기했고 관련 회사도 꼭 찍어서 언급했습니다. 이 회사는 사장까지 나서서 사과까지 했더라고요. ◇ 정연국 그렇죠. 고용노동부 장관에게 직을 걸고 산재 없도록 하라고 지시를 하고 고용부 장관도 직을 걸겠다고 자신 있게 얘기했는데. 이재명 대통령은 산재와의 전쟁을 선포했다고 봐야 될 것 같습니다. 굉장히 중하게 여기는 그런 사안인 것 같은데. 본인이 지난번 어느 기업을 방문해서 회장을 앞에 두고 질책도 하고 그렇게 하는 모습을 봤는데 이번에도 현장을 같이 가자고 하는 어제 발언도 있었습니다. 그만큼 산재와 관련해서 사람이, 인명이 사고로 인해서 희생당하는 일은 없도록 하겠다는 강력한 의지를 보였다고 생각이 됩니다. 말씀하신 대로 여러 가지 대안도 많이 제시됐어요. 좋은 대안들인 것 같습니다. 그런데 고개가 갸우뚱하는 부분이 대통령이 기업체에 가서 지시를 하면 기업체는 당연히 위축되고 당연히 지시한 대로 따라야 되는 부분이 있는데. 현장에 가서 지시를 한다고 그러면 당연히 그 부분이 개선됩니다. 혹시나 민간기업이잖아요. 사기업이잖아요. 그런데 대통령이 직접 가서 지시하고 구체적인 경영 사안까지 관여한다. 어떻게 보면 관치가 되는 거 아니냐는 그런 부분에 대한 우려가 생길 수 있는 것입니다. 이게 계속되다 보면 즉시 개선은 됩니다마는 이게 지속되다 보면 대통령이 왔으니까 개선되고 대통령이 안 왔으니까 우리는 잘하고 있구나, 이렇게 관행이 돼버릴 수 있단 말입니다. 그러니까 어느 정도 좋은 부분이 있지만 단점도 있다는 데서 어느 정도 대통령실에서도 직시해야 되지 않을까 싶습니다. ◆ 앵커 사기업에 대통령이 직접 지시하는 부분에 대한 우려를 언급해 주셨는데 어떤 의견이실까요? ◇ 배종호 이건 사기업의 경영 문제라기보다는 산재사고로 인해서 사람들이 계속 죽어가는 공적인 문제다라고 봐야 되고요. 수많은 사람들이 계속 죽어가는 산재사고 현장을 대통령이 외면한다? 그러면 대통령으로서 역할을 다 못하는 것이고 직무유기다, 저는 이렇게 생각하고요. 이런 부분에 대해서 민간경영을 간섭한다라고 생각하는 것은 굉장히 잘못된 것이고 근본적인 것은 왜 이런 산재사망사고가 계속해서 줄어들지 않고 늘어나고 있는데 정치권, 정부는 바라만 보고 있었느냐. 그래서 미필적 고의에 의한 살인이다라는 문제까지 나왔는데. 만약에 자기 자신이 그렇게 죽었다. 그리고 자신의 가족이 죽었다. 계속 방치만 할 수 있겠습니까? 그래서 저는 이재명 정부에서 이게 결국 구호로만 끝나는 것이 아니고 결과를 보여줘야 되는 거 아니겠습니까? 그래서 대통령께서 노동부 장관에게 강력하게 얘기를 했잖아요. 이 부분에 대해서 직을 걸어라. 그러니까 직을 걸겠다고 하니까 나중에 결과를 보겠다고 하지 않았습니까? 그래서 김영훈 장관 같은 경우는 본인이 이 부분에 대해서 결과로 성과를 보여주지 못한다면 정말로 직을 걸어야 되는 상황이고. 반대로 본인이 확실하게 산재사망자 수를 뚝 떨어뜨린다면 정말 장관 잘 뽑았다. 그리고 대통령 잘 뽑았다. 진짜 대한민국 정부다. 이런 칭찬을 국민들로부터 받을 수 있겠다. 그래서 그 결과가 주목됩니다. 제작 : 윤현경 #Y녹취록 ※ '당신의 제보가 뉴스가 됩니다' [카카오톡] YTN 검색해 채널 추가 [전화] 02-398-8585 [메일] social@ytn.co.kr","","2025-07-30 10:42:23","https://n.news.naver.com/mnews/article/052/0002226586","2025-07-30 PM 12:32:23"
