"category_id","category_name","press","title","content","reporter","date","link","timestamp"
"100","정치","연합뉴스","與전대 닷새앞…鄭 ""당심이 승부 갈라"" 朴 ""대통령과 함께 책임","정청래 ""법관평가제 도입"" …박찬대 ""협치프레임 그만"" 2차 토론회에서 악수하는 박찬대·정청래 후보 (서울=연합뉴스) 더불어민주당 당 대표 선거에 출마한 정청래(오른쪽)·박찬대 후보가 지난 27일 오후 서울 영등포구 여의도 KBS 신관 공개홀에서 2차 텔레비전 토론회 시작 전 악수를 하고 있다. 2025.7.27 [국회사진기자단] hkmpooh@yna.co.kr (서울=연합뉴스) 곽민서 기자 = 더불어민주당 8·2 전당대회를 닷새 앞두고 정청래·박찬대 후보(기호순) 간 신경전이 고조되고 있다. 강력한 개혁 이미지를 굳히려는 정 후보와 개혁 의지에선 우열을 가릴 수 없다며 인식 전환을 노리는 박 후보가 경쟁적으로 '내란 척결' 메시지를 발신하고 있다. 정 후보는 이날 외부 전문가가 참여하는 '법관평가제'를 도입하는 내용의 법원조직법 개정안을 대표 발의했다고 밝혔다. 민주당은 법원의 지난 3월 윤석열 전 대통령 구속 취소 결정, 대법원의 이재명 대통령 선거법 사건 파기환송 등을 사법부의 부당한 판결 사례로 지목하며 개혁을 벼르고 있다. 정 후보는 ""외부 전문가의 객관적인 평가를 통해 사법부의 독립성과 투명성을 확보해야 한다""며 ""(윤 전 대통령 구속 취소를 결정했던) 지귀연 판사 등 내란 동조 세력이 여전히 존재하는 만큼 신속히 사법 개혁을 추진해야 한다""고 강조했다. 정 후보는 전날 TV 토론 후 기자들과 만난 자리에서는 이른바 '명심'(明心·이재명 대통령의 의중)이 박 후보에게 향한 것 아니냐는 지적을 일축하며 ""이번 전당대회는 오직 당원, 오직 당심, 당원들이 결국 승부를 가릴 걸로 생각한다""고 말하기도 했다. 권리당원 표심에서 우위에 있다고 자평하는 정 후보가 강력한 개혁 추진력을 강점으로 내세워 '굳히기'에 들어간 것으로 풀이된다. 박 후보도 특검 수사를 고리로 강경한 메시지를 냈다. 그는 이날 페이스북에서 김건희 여사의 의혹을 수사하는 민중기 특별검사팀이 개혁신당 이준석 대표를 압수수색한 데 대해 ""늦었지만 다행""이라며 ""(이 대표) 체포동의안이 오면 즉시 처리하겠다""고 말했다. 전날 TV 토론 후 페이스북에서는 ""박찬대를 '협치 당 대표'로 규정해 '개혁 당 대표'와 대립시키는 것은 프레임""이라며 ""내란 종결과 개혁의 의지는 박찬대, 정청래가 다르지 않다""고 강조했다. 정 후보 측에서 박 후보의 개혁 추진 동력을 평가절하하는 것을 경계하면서 당원 표심을 겨냥한 '강성' 메시지를 내놓는 데 공을 들이는 모습이다. 박 후보는 이날 경기·강원·호남·제주·인천 등 지역별 공약도 발표했다. 특히 박 후보의 지역구이자 의원 시절 이재명 대통령의 지역구였던 인천에 대해서는 ""인천 출신 박찬대가 대통령과 함께 인천 발전을 책임지겠다""고 말했다. 민주당 전통의 텃밭인 호남은 물론 서울·경기·인천 등 수도권 당심도 당 대표 선거의 승패를 가를 변수인 만큼 지역의 표밭갈이에 사활을 거는 모습이다. 두 후보는 오는 29일 전당대회 전 마지막 TV 토론에서 맞붙는다. mskwak@yna.co.kr","곽민서 기자","2025-07-28 12:35:21","https://n.news.naver.com/mnews/article/001/0015533754","2025-07-30 AM 11:26:51"
"100","정치","연합뉴스","李정부 화해 손길 뿌리친 北…남북관계 앞날 예상대로 '험로'(종합)","대북전단 말리고 대북방송 중단했지만…김여정 ""선임자와 다를 바 없어"" '한미연합연습 축소 압박 해석도…정부, 일희일비 않고 ""평화정착 노력 계속"" 김정은, 2023년 말 전원회의에서 '적대적 두 개 국가 관계' 선언 2023.12.27 [조선중앙TV 화면. 국내에서만 사용가능. 재배포 금지. For Use Only in the Republic of Korea. No Redistribution] nkphoto@yna.co.kr (서울=연합뉴스) 하채림 기자 = 북한이 이재명 정부의 잇단 대북 화해 제스처를 평가 절하하며 ""마주 앉을 일 없다""고 선을 그었다. 한반도 긴장완화와 남북관계 개선을 향한 새 정부의 시도에 찬물을 끼얹은 것이지만, 북한이 남북관계를 '적대적 두 국가관계'로 규정한 상황에서 애초부터 신속한 화답을 기대하긴 어려웠던터라 실망하기는 이르다는 평가도 나온다. 정부도 북한의 반응에 일희일비하지 않고 평화정착 노력을 계속하겠다는 입장이다. 김정은 북한 국무위원장의 동생 김여정 노동당 부부장은 28일 발표한 담화에서 ""우리는 서울에서 어떤 정책이 수립되고 어떤 제안이 나오든 흥미가 없다""면서 ""한국과 마주앉을 일도, 논의할 문제도 없다""고 단언했다. 이재명 정부의 대북정책에 대한 북한의 첫 반응이다. 김여정 부부장은 이를 '공식입장'이라고 못박았다. 김정은 국무위원장의 의중이 들어있다는 의미다. 김 부부장은 새 정부의 대북 확성기방송 중지, 전단 살포 차단, 개별관광 허용 등을 열거하며 ""나름대로 기울이고 있는 《성의있는 노력》""이라고 언급하긴 했다. 정동영 통일부 장관이 취임사에서 언급한 ""이제 강 대 강의 시간을 끝내고, 선 대 선의 시간으로 바꿔야 한다""거나 ""적대와 대결의 시간을 뒤로 하고 다시 화해와 협력의 시대를 열어가자""고 한 것도 짚었다. 그러나 김 부부장은 이에 대해 ""한국이 이제 와서 스스로 자초한 모든 결과를 감상적인 말 몇마디로 뒤집을수 있다고 기대하였다면 그 이상 엄청난 오산은 없을 것""이라고 평가절하했다. 대북방송 중단에 대해서도 ""스스로 초래한 문제거리들""에 대한 조처일 뿐, ""평가받을 만한 일이 못 된다""고 지적했다. 오는 10월 말 경북 경주에서 열리는 아시아태평양경제협력체(APEC) 정상회의에 김정은 국무위원장을 초청하는 문제에 대해서는 ""헛된 망상""이라고 일축했다. 김 부부장은 특히 이재명 정부가 ""한미동맹에 대한 맹신과 우리와의 대결기도는 선임자와 조금도 다를 바 없다""고 비판했다. 그러면서 ""우리의 남쪽 국경너머에서는 침략적 성격의 대규모합동군사연습의 련속적인 강행으로 초연이 걷힐 날이 없을 것""이며 한미는 정세악화의 책임을 북한에 전가하려할 것이라고 지적했다. 또 새 정부에서 검토하는 '통일부' 명칭 변경 문제를 염두에 둔듯 ""해체되여야 할 통일부의 정상화를 시대적 과제로 내세운 것을 보아도 확실히 흡수통일이라는 망령에 정신적으로 포로됐다""고도 비난했다. 지난해 한미 정례 연합훈련 '을지 자유의 방패' 당시 평택 캠프 험프리스 미군기지의 아파치 헬기 [연합뉴스 자료사진] 2024.8.19 xanadu@yna.co.kr 김 부부장의 이날 담화는 이재명 정부의 대북 화해 정책에도 '적대적 두 국가' 방침을 바꿀 생각이 없음을 드러낸 것이라는 평가가 나온다. 다만 김 부부장이 이재명 정부가 전 정부와 다를 바 없다고 평가한 근거로 한미연합훈련을 지목했는데, 거꾸로 보면 이는 내달 중순 시행 예정인 '을지 자유의 방패'(UFS·을지프리덤실드) 연합연습의 축소·연기를 한국에 압박하는 것으로 해석될 소지도 있다. 양무진 북한대학원대학교 총장은 ""북한이 이재명 정부가 이전 정부에서 변하지 않았다는 근거로 한미동맹을 꼽고, 대적관계의 상징으로 한미군사훈련을 거론했다""며 ""다음달 한미연합훈련이 남북관계의 분수령이 될 수 있다""고 전망했다. 김여정 북한 노동당 부부장 [조선중앙TV 화면] 2022.8.11 [국내에서만 사용가능. 재배포 금지. For Use Only in the Republic of Korea. No Redistribution] nkphoto@yna.co.kr 정부는 북한의 대화 거부 반응에 낙담하지 않고 관계 개선 노력을 계속하겠다는 입장을 분명히 했다. 이재명 대통령도 취임 한 달 기자회견에서 ""지금은 너무 적대화되고 불신이 심해서 (북한과 관계 개선이) 쉽지 않을 거로 예상한다""며 ""길게 보고 소통과 협력을 계속해 나가겠""다는 의지를 밝힌 바 있다. 대통령실이 이날 북한 반응을 두고 ""싸울 필요가 없는 상태인 평화 정착은 이재명 정부의 확고한 철학""이라며 ""정부는 적대와 전쟁 없는 한반도를 만들기 위해 필요한 행동을 일관되게 취해 나갈 것""이라고 밝힌 것도 같은 맥락이다. 한편 김여정의 담화는 대외매체인 조선중앙통신에만 실렸을 뿐 주민들이 볼 수 있는 노동신문 등 대내매체는 보도하지 않았다. tree@yna.co.kr","하채림 기자","2025-07-28 12:30:15","https://n.news.naver.com/mnews/article/001/0015533753","2025-07-30 AM 11:26:51"
"100","정치","중앙일보","李 공약 현실화? 스테이블 코인 제도화 與 첫 법안 발의","더불어민주당이 '스테이블 코인'을 제도화하는 법안을 발의했다. 이재명 대통령의 대선 공약 중 하나인 '스테이블 코인 제도화'를 구체화할 법안이 여당에서 처음 발의된 셈이다. 스테이블코인은 달러·원화 등 기존 통화에 가치를 고정해 가격 변동을 최소화한 가상 자산을 뜻한다. 국제 경제 시장이 달러 기반의 스테이블 코인에 석권 되기 전에 한국도 '원화 스테이블 코인'을 만들어 대응해야 한다는 발상이다. 더불어민주당 안도걸 의원이 23일 서울 여의도 금투센터에서 열린 스테이블코인의 제도권 편입을 위한 정책토론회에서 인사말을 하고 있다. [연합뉴스] 28일 국회 기획재정위원회 소속 민주당 안도걸 의원은 ‘가치 안정형 디지털 자산의 발행 및 유통에 관한 법률안’을 대표 발의했다고 밝혔다. '가치 안정형 디지털 자산'은 스테이블 코인의 다른 이름이다. 앞서 같은 당 민병덕 의원이 지난달 발의한 ‘디지털자산 기본법’에 스테이블 코인 관련 내용이 일부 담겼으나 원화 스테이블 코인의 발행·유통·통제 등 생태계를 규율한 법안은 이번이 처음이다. 최근 미국에서는 스테이블 코인을 제도권에 편입하는 ‘지니어스 법안(GENIUS act)’이 통과된 바 있다. 스테이블 코인은 카드 결제보다 수수료율이 훨씬 낮고, 정산 기간도 따로 없어 국제 시장에서 새로운 주류로 자리잡을 것이란 관측이 나온다. 새로 발의된 법안은 스테이블 코인의 발행에서 유통, 준비자산, 이용자보호, 통화·외환 정책까지 총체적인 관리 체계를 규정한다. 스테이블 코인 발행인은 반드시 금융위원회의 사전 인가를 받아야 하며, ▲금융기관 또는 상법상 주식회사일 것 ▲자기자본 50억원 이상, ▲전산설비·전담인력 구비 등 자격 요건도 갖춰야 한다. 모든 스테이블 코인은 발행 잔액의 100% 이상을 유동성이 높은 실물자산으로 준비해야 하며, 현금·요구불예금·국채·지방채 등으로 구성해야 한다. 스테이블코인의 예금화와 그로 인한 금융시장 교란을 방지하기 위해 스테이블 코인에 대한 이자 지급은 금지된다. 암호 화폐 (가상 화폐) 테더를 시각화한 모습. [AFP=연합뉴스] 이용자 보호를 위한 장치도 법안에 포함됐다. 스테이블 코인 발행인이 파산하더라도 준비자산은 전적으로 이용자 상환에 우선 배정된다. 이 금액은 압류나 담보로도 활용할 수 없다. 상환청구 시 3영업일 이내 상환이 법적으로 의무화되고, 거래소는 상장 전후로 ▲발행인의 적격성, ▲공시 여부, ▲위법 사실 여부 등을 주기적으로 평가한다. 금융위원회는 시장질서 훼손이 우려될 경우 발행·유통·상환에 대한 긴급조치를 즉시 발동할 수 있고, 한국은행은 통화 정책 수행 목적에 따라 금융위에 자료 제출이나 공동검사를 요구하거나, 긴급조치 명령을 요청할 수 있다. 기획재정부도 외환정책 관점에서 유사한 권한을 행사할 수 있다. 안 의원은 “이번 법안은 민주당 미래경제성장전략위원회에서부터 논의하고 준비해 온 것으로 이 대통령의 대선 공약으로 제시됐다”며 “법안 마련을 위해 정부 부처 및 금융당국, 학계, 연구계 전문가들과 10차례 이상 심도 있는 토론과 의견 수렴을 거쳐 마련된 법안”이라고 말했다. 또 “스테이블 코인은 더는 실험이 아니라, 디지털 시대 국가경제의 혈관이자 통화 주권의 최전선”이라며 “디지털 달러를 앞세운 미국처럼, 우리도 원화 기반 스테이블 코인으로 새로운 금융 주권 시대를 열어야 할 때”라고 주장했다.","신혜연 기자","2025-07-28 12:17:21","https://n.news.naver.com/mnews/article/025/0003458110","2025-07-30 AM 11:26:51"
"100","정치","헤럴드경제","“李대통령, 최동석 문제 결단하라”…野 경질 요구 봇물","宋 “한 사람 지키려 전부 바보 만들지 말라” 韓 “늦기 전에 사퇴 시키는 게 정부에 좋다” 朱 “저급한 유튜버 수준 식견”…사퇴 촉구 최동석 인사혁신처장 [연합] [헤럴드경제=김진 기자] 국민의힘에서 과거 발언으로 논란이 된 최동석 인사혁신처장의 경질 요구가 쏟아졌다. 송언석 국민의힘 비상대책위원장 겸 원내대표는 28일 오전 국회에서 열린 비대위 회의에서 “최동석 인사혁신처장의 막말 비하 논란이 점입가경”이라며 “최동석 처장의 말에 의하면 지금 이재명 정부는 인사 대참사 정권”이라고 말했다. 송 위원장은 최 처장이 대통령실의 강훈식 비서실장과 우상호 정무수석, 윤호중 행정안전부 장관, 김경수 지방시대위원장을 과거 비판한 전적을 언급했다. 송 위원장은 “최 처장에 말에 따르면 문재인 정부 출신 장·차관들은 다 문재인 같은 인간들, 무능한 인간들”이라며 “그런데 지금 관세협상을 주도하는 구윤철 경제부총리, 조현 외교부 장관 모두 문재인 정부 시절 차관이었다”고 지적했다. 그는 “결국 무능한 인간들이 대한민국의 국운을 건 관세협상을 이끌고 있다는 말이 된다”며 “이런 모욕을 듣고도 대통령에게 최동석 처장의 경질을 건의하지 못하는 비서실내 고위직들 안타까운 마음을 금하기 어렵다”고 했다. 이어 “지금 대통령실에서 인사를 주무르는 최고 실세는 김현지 총무비서관, 김용채 인사비서관 등 성남 라인 비서관들이라는 항간의 이야기가 사실인가 보다”라고 했다. 그러면서 송 위원장은 “이재명 대통령에게 촉구한다. 최동석 한 사람을 지키려고 본인이 속한 당 사람들 전부 바보로 만들지 마시고 결단하시길 바란다”고 했다. 송 위원장은 “초대형 막말 유튜버에게 공직사회의 인사혁신을 맡긴다는 것이 국민 상식과 국민 눈높이와 전혀 맞지 않는다”고 했다. 이어 “이재명 정부가 인사검증 시스템을 재건하는 첫걸음을 인사혁신처장부터 제대로 다시 임명하는 것, 그리고 성남 라인 인사들이 독주하는 폐쇄적 밀실 인사 시스템을 전면 쇄신하는 것부터 시작해야 한다”고 했다. 한동훈 전 대표도 이날 페이스북에서 최 처장을 언급하며 “이 정도면 무속인에 가까운 것 아닌가”라고 비판했다. 한 전 대표는 최 처장이 작성한 것으로 알려진 ‘고위공직 적합성 진단 결과’ 점수표를 게시한 뒤 “‘한국 문명을 발전시킨 사람들’과 ‘한국 문명을 퇴보시킨 사람들’을 아래와 같은 기괴한 점수표로 계산했다”며 “인간을 대상으로 이렇게 점수 매기는 것 처음 본다”고 했다. 한 전 대표는 “이 분을 이 정부 인사실무총책으로 그대로 두면 앞으로 이 정부 인사 업무가 이 기괴한 점수표처럼 이 분 ‘촉’에 따라 비과학적으로 되는 게 아닌지 국민들께서 걱정하실 것”이라며 “더 늦기 전에 사퇴시켜야 한다. 그게 이 정부를 위해서도 좋다”고 했다. 당권주자인 초선의 주진우 의원도 이날 “한 인물이 이런 다양한 막말을 쏟아낸 것을 본 적이 없다”며 최 처장의 사퇴를 촉구했다. 주 의원은 “저급한 유튜버 수준의 식견으로 대한민국 공무원 인사를 총괄하는 것이 말이 되나”라며 “성폭력 2차 가해, 장애인 비하 표현, 욕설에 궤변에 이어 지난 대선 김문수 후보를 지지한 국민은 우매하고, 이준석 후보를 지지한 2030 청년은 지적 수준이 떨어지는 애들이라고 비하했다”고 했다. 주 의원은 “이재명 대통령은 하늘이 낸 사람이고 대장동은 천재성은 보여줬으며 형수 욕설은 국정원 공작이라고 한다”며 “아첨한 대가로 공직을 줄 수 없다. 더 이상 못 봐주겠다”고 했다.","김진 기자","2025-07-28 12:14:15","https://n.news.naver.com/mnews/article/016/0002506021","2025-07-30 AM 11:26:51"
"100","정치","중앙일보","신천지 연루설·이준석 압수수색…野 덮친 악재에 민주당 반색","김병기 더불어민주당 대표 직무대행 겸 원내대표가 28일 국회에서 열린 최고위원회의에서 모두발언을 하고 있다. 임현동 기자 ‘윤석열-신천지 관계설’, 이준석 개혁신당 대표 압수수색 등 야권 악재에 더불어민주당이 반색하는 분위기다. 김병기 민주당 대표 직무대행 겸 원내대표는 28일 최고위원회의에서 “윤석열 (전 대통령과) 신천지의 밀월이 세상에 드러나고 있다”며 “윤석열 검찰총장의 신천지 봐주기, 그 대가로 신천지 신도 10만명의 책임당원이 입당해 윤석열을 지원한 게 사실이라면 국민의힘은 민주정당이 아니다”라고 했다. 김 원내대표는 “민주주의 회복, 윤석열 심판, 내란종식과 관련한 문제이므로 합당한 조치를 취하겠다”며 “그 시작으로 민주파출소를 확대 개편해 6월 대선이 부정선거라는 가짜뉴스를 조직적으로 살포하는 내란 잔당을 반드시 뿌리 뽑겠다”고 했다. 지난 26일 홍준표 전 대구시장이 “신천지 신도 10여만 명이 국민의힘 책임당원으로 가입해 윤 전 대통령을 도왔다”고 주장해 부른 야당 내홍을 공격을 소재로 삼은 것이다. 황정아 민주당 대변인은 이날 논평에서 “특검의 철저한 수사를 촉구하며, 당시 경선에 참여했던 국민의힘 당직자 및 캠프 관계자 등의 관여와 방조 여부에 대한 엄정한 조사도 필요하다”고 했다. 박상혁 수석대변인도 이날 YTN 라디오 인터뷰에서 “단순히 의혹 제기뿐만 아니라, 여러 가지 실정법, 정당법이라든지, 강제 입당시키면 그런 위반 사유가 있는데 그런 문제에 대해서 조치가 취해져야 한다”고 했다. 김건희 여사의 각종 의혹을 수사하는 김건희 특검팀(특별검사 민중기)이 이준석 개혁신당 대표의 자택에 대한 압수수색에 들어간 28일 서울 노원구 이 대표의 자택에 압수장소 봉인지가 붙어있다. 뉴스1 국민의힘 인사들에 대한 특검팀의 압수수색 행렬도 민주당은 정치적 호재로 받아들이고 있다. 28일 김건희 특검팀은 2022년 대선 당시 국민의힘 대표였던 이준석 개혁신당 대표의 자택을 압수수색했다. 전날 특검팀은 윤상현 국민의힘 의원은 피의자 신분으로 15시간 가까이 조사를 진행했다. 김용민 민주당 의원은 이날 페이스북에 이 대표의 압수수색 기사를 공유하며 “특검의 체포동의안이 오면 국회는 신속하게 동의해줄 것”이라고 썼다. 민주당 대표 선거에 출마한 박찬대 의원은 김 의원 글을 공유하며 “김용민 수석과 함께 합니다”라고 적었다.","강보현 기자","2025-07-28 12:09:59","https://n.news.naver.com/mnews/article/025/0003458109","2025-07-30 AM 11:26:51"
