"category_id","category_name","press","title","content","reporter","date","link","timestamp"
"100","정치","문화일보","“세 딸이 서울 살아서” 국토부장관 후보자, 전세금 6.5억 현금 지원","“서민에 비해 혜택 받았다 생각” “대장동 사업, 공공이익 환수 모범사례” 김윤덕 국토교통부 장관 후보자가 29일 국회 국토교통위원회에서 열린 인사청문회에서 선서하고 있다. 연합뉴스 김윤덕 국토교통부 장관 후보자는 29일 장녀의 아파트 전세보증금 6억5000만 원을 현금으로 지원한 것과 관련, “국회의원 딸이기 때문에 서민에 비해 일정한 혜택을 보고 있는 게 아니냐는 질문에는 저는 그렇다고 말할 수밖에 없을 것 같다”고 밝혔다. 김 후보자는 이날 오전 국회 국토교통위원회에서 열린 인사청문회에서 배준영 국민의힘 의원이 “본인 자녀에게 수억원대 전셋값을 대주면서 서민과 실수요자 대출을 규제한다면 누가 공감하겠느냐”고 묻자 이같이 답하며 “그런 점에 대해서 겸허한 생각을 하고 있다”고 했다. 김 후보자는 이어 “딸이 취업을 해 독립하겠다고 했을 때 둘째 딸은 취업을 준비하고 있었고 막내딸은 휴학하고 있는 상태”라며 “세 딸이 서울에서 살게 될 형편이었다”고 해명했다. 이에 배 의원은 “서울에 살아야 될 형편이 있는 사람들은 후보자 딸뿐만 아니라 다 마찬가지”라며 “그런 정도의 해명으로는 젊은이들의 공감을 얻기 힘들다”고 말했다. 김 후보자는 또한 이상경 1차관이 교수 시절 ‘대장동 사건은 공공이익 환수의 모범사례’라고 평가한 것에 동의하느냐는 질문에 “대체적으로 동의하고 있다”고 답했다.","김무연 기자","2025-07-29 19:32:14","https://n.news.naver.com/mnews/article/021/0002726072","2025-07-30 PM 12:32:23"
"100","정치","한국일보","'자진 사퇴' 강준욱 ""계엄 옹호한 적 없다… 언론이 잘못 만든 프레임","유튜브 '정규재TV' 출연해 본인 발언 논란 해명 ""계엄 비판한 표현인데, 대통령실 입장만 인용"" ""서울서부지법 사태와 5·18 비교는 잘못"" 사과 ""내가 뉴라이트? 日과 토론·역사 합의 바란 것"" 29일 유튜브 '정규재tv 시즌3'에 게시된 영상에서 강준욱(왼쪽) 전 대통령실 국민통합비서관이 자신을 둘러싼 '계엄 옹호 논란' 등과 관련해 정규재 전 한국경제 주필과 대화하고 있다. 유튜브 '정규재tv 시즌3' 영상 캡처 윤석열 전 대통령 파면 이전 '불법 계엄 옹호'로 해석될 법한 입장을 취한 사실이 드러나 임명 7일 만에 자진 사퇴한 강준욱 전 대통령실 국민통합비서관이 '작심 해명'을 내놨다. 그러나 '내 뜻을 대중이 잘못 이해한 것'이라는 취지로 본인 입장을 변호하는 데 급급한 모습이었다. 자신의 발언으로 불거진 논란과 관련해 잘못을 인정하거나 사과했다기보다는, '변명' 또는 '항변'에 가까웠다는 얘기다. 강 전 비서관은 28일 보수 논객인 정규재 전 한국경제 주필이 운영하는 유튜브 '정규재TV 시즌3'에 출연해 비서관 임명 후 제기된 각종 논란 등에 대한 생각을 구체적으로 풀어냈다. 앞서 정 전 주필은 언론을 통해 자신이 이재명 대통령에게 강 전 비서관을 추천했다고 밝힌 바 있다. 2018년부터 동국대 정보통신학과 교수로 재직해 온 강 전 비서관은 이재명 정부 들어 대통령실 국민통합비서관에 발탁됐지만 '계엄 옹호' 논란 등에 휘말린 끝에 지난 22일 스스로 자리에서 물러났다. ""계엄 선포는 비민주적, 잘못된 저항"" 강 전 비서관은 이날 ""제 진심이 중간에 알려지는 것과 다르다 보니까 '오해하고 계신 분들'과 '이해를 못하는 분들'이 많다""며 운을 뗐다. 지난 3월 출간된 저서 '야만의 민주주의'에 담겨 있는 표현, 곧 ""(윤석열 전) 대통령의 비상계엄은 야당의 민주적 폭거에 항거한 비민주적 방식의 저항""이라는 부분을 '계엄 옹호'로 해석한 건 '오해'이자 '이해력 부족'에서 기인한 결과라는 뜻이었다. '계엄 옹호' 논란과 관련, 강 전 비서관은 ""윤 전 대통령에 대해 우호적 생각을 갖고 있었던 건 맞지만, 계엄(령 선포)이라는 행동에 대해서 옹호 발언을 한 적은 없다""고 밝혔다. 문제가 된 해당 문장은 ""오히려 계엄을 비판하기 위해 적은 표현""이라고도 주장했다. 그는 ""'민주적 폭거'라는 표현을 쓴 이유는, 민주주의이기 때문에 다수가 그런 행동을 할 수 있고, 이게 민주주의의 문제라는 걸 지적한 것이었다""고 설명했다. 이어 ""계엄 선포는 전혀 민주적이지 못했다. 그래서 '비민주적 방식의 저항'이라고 쓴 건 '잘못된 저항'이라는 의미""라고 덧붙였다. 그런데도 언론이 이런 내용을 보도하진 않고, 대통령실 입장만 그대로 받아 적은 탓에 '계엄 옹호' 프레임이 생겼다는 게 강 전 비서관 입장이다. 서울서부지법 폭력 사태를 5·18민주화운동과 비교해 거센 비판을 받았던 데 대해선 어정쩡한 사과를 남겼다. 같은 저서에서 강 전 비서관은 ""사법부에 저항해 유리창을 깨고 법원에 난입한 것이 폭도이고 전원 구속될 일이라면, 5·18은 버스로 공권력을 뭉개고 총 들고 싸운 일이므로 폭도라는 말로도 모자란다""고 적었다. 이에 대해 그는 이날 ""서부지법 폭도들을 막 한쪽으로만 폭도라고 몰아가는 게 너무 안타까워서 '5·18은 폭도 아니냐'고 표현한 것""이라고 해명한 뒤, ""지금 생각해도 그런 비유는 해선 안 됐다는 생각이 든다. (해당 표현이) 적절하지 않다고 생각하면 그건 제가 사과를 해야 될 것 같다""고 말했다. 반쪽짜리 사과였다. 2020년 7월 서울 종로구 옛 일본대사관 앞에서 뉴라이트 인사이자 '반일종족주의' 저자인 이영훈(가운데) 전 서울대 교수와 이우연(왼쪽) 낙성대경제연구소 연구위원, 류석춘 전 연세대 교수를 규탄하는 퍼포먼스가 펼쳐지고 있다. 뉴스1 ""친일파, 다 죽고 없다""면서 '뉴라이트' 부인 '뉴라이트 역사관'이라는 일각의 지적에도 일단 선을 그었다. 그러나 친일 성향 인사들이 평소 자신들 주장을 옹호하는 논리와 크게 다를 바 없었다. 강 전 비서관은 사퇴 전 과거 페이스북에 ""나는 식민지근대화론을 믿으며 강제징용이란 것을 믿지 않는다""고 적은 사실이 알려지는 바람에 '친일 논란'에까지 휩싸이며 더욱 더 궁지로 내몰렸다. 실제로 뉴라이트 역사관과 차별화되는 지점을 딱히 설명하지도 않았다. 강 전 비서관은 ""이영훈 전 서울대 경제학과 교수와 낙성대경제연구소 연구자분의 이야기를 들어봤다. 이후 일반 국민들이 일본에 대해 갖는 생각들과 혹시 다른 부분이 있다면 뭐가 옳은지 서로 토론하면서 좀 더 좋은 방향으로 나아가야 한다고 생각했다""고 밝혔다. 이 전 교수와 낙성대경제연구소 소속 일부 학자들은 식민지근대화론을 주창하는 뉴라이트계 인사들로 꼽힌다. 특히 강 전 비서관은 ""사실 친일파는 다 죽고 없지 않나. 옛날에 다 죽고 없다""는 엉뚱한 주장도 펼쳤다. 그러면서 ""(한국이) 일본과 사이좋게 지내야 하니 '갈등적 요소를 자꾸 이어가서 되겠나. 서로 토론해서 역사 문제를 합의하면 좋겠다'는 취지의 글을 적은 것뿐""이라고 강조했다. ""갑자기 내가 역사 인식이 잘못된 사람으로 몰렸다. 내가 이렇게 생각하는 것까지 비난받아야 하는 부분인지 모르겠다""는 게 그가 이날 털어놓은 솔직한 심경이었다.","오세운 기자","2025-07-29 19:31:11","https://n.news.naver.com/mnews/article/469/0000878807","2025-07-30 PM 12:32:23"
"100","정치","연합뉴스","김윤덕 청문회…'재산신고 누락·이해충돌' 與野 공방(종합)","국힘 ""자녀 전세금 누락, 공직자윤리법 저촉""…민주 ""증여 회피 아냐"" 금전거래 건설사의 관급사업 수주 논란·전문성 공방도 김윤덕 국토교통부 장관 후보자 인사청문회 (서울=연합뉴스) 황광모 기자 = 김윤덕 국토교통부 장관 후보자가 29일 국회 국토교통위원회에서 열린 인사청문회에서 의원 질의에 답하고 있다. 2025.7.29 hkmpooh@yna.co.kr (서울=연합뉴스) 홍국기 오규진 기자 = 여야는 29일 국회 국토교통위원회의 김윤덕 국토교통부 장관 후보자 인사청문회에서 재산 신고 누락 의혹, 이해충돌 논란을 두고 공방을 벌였다. 국민의힘은 김 후보자가 재산 신고 당시 자녀에게 아파트 전세금을 대여하는 과정에서 발생한 채권과 채무를 제대로 기록하지 않았다며 공세를 폈다. 국민의힘 김종양 의원은 2022년 김 후보자가 장녀에게 약 4억5천만원을 아파트 전세금 명목으로 무이자 대여한 것을 두고 ""계약서도 없었고, 증여든 대여든 재산 신고를 해야 된다""며 ""누락했을 경우 공직자윤리법에 저촉된다는 것도 잘 알고 있지 않나""라고 지적했다. 이에 김 후보자는 ""재산 신고가 부실했던 점은 저의 불찰""이라고 사과했다. 더불어민주당은 전세금 대여 논란에 증여를 회피하기 위한 탈법은 아니라며 김 후보자를 엄호했다. 민주당 한준호 의원은 ""4억5천만원에 대한 대여는 적정이율 4.6%를 적용해도 4천만원 정도, 10년간 5천만원 미만으로 비과세 한도 이내""라며 ""배우자가 자녀에게 한 1억8천만원도 연간 증여재산가액이 1천만원 미만이라 증여로 볼 수 없다""고 강조했다. 민주당 의원 출신인 김 후보자(전북 전주갑)가 총선 승리 후 전주 기반의 건설업체(우진건설)가 지역구 관급 공사를 따낸 것을 놓고도 여야는 대립했다. 김 후보자는 19대 국회의원 당선 직후인 2012년 이 업체로부터 5천만원을 빌렸다고 신고한 바 있다. 국민의힘 김희정 의원은 ""(우진건설은) 당선되기 전 관급공사를 맡은 적이 한 번도 없었지만, 후보자와 몇 개월에 걸쳐 차용증도, 이자도 없이 금전 거래한 이후 그 지역의 관급공사를 쫙쫙 맡아서 간다""며 ""누가 봐도 명쾌한 상황은 아니다""라고 꼬집었다. 이에 맞서 민주당 문진석 의원은 ""2013년 이전에는 (관급 공사가) 1건도 없다고 그랬는데, 찾아보니까 2건 있고 (각각) 8억원, 1억원 상당""이라며 ""전자입찰을 통해서 계약자가 선정되는 과정에서 수의계약은 불가능한 사안""이라고 반박했다. 국민의힘은 2006년 김 후보자가 친인척이 운영하는 건설사로부터 전주 덕진구의 한 아파트 분양권을 받은 것을 두고도 이해충돌 의혹을 제기했는데, 민주당 의원들은 ""건설사가 어려우면 업자들에게 떠넘기기식 강매도 있어 왔다""며 엄호했다. 청문회에서 인사말 하는 김윤덕 국토교통부 장관 후보자 (서울=연합뉴스) 황광모 기자 = 김윤덕 국토교통부 장관 후보자가 29일 국회 국토교통위원회에서 열린 인사청문회에서 인사말을 하고 있다. 2025.7.29 hkmpooh@yna.co.kr 여야는 김 후보자의 전문성 문제를 놓고도 충돌했다. 국민의힘 배준영 의원은 '지난해 서울의 주택 착공(공급) 실적이 얼마나 되느냐'는 질문에 김 후보자가 답변하지 못하자 ""전문성에 문제가 보인다""고 지적했다. 같은 당 김은혜 의원은 강남권과 마포·용산·성동구의 새 아파트 국민평형(전용면적 84㎡) 평균 가격, 청년의 디딤돌·버팀목 대출 상한액 등과 관련한 물음에 김 후보자가 ""모르겠다""고 하자 ""이 정도는 좀 알고 왔으면 한다""고 했다. 반면 민주당 이연희 의원은 ""정치인 출신 장관이 부처 장악력을 높이면서 많은 성과를 냈다는 게 공통된 평가""라며 ""그런 면에서 3선 국회의원을 하고 제1당의 사무총장을 역임한 강력한 리더십이 국토부 장관 지명 배경이라고 생각한다""고 강조했다. acdc@yna.co.kr","","2025-07-29 19:16:36","https://n.news.naver.com/mnews/article/001/0015537118","2025-07-30 PM 12:32:23"
"100","정치","한겨레","이 대통령 “결론만” “직 거십시오”…최초 생중계된 92분 국무회의 어땠나","이재명 대통령이 29일 서울 용산 대통령실 청사에서 열린 국무회의에서 발언하고 있다. 연합뉴스 “사람 목숨 지키는 특공대라고 생각하고 정말로 철저하게 단속해야 됩니다.” (이재명 대통령) “직을 걸겠습니다.” (김영훈 고용노동부 장관) “진짜로요. 상당 기간 지나도 산재가 안 줄어들면 진짜 직을 거십시오.”(이 대통령) “그렇게 하겠습니다.”(김 장관) 29일 열린 국무회의는 역대 정부 사상 처음으로 실시간 생중계됐다. 이 대통령의 머리발언과 중대재해 근절을 위한 부처별 대책 보고, 이 대통령과 국무위원들 간 토론 장면, 산사태 관련 논의 등이 92분 동안 여과 없이 공개됐다. ‘산업안전 조처를 지키지 않는 사업장에 대한 제재가 무엇인지’를 묻는 질문에 국무위원들이 답을 하지 못하자 이 대통령이 “(국무회의 참석으로) 전화기를 뺏겼죠. 누가 나가서 확인 좀 해주세요”라고 말하는 장면 등이 편집 없이 방송을 탔다. ‘막말’ 논란으로 문제가 된 최동석 인사혁신처장이 발언하는 모습도 공개됐다. 발언권을 자청한 최 처장은 자신의 과거 발언을 둘러싼 논란을 두고 “요새 유명해지고 있어서 대단히 죄송스럽다”고 말했다. 그는 산업재해 근절을 위해 안전 규정을 준수하지 않는 사업장에 제재를 부과해야 한다는 이 대통령 주장에 동의한다면서도 “그것으로 충분하지 않다”고 말했다. 최 처장이 “인간의 존엄성은 건드릴 수 없다는 철학적 배경 없이 규정만 가지고는 문제를 근본적으로 해결할 수 없다”는 등 다소 핵심에서 벗어난 얘기를 하자, 이 대통령은 발언을 중간에 끊으며 “그건 충분히 이해하겠고, 결론만, 요지만 말해보시라”고 지적하기도 했다. 이 대통령은 이 자리에서 국방부 산하 국방홍보원이 발행하는 국방일보가 지난 28일치 지면 안규백 국방부 장관의 취임사 보도에서 12·3 내란 사태 관련 메시지를 누락한 것을 언급하면서 안 장관에게 “기강을 잘 잡으셔야 될 것 같다. 심각하다”고 말하기도 했다. 윤석열 정권에서 임명된 채일 국방홍보원장이 12·3 내란을 정당화하는 윤 전 대통령의 주장을 보도하라고 압력을 행사한 의혹 등을 상기시킨 것이다. 이날 국무회의 생중계는 “중대재해 근절 대책은 국민 모두에 알려야 한다”는 이 대통령의 지시로 이뤄졌다. 이규연 대통령실 홍보소통수석은 “심층토의 생중계는 1회성 조치지만 여러 상황을 고려해 공개 횟수나 범위를 확대해나갈 생각”이라고 했다.","","2025-07-29 19:16:11","https://n.news.naver.com/mnews/article/028/0002758564","2025-07-30 PM 12:32:23"
"100","정치","중앙일보","국무회의 생중계한 李 “산재는 미필적고의 살인…산재 기업 주가 폭락”","“살인”, “주가 폭락”, “징벌적 손해배상”…. 이재명 대통령이 29일 서울 용산 대통령실에서 주재한 국무회의에서 산업재해 사망 사고 발생 기업의 책임을 물으며 나열한 표현이다. 이날 국무회의는 이례적으로 토론 과정까지 KTV와 유튜브를 통해 생중계됐고, 거론된 기업은 7시간 만에 사과 담화문을 발표했다. 이 대통령은 “포스코이앤씨라는 회사에서 올해 들어 다섯 번째(실제론 네 번째) 산재 사망 사고가 발생했다고 한다”며 “이게 있을 수 있는 일이냐”고 지적했다. 전날 포스코이앤씨가 시공하는 경남 함양울산고속도로 의령나들목 공사 현장에서 60대 노동자가 천공기(지반을 뚫는 건설기계)에 끼여 숨진 걸 지목한 것이다. 포스코이앤씨 사업장에선 지난 1월과 4월에도 총 3건의 추락·붕괴 사고가 발생해 모두 3명이 숨졌다. 이 대통령은 “똑같은 장소에서 똑같은 사고가 발생해, 똑같은 방식으로 특히 사망하는 것은 충분히 예상할 수 있는 일”이라며 “예상할 수 있는 일들을 방어하지 않고 사고가 나는 것은 결국 죽음을 용인하는 것이다. 아주 심하게 얘기하면 법률적 용어로 ‘미필적 고의에 의한 살인’ 아니냐”고 말했다. 이재명 대통령이 29일 서울 용산 대통령실 청사에서 열린 국무회의에서 산업재해 관련 발언을 하고 있다. 대통령실사진기자단 이 대통령과 국무위원들은 1시간 30분가량 산재 대책 토론을 벌였다. 이 대통령이 진단한 산재 원인은 “돈”(기업의 비용 절감)이었고, 해법도 “돈”(경제적 불이익)이었다. 이 대통령은 “산업 안전에 관한 기준들을 다 법에 정해놨다. 예를 들면 폐쇄 공간에 들어갈 때는 꼭 뭘 해야 된다는 온갖 게 다 있는데 안 지켜서 사고가 난다”며 “안 지킨 이유는 거의 대부분이 돈이 드니까”라고 지적했다. 김영옥 기자 정성호 법무부 장관이 지난해 6월 23명이 숨진 아리셀 공장 화재 사고에 대해 “대표에게 20년을 구형했다”고 보고하자, 이 대통령은 “(사망자 1인당 형량이) 교통사고 처리보다 별로 세지 않다”고 지적했다. 이 대통령은 “형사처벌은 아주 결정적인 수단이 못 되는 것 같다”며 “똑같은 현장에서, 똑같은 원인으로, 똑같은 방식으로 (사고가 발생하는 건) 고의에 가까운데 ‘징벌 배상’ 도입을 고려해볼 필요가 있다”고 말했다. 징벌적 손해배상제는 특정한 불법행위에 대해 실제 손해액을 초과하는 배상액을 물리는 제도다. 이 대통령은 김영훈 고용노동부 장관에게 “산재 사고가 안 줄어들면 진짜 직을 걸라”고 했고, 김 장관은 “그렇게 하겠다”고 답했다. 정성호 법무부 장관이 29일 서울 용산 대통령실 청사에서 이재명 대통령 주재로 열린 국무회의에서 국무위원들과 중대재해 근절대책 토론을 하며 발언하고 있다. 연합뉴스 산재 발생 기업에 대한 금융 규제도 언급됐다. 김병환 금융위원장이 상장기업 ESG(환경·사회·지배구조) 평가 시 중대재해 발생 이력을 더 엄격히 반영하는 방안을 보고하자, 이 대통령은 “산재 사망 사고가 반복적으로, 상습적으로 발생한다면 아예 그걸(ESG 평가를) 여러 차례 공시해 투자를 안 하게 되면 주가가 폭락하게 (될 것)”이라고 말했다. 이날 이 대통령의 발언을 두고 정치권과 재계에선 다양한 해석이 나왔다. 여권 핵심 관계자는 “이 대통령은 성남시장·경기지사 때부터 이런 방법을 사용했다”며 “강력한 처벌을 예고함으로써 문제를 해결하는 방법”이라고 설명했다. 반대로 재계에선 ‘기업 군기 잡기’로 바라봤다. 특히 노란봉투법과 상법의 개정을 두고 기업이 불만을 제기한 직후라는 시점을 주목했다. 재계 관계자는 “기업 입장에서는 언제 자신들이 지목될까 두려워하는 분위기”라며 “이재명 정부 출범 이후 어느 정도 예상한 부분”이라고 했다. 이 대통령이 지목한 포스코이앤씨의 정희민 대표이사는 이날 오후 5시쯤 인천 송도 사옥에서 기자회견을 열고 “사죄의 말씀을 드린다. 안전이 확실하게 확인되기 전까지는 무기한 작업을 중지토록 했다”며 허리를 숙였다. 정희민 포스코이앤씨 사장이 29일 인천 송도 본사에서 연이은 현장 사망사고와 관련한 담화문 발표에 앞서 관계자들과 사과 인사하고 있다. 이재명 대통령은 이날 오전 국무회의 모두발언을 통해 올해 포스코이앤씨 현장에서 연이은 산업재해 사고로 노동자들이 숨진 사실을 언급하며 질타했다. 연합뉴스 이날 국무회의에선 상호관세 유예 시한(다음 달 1일)을 앞두고 한·미 통상 협상이 난항지만 관련 이슈는 한번도 언급되지 않았다. 정치권에선 이 대통령의 산재 관련 발언이 통상 협상에 대한 관심을 돌리기 위한 것이라는 관측도 나왔지만, 대통령실 관계자는 “대통령이 직접 나서지 않는 것도 전략적 판단”이라며 “마무리 단계에 필요하면 직접 나설 것”이라고 말했다. 한편 이 대통령은 국무회의에 처음 참석한 안규백 국방부 장관을 향해 “(국방일보가) 국방부 장관이 한 취임사를 편집해서 내란 언급은 싹 빼버렸다 그러더라”며 “기강을 잘 잡으셔야 할 것 같다. 심각하다”고 말했다.","윤성민 기자","2025-07-29 19:10:37","https://n.news.naver.com/mnews/article/025/0003458541","2025-07-30 PM 12:32:23"
