"category_id","category_name","press","title","content","reporter","date","link","timestamp"
"100","2025-07-30 PM 12:34:51","중앙일보","대법 넘어간 포항지진 손배소…'마지막 결투' 벼르는 포항시","이강덕 포항시장을 비롯한 지역 정치권 인사들이 지난달 11일 오전 서울 서초구 대법원을 찾아 경북 포항지진 정신적 손해배상 소송의 대법원 심리를 앞두고 공정한 판결을 촉구하며 구호를 외치고 있다. 뉴스1 경북 포항지진으로 발생한 피해에 대한 손해배상을 청구하는 소송이 결국 대법원으로 넘어간 가운데 포항시가 ‘판결 뒤집기’를 위한 만반의 준비를 하고 있다. 앞서 지난 5월 12일 대구고법은 지진 피해 포항시민들이 정부를 상대로 제기한 포항 지진 손해배상 청구소송 항소심에서 원고 패소 판결을 내렸다. ━ 항소심 패소 후 변호인단 강화 나서 소송을 주도한 포항지진 범시민대책본부(이하 범대본)은 항소심 패소 이후 상고장을 대법원에 제출, 지난 6월 11일 대법원에 사건이 접수됐다. 그로부터 약 50일이 지난 시점 포항시는 포항시민 전체 인구와 맞먹는 약 49만여 명이 소송에 참여해 사안이 중대하다고 판단해 다양한 대응책 마련에 집중하고 있다. 최근에는 대법관 출신 김창석 변호사(법무법인 로고스 대표변호사)를 소송대리인으로 추가 선임했다. 상고심 승소를 위해 기존 변호인단을 강화하는 것이 필요하다는 판단에서다. 경북 포항시가 포항 촉발지진 손해배상 상고심 변호인단에 대법관 출신 김창석 법무법인 로고스 대표변호사를 추가 선임했다. 사진 포항시 김 변호사를 선임한 것은 지난 8일 개최된 ‘포항시 공익소송심의위원회’의 심의를 통해 결정됐다. 포항시가 변호사 비용을 지원할 수 있도록 최근 제정된 ‘포항시 공익소송비용에 관한 조례’의 첫 적용 사례다. 김 변호사는 법관 시절 행정·민사 분야에서 폭넓은 식견과 공정한 판단으로 신뢰를 받아온 인물이다. 2018년 대법관 퇴임 이후에는 고려대 법학전문대학원 석좌교수로 재직했으며, 현재는 법무법인 로고스의 대표변호사로 다양한 공공사건과 사회 현안 대응에 참여하고 있다. ━ 포항시, 대법관 출신 변호사에 기대 이번 상고심에서는 기존 소송대리인인 포항지진 공동소송단(대표 공봉학 변호사)과의 협업은 물론 전문가 자문위원단과 함께 공동 대응 체제를 구축해 사실관계와 법리 양 측면에서 균형 잡힌 대응을 펼쳐나갈 계획이다. 포항시는 대법원 심리의 특성상 법리 중심의 고도의 대응이 요구되는 점을 감안해 법조계 최고 수준의 경력을 갖춘 대법관 출신 김 변호사의 참여가 큰 역할을 할 것으로 기대하고 있다. 이와 관련 포항시는 상고심을 앞두고 공동소송단과 지역 변호사회 간담회, 법률·지질 전문가 자문회의, 대시민 토론회 등을 통해 대응 논리 개발과 사회적 공감대 형성을 진행해 왔다. 지난달 12일 경북 포항시청 대회의실에서 열린 포항지진 대시민 토론회에 앞서 참석자들이 대구고법 항소심 기각 판결 항의하는 구호를 외치고 있다. 뉴스1 이강덕 포항시장은 “이번 대응은 단순한 법적 절차가 아니라 시민의 정당한 권리 회복과 정의 실현을 위한 중요한 전환점”이라며 “포항시는 상고심이 정의로운 판결로 이어질 수 있도록 최선을 다하겠다”고 말했다. 포항시와 함께 지역 시민단체 역시 상고심에서 판결을 뒤집기 위한 노력을 하고 있다. 항소심 판결까지 나온 민사1부 재판과 별개로 대구고법 민사3부에서 포항시민 1만7000여 명이 정부와 포스코 등 기관·업체를 상대로 제기한 손해배상 소송 심리가 진행 중인데, 민사3부 재판 법정에서 나온 정부측 과실 증거들을 3심 재판부에 제출할 계획이다. ━ 시민단체도 대법 ‘판결 뒤집기’ 노력 범대본은 항소심 판결 직후 판결의 오류가 있음을 조목조목 짚는 자료를 내기도 했다. 재판부가 감사원과 정부합동 진상조사위원회의 발표내용을 법적 책임 판단에 반영하지 않았다는 점, 작업자 과실과 지진과의 인과관계 기준을 지나치게 엄격하게 적용했다는 점 등을 지적했다. 한편 앞서 지난 5월 12일 대구고법 민사1부는 지진 피해 포항시민 49만 9881명이 정부를 상대로 제기한 포항 지진 손해배상 청구소송 항소심에서 원고 패소 판결을 내렸다. 1심에서는 포항 지진 피해를 겪은 주민 1인당 200만~300만원씩 배상하라는 판결을 내렸지만, 항소심에서 배상금은 ‘0원’으로 완전히 뒤집혔다. 경북 포항지진 정신적 손해배상 소송의 항소심 패소 판결과 관련해 포항지진 범시민대책본부(범대본, 의장 모성은)가 지난달 13일 포항 육거리 인근 중앙상가에서 개최한 시민궐기대회에서 시민들이 항의 손팻말을 들고 있다. 연합뉴스 항소심 재판부는 “포항에서 발생한 지진이 물을 주입한 데 따른 촉발지진인지 여부, 지진이 물 주입 때문에 발생했더라도 이것이 관련 기관의 고의 또는 과실에서 비롯한 것인지가 이번 소송의 쟁점”이라며 “재판부 검토 결과 촉발 지진이라는 점은 인정되나 과실을 입증할 만한 내용이 부족하다”고 설명했다. 그러면서 “감사원과 진상조사위가 지적한 업무 미흡 사항은 민사상 포항지진 촉발과 관련한 과실에 해당하지 않고, 업무 미흡으로 지진이 촉발됐다고 보기도 어렵다”며 “지열발전 사업 관련 기관의 과실과 포항지진 촉발과의 인과관계를 인정할 수 없다”고 판결했다.","김정석 기자","2025-07-30 10:49:55","https://n.news.naver.com/mnews/article/025/0003458713","2025-07-30 PM 12:35:10"
"100","2025-07-30 PM 12:34:51","연합뉴스","故 오요안나 사태에 노동부, KBS·SBS·종편 등 기획감독 착수","방송업계 인력 운영 방식과 노동 여건 근본 개선 방침 고 오요안나씨 어머니의 눈물 (서울=연합뉴스) 박동주 기자 = 18일 서울 여의도 국회에서 고 오요안나 MBC 기상캐스터 사망 사건 관련 긴급 현안 질의 등을 위해 열린 과학기술정보방송통신위원회 전체회의에서 고 오요안나씨의 어머니인 장연미 씨가 눈물을 흘리고 있다. 2025.4.18 pdj6635@yna.co.kr (서울=연합뉴스) 김은경 기자 = 고용노동부가 고(故) 오요안나씨 사태 재발 방지를 위해 KBS와 SBS 등 지상파와 종합편성채널(종편) 등 주요 방송사에 대한 기획감독에 착수한다. 노동부는 서울고용노동청·서울청 서부지청 및 남부지청의 감독관 20여 명으로 전담 감독팀을 구성해 KBS·SBS 등 지상파 방송사와 채널A·JTBC·TV조선·MBN 등 종편을 대상으로 기획감독에 착수한다고 30일 밝혔다. MBC는 앞서 지난 9월 숨진 기상캐스터 오요안나씨 사태를 계기로 특별근로감독을 실시한 바 있어 이번 기획감독에서 제외됐다. 노동당국은 이번 감독에서 프리랜서들이 법적으로 근로자에 해당하는지 판단하고 직장 내 괴롭힘·성희롱 등 조직문화 실태를 파악하는 데 집중할 계획이다. 방송사에 대해서는 그동안 여러 차례 근로감독이 이뤄졌지만, 프리랜서 등 다양한 형태의 고용 인력들이 노동관계법상 보호의 사각지대에 놓여있다는 지적이 계속돼왔다. 그런 와중에 오요안나씨 사태가 발생하면서 노동부는 방송사들을 대상으로 특별근로감독에 준하는 기획감독에 나서겠다고 약속한 바 있다. 노동당국은 이날부터 KBS와 SBS의 인력 운영 실태와 조직문화 전반을 살펴본다 종편의 경우 KBS와 SBS 감독 기간에는 자율 개선을 독려하고, 지상파 감독 종료 후 즉시 감독에 착수할 계획이다. 노동부는 이번 감독을 통해 방송업계 인력 운영 방식과 노동 여건을 근본적으로 개선하는 계기를 만들어간다는 계획이다. 감독 종료 후에는 결과를 지역 방송사 등 전국 모든 방송사와 외주기업 등에 적극적으로 확산해 방송업계 전반에서 노동 권익이 제대로 보호될 수 있도록 노력할 예정이다. 김영훈 노동부 장관은 ""이번 기획감독이 방송업계에 만연한 인력 운영 방식의 뿌리 깊은 문제를 바꾸는 데 더해 조직문화를 완전히 탈바꿈하는 계기가 될 수 있도록 엄정하고 철저하게 실시하겠다""고 밝혔다. bookmania@yna.co.kr","김은경 기자","2025-07-30 10:47:35","https://n.news.naver.com/mnews/article/001/0015537947","2025-07-30 PM 12:35:10"
"100","2025-07-30 PM 12:34:51","헤럴드경제","“건강이 매우 안좋다” 尹, 김건희특검 2차 소환도 안 나왔다 [세상&]","尹, 결국 특검 2차 소환도 불응 특검, 尹 강제수사 카드 만지작 변호인 “알려진 것보다 건강악화 심해” 윤석열 전 대통령이 9일 오후 서울 서초구 서울중앙지방법원에서 열린 구속 전 피의자심문(영장실질심사)을 받기 위해 출석하고 있다. [사진공동취재단] [헤럴드경제=이용경·김도윤 기자] 건강 이상 증세를 호소하는 윤석열 전 대통령이 30일 예정된 특검 2차 소환 조사 요구에도 불응했다. 전날 소환통보 횟수와 무관하게 강제수사 가능성을 시사한 특검이 어떤 대응을 할지 주목된다. 특검은 이날 오전 언론 공지를 통해 “윤 전 대통령에게 오늘 오전 10시에 출석하도록 통보했으나 별다른 설명없이 출석하지 않았다”고 밝혔다. 변호인 선임계도 특검에 제출되지 않은 상황인 것으로 확인됐다. 윤 전 대통령 측 변호인 유정화 변호사는 이날 헤럴드경제와 통화에서 “(전날과 같이) 건강상 이유”라며 불출석 이유를 전했다. 유 변호사는 “전체적으로 걸음걸이도 좋지 않고 오랫동안 조사받을 수도 없는 상황”이라며 “어제 ‘실명 위기 소견서가 있다’는 관련 기사가 떴는데, 전체적으로 당뇨 합병증처럼 건강이 매우 안 좋다”고 말했다. 이어서 유 변호사는 “실제로 윤 전 대통령 접견을 가면 안색이 확연히 안 좋아지고 있는 게 느껴진다”라며 “특검에서는 항상 (윤 전 대통령의) 건강이 괜찮다고 말하는데, 그건 윤 전 대통령이 들어갈 때 체크한 건강 상태다. 현장에서의 건강 상태는 전혀 고려하지 않고 있어 답답한 부분”이라고 설명했다. 그러면서 “특검 측이 계속 그렇게 밀고 나가니 무슨 해명을 해도 아무런 소용이 없다는 것을 모두가 잘 알고 있는 그런 상황”이라고 덧붙였다. 앞서 특검은 전날 체포영장 청구를 비롯한 강제수사를 언급하며 윤 전 대통령의 출석을 압박했다. 하지만 윤 전 대통령 측은 건강 문제로 출석하기 어렵다는 입장을 고수했다. 특검은 윤 전 대통령이 출석하지 않을 경우 강제수사에 나설 수 있다고 밝힌 상황이다. 문홍주 특검보는 전날 열린 정례 브리핑에서 “만일 재소환마저 응하지 않는다면 체포영장 청구 등 강제수사도 염두에 두고 있다”고 말했다. 수사기관은 관례상 피의자에게 3차례 출석을 요구하고 정당한 사유 없이 피의자가 이에 응하지 않으면 체포영장 청구를 검토한다. 다만 특검은 출석에 불응할 우려가 크다고 판단되면 소환통보 횟수와 무관하게 강제수사가 가능하다는 입장이다. 한편 특검은 윤 전 대통령에 대한 방문 조사 계획은 없다고 밝혔다. 향후 체포영장이 발부될 경우에는 특검보와 검사를 1명씩 구치소에 투입해 교도관들과 함께 집행하는 방안까지 고려하고 있는 것으로 알려졌다. 윤 전 대통령은 현재 건강상 이유로 내란 혐의 수사와 재판에 모두 응하지 않고 있다. 내란 사태를 수사하는 조은석 특별검사팀은 지난 19일 출정 조사에 불응한 윤 전 대통령을 곧바로 기소했다. 다만 민중기 특검팀은 윤 전 대통령에 대한 기소엔 신중하다. 문 특검보는 “기소 여부는 다른 문제”라며 “(수사팀에서) 좀 더 여유를 갖고 생각하는 것으로 알고 있다”고 말했다. 민 특검과 특검보 4명의 성향상 수사 관례에서 크게 벗어나지는 않을 거라는 게 특검 안팎의 평가다. 다만 현재 윤 전 대통령이 내란 특검 수사와 재판 등을 비롯해 끝까지 불출석 입장을 고수하면서 강제수사에 착수할 가능성도 적지 않다는 분위기다.","","2025-07-30 10:46:14","https://n.news.naver.com/mnews/article/016/0002507098","2025-07-30 PM 12:35:10"
"100","2025-07-30 PM 12:34:51","중앙일보","김건희 특검, 삼부 회장∙前대표 재소환…주가조작 369억 공모 혐의","김건희 특검팀(특별검사 민중기)이 30일 이일준 삼부토건 회장과 이응근 전 대표이사를 소환했다. 우크라이나 재건 사업과 관련한 주가조작 혐의로 구속된 이후 두 번째 조사다. 특검팀은 이 회장과 이 전 대표 기소 전 전‧현직 임원들의 주가조작 공모 관계를 입증하는 데 주력하고 있다. 법무부 호송차량이 23일 오전 서울 종로구 kt 광화문빌딩에 마련된 김건희 특검 건물로 들어가고 있다. 연합뉴스 중앙일보 취재를 종합하면 특검팀은 이날 오전부터 이 회장과 이 전 대표를 소환해 조사하고 있다. 이들은 2023년 우크라이나 관련 회사와 허위로 업무협약(MOU)을 체결하고 공개하는 방식으로 주가를 인위적으로 부양했다는 혐의를 받는다. 이 회장과 조성옥 전 삼부토건 회장 등이 이를 통해 얻은 부당이득 규모는 369억원에 달한다. 앞서 특검팀은 이 회장과 이 전 대표 외에 조성옥 삼부토건 전 회장과 이기훈 부회장에 대해서도 구속영장을 청구했다. 이 중 조 전 회장은 법원에서 기각됐고, 이 부회장은 구속영장실질심사에 나오지 않으면서 도주했다. 조 전 회장 역시 주가조작과 관련한 내용을 사전에 인지하고 있었을 것이라는 게 특검팀 판단이다. 조 전 회장은 우크라이나 재건 테마주 작업을 설계한 것으로 지목된 이 부회장에게 5억원을 대여금 형식으로 지급하기도 했다. 특검팀의 남은 과제는 삼부토건 주가조작과 김건희 여사와의 관계다. 당초 이종호 전 블랙펄 인베스트먼트 대표의 “삼부 체크하고” 단체대화방 메시지와 김 여사와의 관련성을 찾느냐가 관건이다. 구속된 이 회장은 김 여사와의 관계를 부인하고 있다. 특검팀은 이날 도이치모터스 주가조작 사건에서 김 여사의 계좌를 관리한 이 전 대표를 3차 소환 조사하고 있다. 특검팀은 삼부토건과 함께 주가조작이 이뤄진 것으로 의심되는 웰바이오텍에 대한 수사로도 확대하고 있다. 웰바이오텍 역시 삼부토건과 같은 시기 우크라이나 테마주로 분류돼 주가가 급등했다.","정진호 기자","2025-07-30 10:45:16","https://n.news.naver.com/mnews/article/025/0003458712","2025-07-30 PM 12:35:10"
"100","2025-07-30 PM 12:34:51","경향신문","기상청 “캄차카 규모 8.7 지진, 국내엔 영향 미미···지진해일 가능성 주시”","러시아 캄차카 반도 지진 발생 위치. 기상청 30일 오전 러시아 캄차카에서 발생한 규모 8.7 강진에 대해 기상청은 국내에 미치는 영향은 미미할 것으로 전망했다. 기상청은 오전 8시 24분 러시아 캄차카반도 남동쪽 해역에서 발생한 규모 8.7 지진에 따라 발생한 지진해일을 분석한 결과, 국내에는 해수면 변동이 거의 없을 것으로 예상한다고 밝혔다. 기상청 관계자는 “향후 울릉도 쪽에 수위가 너울로 인해 조금 올라갈 수는 있다”며 “국내에는 큰 영향이 없을 것으로 보인다”고 말했다. 다만 향후에 지진 규모를 재분석한 결과 상향 조정될 경우, 지진해일이 발생할 가능성이 있어 지속적으로 감시할 계획이라고 덧붙였다. 이날 캄차카 반도에서는 오전 8시24분쯤 규모 8.7 강진이 발생한 데 이어, 오전 9시 9분쯤 규모 6.9, 오전 9시 16분쯤 규모 6.3의 여진이 이어졌다. 일본 기상청은 홋카이도부터 규슈까지 태평양 연안 지역에 쓰나미주의보를 발령했고, 오전 9시 40분쯤 일본 동부 지역에 쓰나미 경보를 내렸다.","반기웅 기자","2025-07-30 10:45:07","https://n.news.naver.com/mnews/article/032/0003386253","2025-07-30 PM 12:35:10"
"100","2025-07-30 PM 12:34:51","한겨레","조립식 주택 모듈 쌓던 50대 노동자, 3층 높이서 추락사","고용노동부, 중대재해법 위반 조사 안전모가 상처 입은 모습으로 바닥에 떨어져 있다. 김혜윤 기자 unique@hani.co.kr 조립식 주택 야적 현장에서 일하던 50대 노동자가 3층 높이에서 떨어져 숨졌다. 고용노동부 등은 중대재해처벌등에관한법률(중대재해법) 위반 여부 등을 조사하고 있다. 30일 고용노동부 천안고용노동지청 광역중대재해수사과와 충북소방본부 등의 발표를 종합하면, 지난 29일 오후 1시10분께 충북 음성군 대소면의 한 조립식 주택 공장에서 50대 노동자 ㄱ씨가 떨어져 숨졌다. ㄱ씨는 조립식 주택(모듈)을 쌓는 작업을 하고 있었다. ㄱ씨는 조립식 주택 설치 기술자로 알려졌다. 당시 크레인, 지게차 등 장비가 동원됐으며, 다른 노동자 등과 함께 작업 중이었다. 천안고용노동지청 광역중대재해수사과는 “교실·주택 등에 쓰이는 조립식 모듈을 3층 높이로 쌓는 작업을 하다 10여m 아래로 떨어진 것으로 보인다. 사고 원인·경위 등은 추가 조사할 계획”이라고 밝혔다. 이 공장은 50명 이상이 일하는 중대재해법 적용 사업장이다. 이에 따라 고용노동부 천안고용노동지청 광역중대재해수사과 등이 중대재해법 위반, 산업안전보건법 위반 혐의 등을 조사 중이다. 고용노동부 천안고용노동지청 광역중대재해수사과는 “추락방지 시설 등 안전 조처, 안전 관리, 안전 규칙 준수 여부 등 전반에 걸쳐 살펴보고 있다”고 밝혔다.","오윤주 기자","2025-07-30 10:44:17","https://n.news.naver.com/mnews/article/028/0002758629","2025-07-30 PM 12:35:10"
"100","2025-07-30 PM 12:34:51","서울경제","한솔제지 근로자 사망산재 강제수사","고용부·경찰 본사 등 압수수색 김종윤 고용노동부 산업안전보건본부장 등 고용부 감독관이 17일 한솔제지 신탄진 공장을 찾아 사고 현장을 살펴보고 있다. 사진제공=고용부 [서울경제] 한솔제지 근로자의 사망산업재해에 대한 강제수사가 시작됐다. 고용노동부는 30일 경찰과 이날 오전부터 한솔제지 본사와 대전·신탄진 공장에 수사 인력을 투입해 압수수색을 하고 있다고 밝혔다. 압수수색은 산업안전보건법과 중대재해 처벌 등에 관한 법률 위반 수사에 초점이 맞춰졌다. 한솔제지 신탄진공장에서 일하던 근로자 A씨는 16일 교반기 안으로 떨어져 숨졌다. A씨는 입사한 지 한 달도 안됐다. A씨의 사고는 아내 신고로 뒤늦게 알려지게 됐다. 이 사고에 대한 비판의 목소리가 쏟아졌다. 민주노동당은 18일 논평을 내고 “명백한 기업의 부실한 안전관리로 일어난 중대재해”라며 “추락방지 장치, 피해 노동자에 대한 주의, 교대시간 때 확인 등 한 가지 대책이라도 있었으면 노동자는 사망하지 않았을 것”이라고 비판했다. 한국노동조합총연맹 대전지역본부도 신탄진공장 앞에서 기자회견을 열고 “최소한 안전장치조차 갖추지 않은 결과”라며 “안전관리 체계가 얼마나 무책임하고 안일하게 방치됐는지 보여준다”고 진상규명을 촉구했다.","양종곤 기자","2025-07-30 10:42:09","https://n.news.naver.com/mnews/article/011/0004515180","2025-07-30 PM 12:35:10"
"100","2025-07-30 PM 12:34:51","파이낸셜뉴스","또 말없이 안 나온 尹...김건희 특검팀, 체포영장 청구 가닥","이날 체포영장 청구할 듯 사진=연합뉴스 [파이낸셜뉴스] '명태균 게이트'에서 공천 개입 의혹을 받고 있는 윤석열 전 대통령이 김건희 특별검사팀(민중기 특검)의 2차 소환조사에도 모습을 드러내지 않았다. 이로써 강제구인에 나설 가능성이 커졌다. 다만 윤 전 대통령이 건강상의 이유를 명분으로 삼고 있다는 점을 감안하면, 실제 행동에 나설 수 있을지는 미지수다. 같은 상황에 처했던 내란·외환 특검팀(조은석 특검)은 추가 조사 없이 곧바로 재판에 윤 전 대통령을 넘겼다. 윤 전 대통령은 30일 오전 10시 예정된 특검팀의 소환조사에 불출석했다. 명분은 아직 확인되지 않았다. 특검팀은 전날 윤 전 대통령에게 재출석을 요구했다. 그는 전날에도 같은 시간에 특검팀의 소환조사가 예정돼있었지만, 끝내 나오지 않았다. 특검팀은 지난 21일 윤 전 대통령에게 공직선거법 위반 혐의에 대해 피의자 신분으로 출석을 통보했다. 특검팀은 윤 전 대통령이 변호사 선임계를 비롯한 의견서 등 별다른 이유를 밝히지 않고 출석하지 않았다고 밝혔다. 윤 전 대통령은 내란 특검의 두 차례 소환조사와 세 차례 강제구인, 내란 재판에 지병과 거동 불편 등 건강상의 이유로 연이어 불출석했다. 특검팀은 이날 중으로 윤 전 대통령에 대한 체포영장을 청구할 계획으로 알려졌다. 형사사건에서 통상 2~3회의 소환조사를 위한 출석 통보 이후 불응할 경우 체포영장을 청구하는 전례를 고려한 것으로 보인다. 문홍주 특검보는 ""2~3회 출석에 응하지 않을 경우와 이전 상황 등을 본다면 내일 출석하지 않을 경우, 출석 불응에 대한 우려가 크다고 본다""고 설명했다. 특검팀에게 주어진 시간이 한정돼 있고, 윤 전 대통령을 비롯한 관련 일부 조사대상자가 비협조적인 만큼 더 이상 출석 조율은 무의미하다고 판단한 것으로 해석된다. 또 윤 전 대통령의 입장을 그대로 받아줄 경우 관련자들에게 부정적인 시그널을 줄 가능성도 염두에 둔 조치로 풀이된다. 특검팀은 윤 전 대통령 부부가 지난 2022년 대선에서 명태균씨로부터 여론조사 결과를 무상으로 제공받은 대가로 같은 해 국회의원 보궐선거에 김영선 국민의힘 전 의원을 공천 받도록 영향력을 행사했다고 보고 있다. 앞서 특검팀은 지난 27일 당시 국민의힘 공천관리위원장이었던 윤상현 의원에 대한 강도 높은 소환조사를 진행했다. 윤 의원은 특검 조사에서 윤 전 대통령의 전화를 받은 것은 사실이지만 이를 공천 과정에 반영하지 않았다는 취지의 진술을 한 것으로 알려졌다.","정경수 기자","2025-07-30 10:42:09","https://n.news.naver.com/mnews/article/014/0005384551","2025-07-30 PM 12:35:10"
"category_id","category_name","press","title","content","reporter","date","link","timestamp"
