"category_id","category_name","press","title","content","reporter","date","link","timestamp"
"100","정치","문화일보","배현진 “MBC 입사 때 공부한 책 20년 지났지만 못 버려”, 최휘영 ‘아빠 찬스’ 의혹 질타","배현진 국민의힘 의원. 뉴시스 배현진 국민의힘 의원이 최휘영 문화체육관광부 장관 후보자의 자녀 취업 특혜 의혹에 대해 맹공을 펼쳤다. 여야는 지난 29일 서울 영등포구 여의도 국회에서 최휘영 문화체육관광부 장관 후보자에 대한 인사청문회를 실시했다. 이날 배 의원은 최 후보자를 향해 “(장녀가) 네이버 100%로 지분 출자된 대단한 법인에 합격하고 거기서 영주권을 취득하자마자 두 달 만에 퇴사했다는 보도가 있었다”며 “자신이 쌓아 온 네트워크로 (자녀를) 좋은 회사에 채용시키기 위해 편법 쓰는 기술을 발휘한 것으로 보인다”고 주장했다. 언론인 출신인 최 후보자는 2022년 네이버 전신인 NHN에 합류해 NHN 네이버본부 기획실장·이사·대표이사 등을 역임한 바 있다. 최 후보자의 딸은 2016년 네이버의 미국 자회사 웨이브미디어에 취업했다가 2019년 퇴사했다. 배 의원은 “우리 청년 취업자 89%가 올해 취업 관문이 힘들 것 같다고, 좌절한다는 내용의 기사가 났는데 (이게 사실일 경우) 네이버에서 떨어지고 눈물 흘리는 우리 청년들한테는 정말 가슴에 비수 꽂는 이야기일 것”이라고 일갈했다. 이런 의혹에 대해 최 후보자는 “딸의 취업에 대해서는 전혀 관여하지 않았다”고 적극 해명했으나, 배 의원을 비롯한 야당 의원들은 ‘아빠 찬스’ 의혹을 제기하며 소상한 자료 제출을 요구했다. 특히 배 의원은 최 후보자의 관련 자료 제출이 부실하다는 점을 꼬집으면서 “MBC 입사한 지 거의 20년이 다 돼가는 저도 너무 어렵게 취업했고, 그때 공부했던 책을 하나도 못 버리고 있다”며 “(의혹이 해소될 수 있도록) 상세하게 증빙해 달라”고 말했다.","장병철 기자","2025-07-30 08:40:19","https://n.news.naver.com/mnews/article/021/0002726128","2025-07-30 AM 09:19:14"
"101","경제","헤럴드경제","‘불장’ 코스피, 4년만에 최고점 경신했는데…‘만료 코앞’ 한미 무역협상·세제개편 우려에 ‘눈치보기’ [투자360]","외인·기관 닷새 연속 동반 순매수 한미 무역협상·세제개편 우려 지속 “대내외 변수에 변동성 경계해야” 코스피가 전장보다 21.05포인트(0.66%) 오른 3230.57에 장을 종료한 29일 서울 하나은행 본점 딜링룸에서 딜러들이 업무를 보고 있다. 이날 코스피는 닷새 연속 올라 3230대로 올라서며 4년 만에 최고치를 기록했다. [연합] [헤럴드경제=정윤희 기자] 30일 국내 증시는 무역협상 경계감이 지속되는 가운데 개별 업종·종목 차별화 흐름을 보일 것으로 예상된다. 전날 코스피는 전장 대비 21.05포인트(0.66%) 오른 3230.57에 거래를 마쳤다. 5거래일 연속 상승하며 지난 2021년 8월 10일(3243.19) 이후 약 4년 만에 최고치를 경신했다. 지수는 약세로 출발해 장 초반 3169.03까지 낙폭을 키웠으나 이후 상승 전환해 오름폭을 키웠다. 외국인이 6054억원, 기관이 1167억원을 순매수했다. 외인과 기관은 닷새 연속 동반 순매수를 나타냈다. 개인은 8259억원의 매도 우위였다. 테슬라와 대규모 공급 계약으로 실적 개선감이 반영된 삼성전자(0.28%)는 7만원대를 지켰다. SK하이닉스(0.19%), LG에너지솔루션(3.02%) 등이 올랐다. 한미 관세협상 불발에 대한 우려와 세제 개편안 관련 논란이 지속되면서 증시에 하방 압력이 가해지는 가운데 관세 무풍지대로 분류되는 조선·방산 업종에 관심이 집중되며 한화에어로스페이스(4.72%), 현대로템(5.86%), LIG넥스원[079550](3.49%), HD현대중공업(1.94%) 등은 올랐다. 앞서 급락했던 KB금융(0.72%), 신한지주(2.38%) 등 금융주도 반등해 지수 상승을 지원했다. 간밤 뉴욕증시에서는 다우존스30산업평균지수가 0.46%, 스탠더드앤드푸어스(S&P)500지수가 0.30%, 나스닥 종합지수가 0.38% 내리는 등 주요 지수가 동반 약세를 보였다. 일본과 EU 등 주요 우방국과의 무역 협상이 마무리되며 모멘텀이 약해진 가운데 연방공개시장위원회(FOMC) 정례회의가 시작되며 시장의 관심은 연방준비제도(Fed·연준)의 정책 방향과 개별 기업 실적으로 옮겨갔다. 한국 증시 투자 심리를 가늠할 수 있는 모건스탠리캐피털인터내셔널(MSCI) 한국 증시 ETF는 1.07% 올랐다. MSCI 신흥지수 ETF(0.04%) 대비 상승폭이 컸다. 미국의 상호관세 부과 유예 시한(8월 1일)이 임박하면서 정부가 막판 총력전을 펼치는 가운데 코스피는 무역협상 진척 상황을 주시하면서 개별 기업 실적에 따라 주가가 움직일 것으로 보인다. 한-미 통상협의차 미국 워싱턴D.C.를 방문 중인 구윤철 부총리 겸 기획재정부 장관이 29일(현지시간) 김정관 산업통상자원부장관 및 여한구 통상교섭본부장과 함께 미국 상무부에서 하워드 러트닉 상무장관과 통상협의를 하고 있다. [기획재정부 제공] 정부는 구윤철 부총리 겸 기획재정부 장관이 하워드 러트닉 미국 상무부 장관과 통상협의를 했다고 밝혔다. 재계에서는 김동관 한화그룹 부회장이 조선업 협력 및 한미 협상 지원을 위해 주요 인사를 접촉 중이며 이재용 삼성전자 회장도 워싱턴D.C로 출국했다. 세제개편안에 대한 논란은 현재진행형이다. 전날 정부와 더불어민주당은 법인세 최고세율을 24%에서 25%로 상향하고 양도세 과세 대상 대주주 기준을 50억원에서 10억원으로 강화하기로 뜻을 모았다. 배당소득에 대한 세금 부담을 낮추는 ‘배당소득 분리과세’의 경우 민주당 내에서도 의견이 엇갈리고 있다. 김지원 KB증권 연구원은 “단기 고점 부담이 여전하고 추가 상승 동력이 부재해 대내외 변수에 따른 변동성이 연장될 수 있음을 경계할 필요가 있다”고 말했다. 한지영 키움증권 연구원은 “한미 협상 불확실성과 7월 FOMC, 미국 매그니피센트7 실적 등에 대한 경계심리로 눈치보기 장세를 보일 것으로 예상한다”며 “국내도 실적 시즌이 진행중인 만큼 개별 기업 실적에 따라 업종 내 종목간 차별화된 주가흐름을 보일 것”이라고 말했다.","정윤희 기자","2025-07-30 09:08:19","https://n.news.naver.com/mnews/article/016/0002506986","2025-07-30 AM 09:19:14"
"102","사회","연합뉴스","암참 ""노란봉투법에 깊은 우려…한국 투자에 영향 줄 것""","""韓 경쟁력에도 부정적…APEC정상회의에 어떤 시그널 줄지 고민해야"" 주한미국상공회의소 [주한미국상공회의소 제공] (서울=연합뉴스) 조성흠 기자 = 주한미국상공회의소(AmCham)는 최근 국회 환경노동위원회를 통과한 이른바 '노란봉투법'에 대해 ""한국의 경영 환경과 투자 매력도에 미칠 수 있는 부정적 영향에 대해 깊은 우려를 표명한다""고 30일 밝혔다. 암참은 이날 보도자료를 통해 ""지난해 해당 법안이 처음 발의됐을 때도 반대 입장을 표명했고, 당시에도 기업 환경의 불확실성과 규제 리스크에 대한 우려를 강조했다""며 이처럼 지적했다. 노란봉투법으로 불리는 노동조합 및 노동관계조정법(노조법) 2·3조 개정안은 사용자의 범위를 넓혀 하청 노동자에 대한 원청의 책임을 강화하고, 노조나 노동자에 대한 손해배상 범위를 제한하는 내용 등을 담았다. 해당 개정안은 윤석열 정부 당시 두 차례 국회를 통과하고도 거부권 행사에 막혀 폐기됐으나, 지난 28일 국회 환경노동위원회 전체회의에서 의결되면서 내달 4일 국회 본회의 통과를 앞두게 됐다. 암참은 ""이번 개정안은 하도급 근로자에 대한 보호 범위를 확대하고, 쟁의행위에 따른 손해배상 청구를 제한하는 한편 단체교섭에 응하지 않은 경영진에 대한 법적 책임을 확대하는 내용을 담고 있다""며 ""이런 변화가 한국에 진출한 미국계 기업을 포함해 글로벌 기업 전반에 법적·운영상의 부담을 높일 수 있다""고 우려했다. 아울러 암참은 이번 법안이 산업 현장의 우려에도 불구하고 충분한 의견 수렴 없이 추진됐다고 지적하며 절차적 보완이 필요하다고 밝혔다. 합리적 노사문화 정착을 위한 법·제도 개선도 선행 과제로 제시했다. 산업통상자원부와 암참 간담회에 참석한 제임스 김 암참 회장 [암참 제공. 재판매 및 DB 금지] 나아가 제임스 김 암참 회장 겸 대표이사는 ""유연한 노동 환경은 한국이 아시아·태평양 지역 비즈니스 허브로서 경쟁력을 강화하는 데 있어 핵심적 요소""라며 ""이번 법안이 현재 형태로 시행될 경우 향후 한국에 대한 미국 기업들의 투자 의사에도 영향을 줄 수 있다""고 경고했다. 이어 ""2025년 아시아태평양경제협력체(APEC) 정상회의는 한국이 혁신과 경제 정책 측면에서 리더십을 보여줄 수 있는 매우 중요한 무대""라며 ""이런 시점에 해당 법안이 어떤 시그널을 줄지 함께 고민해볼 필요가 있다""고 덧붙였다. 제임스 김 대표는 또 ""암참의 2024년 경영환경 설문조사에서도 규제의 예측 가능성 부족이 외국계 기업의 주요 애로사항으로 꼽혔다""며 ""이번 개정안은 이런 불확실성을 더욱 키울 수 있고, 결과적으로 한국의 글로벌 경쟁력에도 부정적인 영향을 줄 수 있다""고 강조했다. josh@yna.co.kr","조성흠 기자","2025-07-30 09:08:11","https://n.news.naver.com/mnews/article/001/0015537542","2025-07-30 AM 09:19:14"
"103","생활/문화","연합뉴스","끈질긴 무더위…'중복' 오늘 낮 최고 서울 36도·대전 38도","낮 최고 32∼38도…무더위 당분간 지속 한층 거센 남동풍…남쪽 해상 거친 풍랑, 해안에 너울 햇볕을 막아 주는 유일한 공간 (서울=연합뉴스) 김도훈 기자 = 서울 지역 낮 기온이 36도를 기록한 29일 2025 서울도시건축비엔날레 주제전 작품설치 공사가 진행되고 있는 서울 종로구 열린송현 녹지광장에서 한 관계자가 타고 있는 크레인에 햇볕을 막아주는 대형 파라솔이 설치돼 있다. 2025.7.29 superdoo82@yna.co.kr (서울=연합뉴스) 이재영 기자 = 그악스러운 더위가 중복인 30일에도 이어진다. 지난밤에도 서쪽 지역과 전국 해안을 중심으로 열대야가 나타났다. 제주 서귀포는 보름째, 서울은 열하루째, 인천·청주·강릉은 열흘째 열대야다. 밤에 열이 식지 않으면서 낮 더위가 더 심해지겠다. 이날 낮 최고기온은 32∼38도일 것으로 예상된다. 대전은 38도, 서울과 대구는 36도, 광주는 35도, 인천·울산·부산은 33도까지 기온이 오르겠다. 강하게 내리쬐는 햇볕은 기온을 올릴 뿐 아니라 오존 농도도 높이겠다. 서울·인천·경기남부·충남은 '매우 나쁨', 경기북부·대전·전북·전남·울산·경북은 '나쁨' 수준으로 오존이 짙겠다. 나머지 지역은 '보통' 수준이겠다. 북태평양고기압과 티베트고기압이 이중으로 한반도를 덮은 상황이 해소되지 않고 있다. 북태평양고기압 영향으로 맑고 고온다습한 남동풍을 맞는 상황이 당분간 유지될 전망으로 더위도 당분간 이어지겠다. 이번 주말도 아침 기온이 21∼27도, 낮 기온이 27∼37도로 오늘과 비슷하겠다. 고온다습한 남동풍이 불어 드는 가운데 내륙을 중심으로 일사에 의해 지상의 공기가 뜨겁게 달궈지는 지역에 열저기압이 발생하겠다. 열저기압은 지표가 가열됐을 때 생성되는 저기압으로 중심이 뜨겁고, 이동하지 않는 정체성 저기압이다. 남동풍과 열저기압 때문에 공기가 모이며 상승하는 지역에 소나기 구름대가 발달해 소나기가 오겠다. 지형의 영향으로 공기가 위로 떠오르는 곳에도 소나기 구름대가 만들어지겠다. 이날은 오후 들어 경기 북동부에 5∼20㎜, 강원 중북부 내륙·산지에 5∼30㎜ 정도 소나기가 올 때가 있을 것으로 보인다. 소나기가 내리면 기온이 일시적으로 떨어지겠으나, 그친 뒤 곧바로 기온이 올라 무더위가 해소되지 못하겠다. 중국 상하이 남동쪽 해상에서 북서진 중인 제8호 태풍 꼬마이와 북태평양고기압 사이 바람길이 좁아지면서 남동풍이 한층 거세게 불겠다. 이에 제주앞바다(북부앞바다 제외)와 남해동부바깥먼바다에 31일까지, 제주남쪽먼바다와 서해남부남쪽먼바다에 8월 첫날까지 바람이 시속 30∼60㎞(9∼16㎧)로 거세게 불고 물결이 1.5∼4.0ｍ로 높게 일겠다. 제주남쪽먼바다는 이날 바람이 시속 45∼80㎞(12∼22㎧)로 더 거세게, 물결이 5ｍ 안팎으로 더 높게 칠 것으로 예상된다. 또 이날 밤부터 서해남부북쪽바깥먼바다에도 바람이 시속 30∼55㎞(9∼15㎧)로 거세게 불고 물결이 1.5∼3.5ｍ로 높게 일겠다. 제주해안과 전남해안, 경남해안엔 당분간 너울이 지속해서 유입되겠다. 방파제나 해안도로를 넘어 물결이 들이치겠으니 각별히 주의해야 한다. jylee24@yna.co.kr","이재영 기자","2025-07-30 08:35:12","https://n.news.naver.com/mnews/article/001/0015537472","2025-07-30 AM 09:19:14"
"104","세계","연합뉴스","애플, AI 조직 엑소더스?…메타·스타트업으로 또 이탈","블룸버그 ""한 달 새 메타행만 4명…다른 연구원도 이직 위해 면접"" 메타, 오픈AI 전 CTO 무라티 설립 스타트업 연구원도 영입 시도 애플 로고 [로이터 연합뉴스 자료사진. 재판매 및 DB 금지] (샌프란시스코=연합뉴스) 김태종 특파원 = 애플의 인공지능(AI) 연구원이 잇따라 회사를 떠난 것으로 알려지면서 애플의 AI 조직이 위기를 맞고 있다. 애플의 핵심 멀티모달 AI 연구원이었던 보웬 장이 조만간 회사를 떠나 페이스북 모회사 메타의 '초지능 연구소'에 합류할 예정이라고 블룸버그 통신이 29일(현지시간) 보도했다. 장 연구원은 애플 AI 플랫폼의 기반이 되는 핵심 기술을 구축한 '애플 파운데이션 모델'(AFM) 소속이었다. 애플 AI 연구원이 메타로 옮기는 것은 최근 한 달간 이번이 4번째다. 최근 애플에서 AI 모델 개발을 총괄하던 뤄밍 팡이 2억 달러 이상의 보상 패키지를 받고 메타로 옮긴 것으로 알려졌으며, 이 조직의 마크 리와 톰 건터 연구원도 메타로 이직했다. 일부 연구원은 메타가 아닌 다른 기업으로도 옮기거나 이직을 고려 중이다. 또 다른 팀원인 플로리스 위어스는 최근 한 스타트업으로 자리를 옮겼고, 다른 연구원들도 이직을 위해 면접을 보고 있다고 소식통은 전했다. AFM 조직은 애플 본사가 있는 캘리포니아 쿠퍼티노와 뉴욕에 걸쳐 수십 명의 엔지니어와 연구원으로 구성돼 있다. 이 조직의 연구는 애플이 지난해 출시한 AI 시스템 '애플 인텔리전스' 플랫폼의 기반이 된다. 그러나 잇따른 인력 이탈로 애플의 AFM 조직은 혼란에 빠졌다고 블룸버그 통신은 전했다. 조직의 로드맵과 연구 방향 결정에 중심적인 역할을 해 온 팡의 이탈에 다른 연구원도 잇따라 회사를 떠나고 있고, 현재 이 조직 내 다수는 팀의 미래가 불투명하다고 말하고 있다는 것이다. 애플은 메타 및 다른 기업들의 영입 제안에 대응해 AI 조직 직원들의 연봉을 소폭 인상했지만, 경쟁사들에 비하면 턱없이 부족한 수준이다. 여기에 AI 정책에 대한 불확실성이 이 조직의 사기를 떨어뜨리고 인력 이탈을 부추기고 있다고 블룸버그 통신은 분석했다. AFM 조직은 애플의 자체 파운데이션 모델을 개발하고 있지만, 애플은 제3자 모델을 더 많이 사용하는 쪽으로 전환을 고려하고 있는 탓이다. 애플의 일부 경영진은 자체 개발 AI 모델로는 경쟁사를 따라잡는 데 어려움이 있다는 판단을 하고 있다고 소식통은 전했다. 아직 최종 결정이 내려지지 않았지만, 애플이 외부 옵션을 검토하고 있다는 사실만으로도 이 조직 내부에서는 불안감이 커지고 있다고 이 매체는 진단했다. 애플 자체 AI 정책도 조직이 경쟁사를 따라잡는 것을 더 어렵게 만들고 있다. 애플은 개인정보 보호에 대한 원칙이 확고해 이용자가 통제 못 하는 곳에서는 데이터가 처리되지 않도록 하고 있다. 이에 AI 작업을 클라우드가 아닌 기기 자체에서 처리하는 것을 선호하는데, 이런 방식은 데이터센터보다 휴대전화가 할 수 있는 일이 제한적이기 때문에 AI 역량이 제한될 수 있다고 블룸버그 통신은 분석했다. 이런 가운데 메타는 계속해서 경쟁사 AI 인재를 영입하고 있다. 최근 인간을 능가하는 AI 개발을 위한 '초지능 연구소'를 설립하고 오픈AI와 구글, 애플, 앤스로픽 등 경쟁사로부터 수십 명의 AI 인재를 영입한 메타가 새로운 '타깃'을 노리고 있다고 정보기술(IT) 전문 매체 와이어드가 이날 보도했다. 메타는 오픈AI 최고기술책임자(CTO) 출신의 미라 무라티가 설립한 AI 스타트업 소속 직원 10여명에게 '초지능 연구소' 합류를 제안한 것으로 알려졌다. 이 중 1명에게는 10억 달러 이상의 보상 패키지를 제안했다고 이 매체는 전했다. 오픈AI에서 CTO를 역임하며 챗GPT 개발에 깊숙이 관여해온 무라티는 지난해 9월 회사를 떠난 뒤 AI 스타트업 '싱킹 머신 랩'을 설립했다. 이 스타트업에는 오픈AI 출신들이 대거 합류한 것으로 알려졌다. taejong75@yna.co.kr","김태종 기자","2025-07-30 08:48:29","https://n.news.naver.com/mnews/article/001/0015537488","2025-07-30 AM 09:19:14"
"105","IT/과학","경향신문","존재감 커지는 애플페이···삼성전자 고민도 커졌다","일러스트 | 챗GPT 애플의 간편결제 서비스 ‘애플페이’가 국내 서비스 범위를 넓히면서 ‘삼성페이’로 갤럭시 스마트폰 생태계를 강화해온 삼성전자에 복합적인 고민을 안기고 있다. 아이폰 선호도가 높은 젊은층의 이탈을 어떻게 막을지, 애플페이처럼 카드사에 수수료를 부과할지를 둘러싼 과제가 삼성전자 앞에 놓였다. 애플은 지난 22일부터 아이폰과 애플워치에 선불 충전 방식의 ‘애플페이 티머니’를 도입했다. 아이폰을 대중교통 단말기에 대는 방식으로 승하차가 가능해진 것이다. 2023년 3월 국내 서비스를 시작한 애플페이는 이용 가능 카드사와 사용처 제한, 교통카드 기능 부재로 시장 확대에 어려움을 겪었다. 아이폰 이용자들은 교통카드 기능 도입을 크게 반기는 분위기다. 삼성전자로선 애플페이의 행보를 예의주시할 수밖에 없다. ‘삼성페이 때문에 갤럭시 쓴다’는 말이 나올 정도로 삼성페이는 갤럭시 스마트폰을 선택하는 주요 요인 중 하나다. 삼성페이는 마그네틱보안전송(MST)과 근거리무선통신(NFC) 방식을 모두 지원해 구형 카드 단말기로도 결제할 수 있다는 게 강점이다. 교통카드 기능은 2015년 삼성페이 서비스를 시작한 첫해부터 제공했다. 애플페이가 서비스를 강화하면 아이폰으로 갈아타는 이탈자가 늘어날 수 있다. 국내에선 특히 젊은층의 아이폰 선호도가 높다. 한국갤럽이 이달 초 전국 만 18세 이상 스마트폰 사용자 986명에게 현재 주로 사용하는 브랜드를 물었더니 삼성전자 72%, 애플 24%, 이외 브랜드 2% 순으로 나타났다. 18~29세에선 애플이 60%로 강세를 보였다. 삼성전자는 인공지능(AI) 기능과 폴더블폰 등 폼팩터(제품 외형) 경쟁력을 앞세워 소비자 공략에 나서는 전략을 펴고 있다. 현 시점에선 삼성페이의 강세가 이어질 것이라는 시각이 많다. 국내에서 애플페이로 결제할 수 있는 카드사는 현대카드가 유일하고, 애플페이를 지원하는 NFC 단말기 보급률도 낮기 때문이다. 카드사들은 애플페이 합류를 고심하고 있다. 애플은 결제 건당 0.15%의 수수료를 받는 것으로 알려졌다. A카드사 관계자는 “수수료가 부담스럽긴 하지만 애플을 선호하는 젊은 고객들이 많은 만큼 애플페이와의 제휴를 고려하지 않을 수 없다”고 말했다. 이 같은 카드사들의 움직임에 삼성전자는 수수료 부과를 검토하고 있다. 그동안 삼성전자는 카드사로부터 수수료를 받지 않는 정책을 유지해왔다. 카드사들은 보안인증업체에 생체인증 비용만 지불한다. 삼성전자는 현대카드 외 다른 카드사들도 애플페이 서비스를 도입해 수수료를 낸다면 형평성 차원에서 수수료를 부과할 수 있다는 입장이다. 삼성전자와 카드사들은 2023년 수수료 문제로 갈등을 겪었으나 삼성전자 측이 ‘무료’ 유지를 결정하면서 일단락된 바 있다. 양측의 계약은 다음달 만료된다. 삼성전자 관계자는 “수수료 관련 사안을 지속적으로 검토 중”이라고 전했다. 삼성전자는 수수료를 받을 경우 운영비를 충당하고 남은 이익을 프로모션 등을 통해 소비자에게 돌려주겠다는 방침이다. B카드사 관계자는 “같은 서비스를 제공하는데 한쪽(애플)만 수수료를 받는다면 다른 쪽(삼성전자)도 수수료를 부과할 가능성이 크다고 본다”고 말했다.","배재흥 기자","2025-07-30 06:06:15","https://n.news.naver.com/mnews/article/032/0003386211","2025-07-30 AM 09:19:14"
