"category_id","category_name","press","title","content","reporter","date","link","timestamp"
"100","정치","중앙일보","권성동 ""안철수, 여의도 대표 하남자…특검 문자 한통에 호들갑""","권성동 국민의힘 의원이 같은 당 안철수 의원을 또 '하남자'라고 칭하며 비판했다. 국민의힘 권성동 의원이 18일 서울 여의도 국회 의원회관 자신의 의원실로 들어서며 압수수색 관련 입장을 밝히고 있다.[연합뉴스] 권 의원은 이날 오전 페이스북에 글을 올려 ""어제 안철수 당대표 후보가 특검으로부터 문자 한 통을 받았다며 호들갑을 떨었다""며 ""이에 특검은 '내란 특검법에 찬성한 유일한 (당시)여당 의원이라 연락한 것'이라 밝혔다""고 적었다. 이어 ""정작 위헌 요소로 가득한 특검법에 홀로 찬성표를 던지고, 이후에는 동지들을 ‘인적 청산’이라는 이름으로 절벽 끝에 몰아넣은 사람이 바로 안철수 후보""라며 ""동지들이 정치 수사의 큰 칼에 쓰러질 땐 미소를 머금고 방관하더니, 정작 본인에게는 커터칼 수준도 안 되는 참고인 협조 요청이 오자 '무분별한 정치 수사'라며 목소리를 높이는 모습은 실소를 자아낸다""고 적었다. 안철수 국민의힘 의원이 지난 21일 국회 소통관에서 현안 관련 기자회견을 하고 있다. 임현동 기자 또 ""특검의 본질이 정치 보복임을 몰랐다면 무능이고, 알면서도 '나는 빼고' 식으로 당과 동지들을 희생시켰다면 비열함""이라며 ""무엇보다, 스스로 만든 상황 속에서 마치 희생자인 양 비장미를 연출하는 모습에 ‘여의도 대표 하남자’라는 별명이 괜히 붙은 게 아님을 다시금 느낀다""고 비판했다. 이는 안 의원이 전날 오후 국회 상징석 앞에서 당대표 선거 출마를 공식 선언하며 특검으로부터 출석 요구를 받은 사실을 털어놓은 것에 대한 비판으로 보인다. 안 의원은 당시 ""이재명 정권이 임명한 특검이 오늘 제게 문자를 보내 ‘내란에 대한 수사가 있다’며 출석을 요구했다”며 “계엄에 반대하고 탄핵에 찬성했던 저에게조차 이런 문자를 보낸 것은 국민의힘 전체를 내란 정당으로 낙인찍으려는 시도”라고 주장했다. 다만 특검은 안 의원이 내란 특검법에 찬성한 당시 유일한 여당 의원이라는 이유로 연락했다는 입장이다. 권 의원이 안 의원을 '하남자'라고 칭한 건 이번이 처음이 아니다. 이달 초 권 의원은 안 의원이 자신을 인적 청산 대상으로 지목하자 ""'하남자 리더십'으로 당의 위기를 극복할 수 없다""며 안 의원을 비판한 바 있다. '하(下)남자'는 '상남자'의 반대 개념으로, 주로 소극적이고 겁이 많거나 남성적 매력이 부족한 남성을 풍자하는 의미로 쓰이는 신조어다.","신혜연 기자","2025-07-30 09:08:33","https://n.news.naver.com/mnews/article/025/0003458691","2025-07-30 AM 09:42:18"
"101","경제","서울경제","노타, 코스닥 예심 신속 통과…하반기 상장 본격화 [시그널]","코스닥 기술특례상장 시동 노타 CI. 사진 제공=노타 [서울경제] 인공지능(AI) 경량화 솔루션 기업 노타가 코스닥 상장을 위한 예비심사를 통과했다. 30일 투자은행(IB) 업계에 따르면 노타는 최근 한국거래소의 상장 예심을 통과했다. 이는 5월 예비심사를 신청한 이후 약 2개월 만이다. 노타는 지난해 12월 기술성 평가에서 전문기관 2곳으로부터 모두 ‘A등급'을 받으며 기술특례상장을 추진하고 있다. 상장 목표 시기는 올해 하반기이며 주관사는 미래에셋증권이다. 노타는 자체 개발한 AI 모델 최적화 플랫폼 ‘넷츠프레소’를 통해 엣지디바이스(데이터 센터와 사용 기기 사이에서 연결체 역할을 하는 기기) 환경에 특화된 AI 모델을 개발·공급하고 있다. 노타 측은 엔비디아, 삼성전자, Arm, 퀄컴, 소니 등 글로벌 기업과 협업하며 다수의 상용화 경험을 가지고 있다고 강조한다. 올해 4월 아랍에미리트연방(UAE) 두바이 교통국에 솔루션을 공급하며 국내 기업으로는 최초로 중동 정부 기관에 생성형 AI 솔루션을 납품했다. 채명수 노타 대표는 “최근 기술특례상장이 더욱 까다로워지는 가운데 약 2개월만에 예비심사를 통과한 것은 이례적""이라며 “이는 노타가 기술 스타트업을 넘어 글로벌 시장에서 기술력과 사업성을 모두 입증한 기업임을 보여주는 결과”라고 강조했다. 채 대표는 이어 “이번 기업공개(IPO)를 기점으로 AI 경량화, 최적화 분야에서 글로벌 기술 표준을 주도하고 산업 전반의 AI 전환을 선도하는 기업으로 자리매김하겠다”고 말했다.","이덕연 기자","2025-07-30 09:31:16","https://n.news.naver.com/mnews/article/011/0004515114","2025-07-30 AM 09:42:18"
"102","사회","오마이뉴스","가족의 생계까지 위협한 12·3 내란사태... ""매출 80% 줄었다""","[1인 자영업자들의 재난 같은 영업현장 ③] 내란 이후 가족 소상공인들은 어떻게 살아가나?본 기사는 송파구의회 의정연구회(회장: 배신정 의원)와 함께 송파구내 소상공인들의 노동 및 영업 실태를 분석하기 위해, 현장을 직접 방문해 작성한 기사입니다. 소상공인들의 어려움을 돕고, 응원하는 목적에서 작성되었습니다. 단순히 송파구 상황이 아니라 국내 소상공인들 대부분이 직면한 현실이라 생각합니다. 4회 연재할 예정입니다. <기자말> ▲ 요거트 피플 사장님 엄마와 아들이 함께 운영하고 있다. ⓒ 전진한 위례신도시는 송파구, 성남시, 하남시가 모여 있는 곳이다. 30대 젊은 부부와 학생과 아이들의 비중이 높기도 하다. 도시가 아파트 단지로 구성되어 있고, 직장인들이 대부분이라 체감경기에 민감하다. 서울에서 가장 젊은 도시이다. 이곳에서 대학에서 연구로 매진하던 엄마와 아들이 1년 전 요거트 가게를 열었다. 취재진이 가게로 들어서자, 민트색 옷의 화사한 외모를 가진 주인이 인사를 한다. 50대 중반이라는 나이가 좀처럼 믿어지지 않는다. 이곳은 아들과 함께 운영하는 모자(母子)가게이다. 서너 평 규모의 가게였지만 깔끔했고, 꽤 많은 투자금이 들었을 것으로 보였다. 왜 아들과 함께 소상공인의 삶을 결심했을까? ""요즘 청년 실업이 매우 많잖아요. 저희 아들도 대학원에 다니다가 적성이 안 맞아서 뭔가를 하고 싶어 했는데, 조그만 가게를 함께 해보자고 제안했습니다. 저도 평생 공부만 했습니다. 큰 결심을 하고 1억 원 정도 투자했습니다. 월세는 210만 원 입니다."" 학교라는 울타리에 있다가 '야전'으로 나온 1년의 소감은 어떨까? 아마도 녹록지 않았을 것이다. 더군다나 작년 12·3 내란 사태는 우리나라 경제를 뿌리째 뒤흔들었다. 정치인들의 폭정은 서민들에게 해일이 되어 밀려온다. 그리고 아무도 도와주지 않는다. ""처음에는 장사가 굉장히 잘됐어요. 매출도 좋았고요. 그런데 12월에 계엄령이 터져서 공포분위기 속에서 소비심리가 확 죽어 버렸어요. 너무 힘들었어요. 그 뒤로 근근이 버티고 있습니다."" 내란을 일으킨 전직 대통령은 구치소에 있고, 다른 가담자들은 수사를 받고 있다. 새로운 정부도 들어섰다. 이재명 정부는 경제를 살리고자 소비쿠폰도 발행하고, 국가의 정상화를 위해 애쓰고 있다. 그러나 ""국가에서는 소비쿠폰이다 하면서 애써주시는데, 저희 같은 브런치 카페나 디저트 카페 등에는 영향이 미미해요. 밥집은 필수지만 이런 카페는 간식이라 이런 것부터 (소비를) 줄이는 것 같아요. 개업했을 때 보다 현재 매출액이 80% 이상 줄었어요."" ▲ 요거트 피플 사장님 서빙을 돕고 있는 조용근 송파구 구의원 ⓒ 전진한 매출이 80%나 감소했다니 심각한 상태다. 그나마 인터뷰 진행 중에도 젊은 엄마와 아이들이 요거트를 먹기 위해 가게로 들어서고 있었다. 실제 요거트를 사먹어 보니 깔끔하고 맛났다. 하지만 만들어진 요거트에 1년 동안 겪었을 자영업자의 눈물이 들어 있는 것 같았다. ""혹시나 대신 영업 하실 분이 나타나시면 가게를 넘길까 생각하고 있습니다. 아들한테도 다시 공부를 하라고 권하고 있습니다. 유학도 생각하고 있고요."" 재난 현장을 방문한 느낌이었다. 깔끔한 요거트 가게에서 시름은 깊었다. 아파트 상가도 곳곳에 폐업한 곳이 눈이 띄었다. 새롭게 출범한 이재명 정부에 바라는 점은 무엇이 있는지 물었다. ""정부에서 자영업자들의 실태파악을 정확히 했으면 좋겠어요. 소비 쿠폰도 중요하지만, 자영업자들은 대출이 더 중요해요. 낮은 이자로 대출하는 정책이 필요하고, 갚는 기간도 길게 늘려주고요. 실제 소상공인 진흥재단 같은 곳에 대출에 대해서 물어보면 인터넷 들어가서 보라고 합니다."" 함께 방문한 조용근 구의원(거여2동, 장지동, 위례동)은 위례 신도시 매출 하락의 원인에 대해 부동산이라고 분석했다. ""처음 분양할 때 분양가가 높았어요. 가게마다 대부분 상당한 대출이 있어요. 소비여력이 많이 부족하고요. 임대료가 높은데, 비싼 음식을 팔면 영업은 잘 안 되고요. 그런 악순환이 있는 것 같습니다. 12.3 계엄이 이런 작은 가게까지 영향을 미칠지 몰랐습니다."" ▲ 내담아구찜 내담아구찜 간판 ⓒ 전진한 다음으로 방문한 곳은 풍납동에 맛집으로 유명한 '내담 아구찜'이다. 풍납동은 풍납토성으로 유명한 곳이다. 맑은 날 토성 주변을 걷다 보면 마음이 치유된다. 토성의 아름다움은 지역 주민들에게는 깊은 굴레로 다가온다. 문화재보존지구로 선정되어 각종 개발이 제한되면서 많은 불이익을 받고 있기 때문이다. 내담아구찜은 1992년부터 치킨 집으로 시작했고, 2013년 이후에는 아구찜으로 업종을 변경했다. 이곳은 30년 넘게 부부가 함께 운영하고 있는 곳이다. 주인 김행순(69세)씨는 지역에서 요리솜씨로 명성이 자자한 분이다. 실제 한 지상파 방송에 출연하기도 했다. 내공이 가득한 이곳의 상황은 어떨까? ""최근 매출이 50% 이상 줄었습니다. 원래 연말연시에는 장사가 잘 되었는데, 작년 정치상황 때문에 매출이 너무 줄었어요. 쉬는 날 없이 일하고 있는데, 힘드네요. 저희는 명절에도 쉬지 않는데 상황이 나아지지 않습니다."" 평생 쉬는 날 없이 일하다 보니, 자식들과 여행 한 번을 못 갔다고 했다. 그나마 장사가 잘 되었을 때는 덜 힘든데, 최근에는 상황이 더 힘들다고 한다. ""오전 9시에 문을 열어서 오후 10시까지 합니다. 이곳에서 치킨집을 할 때는 새벽 3, 4시까지 했어요. 그래도 장사만 잘 되면 좋은데, 최근 손님이 끊겨서 힘드네요."" 실제 아구찜을 시켜서 먹어보았는데, 전문 아구찜 가게보다 더 맛나서 놀랐다. 직접 매일 만드는 반찬은 정성이 가득했고, 가격도 아구찜(大)이 4만9천 원으로 합리적이었다. 가게는 오래된 장인의 풍모가 가득했다. 포털사이트 맛집 평가도 칭찬으로 가득했다. ""김치 반찬 맛있고요. 해물 크고 콩나물 많고 간이 딱 맞아서 좋아요. 여사장님 따뜻하게 말씀 잘하셔요."" 이런 맛집이 장사가 잘 안 되는 것은 우리나라 경제가 심각한 지경이라는 것을 방증한다. 부부가 함께 일하는 곳이라 가정 경제에 더 큰 타격을 받을 것 같았다. ""따로 일하는 가정보다 (저희는) 가게 매출이 줄어들 때 타격이 더 큽니다. 날씨가 더우니 에어컨은 계속 틀어야 하고, 월세, 전기세, 가스비, 개인 보험 등은 그대로 나오니까요."" 이곳의 오래된 단골인 김정열 의원(풍납 1,2동, 잠실 4·6동)은 풍납동에 대한 애정으로 가득했다. ""이곳은 너무 아름다운 동네에요. 우리 아이들도 여기서 자랐고, 내담 아구찜도 예전부터 가족들과 오던 곳입니다. 풍납동은 경당연립부지 개발에서 유물이 발견되어 문화재 유적지로 지정되면서 많은 어려움을 겪고 있는 곳입니다. 경제 상황이 안 좋아지니, 동네 상권도 활기를 잃는 것 같아서 마음이 무겁습니다."" 12·3 내란사태와 경기불황은 한 가족의 생계를 위협하고 있다. 시름에 잠긴 사장님의 모습에 가슴이 아프다. 이들에게 새로운 희망이 내려오길 간절히 바라본다. ▲ 내담아구찜 내담아구찜 사장님 ⓒ 전진한","","2025-07-30 09:32:15","https://n.news.naver.com/mnews/article/047/0002482770","2025-07-30 AM 09:42:18"
"103","생활/문화","동아일보","女, 더 향긋한 체취 풍겨 男 사로잡는 ‘때’ 있다…도쿄대 연구","사진=게티이미지코리아.‘썸’ 타는 남자에게 고백하거나 배우자에게 원하는 게 있을 때 성공 확률을 높이는 간단한 비결이 있는지도 모른다. 여성의 체취는 생리 주기에 따라 달라지며, 특히 배란기 여성의 냄새를 남자들이 더욱 매력적으로 느낀다는 연구 결과가 나왔기 때문이다. 일본 도쿄 대학교 연구진은 여성 참가자 21명을 모집해 한 달 동안 생리 주기의 4단계에서 각각 겨드랑이 냄새를 채집했다. 전문 장비를 활용해 분석한 결과 배란기(생리 주기가 28일인 경우 14일 째)에 세 가지 향 성분이 집중적으로 증가한다는 사실을 밝혀냈다. 이 향들은 각각 꽃향기, 비누 냄새, 신선한 느낌을 주는 특징이 있다. 연구자들은 배란기에 세 가지 화합물 즉, (E)-젤라닌 아세톤((E)-geranylaceton), 테트라데칸산(Tetradecanoic acid), (Z)-9-헥사데센산((Z)-9-hexadecenoic acid)이 증가한다는 사실을 알아냈다. 이 화합물들이 에스트라디올·프로게스테론과 같은 여성 호르몬, 혈중 아미노산, 인지질 등의 농도를 변화시켜 평소와 다른 몸 냄새를 유발 하는 것으로 여겨진다. 사진=게티이미지코리아. 불쾌한 겨드랑이 냄새에 이들 향을 추가해 남자들에게 맡게 하자 놀라운 일이 벌어졌다. 남자들은 배란기 체취를 평소 여성의 냄새보다 더 쾌적하게 느끼고, 해당 체취와 연결된 여성의 얼굴 사진을 더욱 여성답고 매력적이라고 평가했다. 또한 스트레스 완화 효과도 있어 남자들의 침에 들어 있는 스트레스 생체 지표인 아밀레이스 수치 증가가 억제됐다. 연구진은 “여성의 배란기 동안 증가하는 체취 성분 세 가지를 확인했고, 이들이 원래의 불쾌한 겨드랑이 냄새를 완화시켜 배란기의 체취가 남성에게 가장 쾌적하게 인식되도록 만들었다”며 “또한, 이 성분들은 남성의 적대감과 스트레스를 줄이고, 여성의 얼굴 사진에 대한 긍정적인 인상을 강화시켰다”라고 설명했다. 논문에서 캡처, 도쿄 대 응용생물학과와 국제신경지능 연구센터가 공동 수행한 이번 연구는 인간에게 ‘페로몬’이 존재한다는 직접적인 증거는 아니지만, 배란기 동안 증가하는 특정 향 성분이 남성의 기분과 인식에 미묘한 영향을 줄 수 있음을 보여준다. 연구를 이끈 도쿄 대 생리학자이자 신경과학자인 도하라 카즈시게 교수는 “배란기 동안 증가하는 화합물이 인간 페로몬이라고 단정 지을 수는 없다. 페로몬의 고전적 정의는 특정 행동 또는 생리적 반응을 유도하는 종(species) 특이적 화학 물질이다”라며 “우리가 발견한 성분들이 인간에게만 작용하는지 여부는 아직 불분명하다. 다만, 이 성분들이 사람의 행동과 생리 반응에 유사한 영향을 주는 ‘페로몬 유사 화합물’일 가능성은 있다”고 말했다. 이와 비슷한 맥락의 연구는 전에도 있었다. 배란기 여성의 목소리나 얼굴이 더 매력적으로 평가되는 경향이 있다는 다른 연구 결과가 그것이다. 이번 연구는 그 연장선에서, 후각을 통한 무의식적 소통 가능성에 주목한다. 체취의 변화는 단순히 냄새를 좋게 만드는 것을 넘어, 남성과 여성 간의 무의식적인 소통 수단으로 작용하는 것으로 보인다. 사진=게티이미지코리아. 연구진은 “이러한 신체적 변화는 배란기에 이성을 끌기 위한 자연적 변화 메커니즘으로 해설될 수 있다”며 “얼굴 매력이 낮은 여성의 경우 체취 신호가 보다 큰 영향을 미칠 수 있으며, 이는 배란기 체취와 신체적 변화가 결합하여 이성의 관심을 끄는 전략으로 작용할 수 있다”라고 썼다. 그렇다고 ‘여성이 향기로 남성을 조종할 수 있다’는 뜻은 아니다. 다만 이 연구는 우리 몸이 얼마나 섬세하고 복잡하게 설계되어 있는지를 알게 해 준다. 연구결과는 국제 학술지 아이 사이언스(iScience)에 ‘Human ovulatory phase-increasing odors cause positive emotions and stress-suppressive effects in males’라는 제목으로 게재됐다.","박해식 기자","2025-07-30 09:21:15","https://n.news.naver.com/mnews/article/020/0003651343","2025-07-30 AM 09:42:18"
"104","세계","서울경제","[속보]러 캄차카반도 8.7 강진…일본, 태평양 연안 '쓰나미 주의보'","야후 재팬 캡쳐 [서울경제] 러시아 캄차카반도 동쪽 해역에서 규모 8.7의 강진이 발생하면서 일본 기상청이 홋카이도부터 규슈에 이르는 태평양 연안 전역에 쓰나미 주의보를 발령했다. 30일(현지시간) NHK에 따르면 일본 기상청은 “예상되는 쓰나미 높이는 최대 1m”라며 “해안과 하천 하구 인근에서는 접근을 피하고, 바다에 나가 있는 경우 즉시 대피해야 한다”고 당부했다. 미국 태평양쓰나미경보센터(PTWC)도 러시아와 일본에 대해 “향후 3시간 이내 위험한 쓰나미가 도달할 수 있다”며 경보를 발령했다. 쓰나미 주의보는 홋카이도 태평양 연안 동부와 중부를 비롯해 아오모리현, 이와테현, 미야기현, 후쿠시마현, 이바라키현, 치바현 구주쿠리·외보, 오가사와라 제도, 시즈오카현, 미에현 남부, 와카야마현, 미야자키현 등 태평양 연안 전역에 발령됐다. 쓰나미 도달 예상 시각은 지역별로 30일 오전 10시부터 오후 12시까지다. 홋카이도 태평양 연안 동부와 중부는 오전 10시, 아오모리현과 이와테현·미야기현은 오전 10시 30분 전후, 후쿠시마현은 오전 11시, 이바라키현과 치바현은 오전 11시 전후에 도달이 예상된다. 오가사와라 제도와 시즈오카현·미에현 남부·와카야마현은 오전 11시 30분 전후, 미야자키현은 오후 12시 전후에 도달할 것으로 보인다. 일본 기상청은 해당 시간 전후로 쓰나미가 연안에 도달할 것으로 보고 있으며, 일부 지역에서는 조석과 겹쳐 피해 우려가 커질 가능성도 있다고 경고했다. 한편 이번 지진의 진앙은 인구 약 18만7000명이 거주하는 러시아 페트로파블롭스크-캄차츠키에서 남동쪽으로 약 136㎞ 떨어진 해역이며 진원의 깊이는 약 19㎞로 관측됐다. 야후 재팬 캡쳐","김도연 기자","2025-07-30 09:21:11","https://n.news.naver.com/mnews/article/011/0004515106","2025-07-30 AM 09:42:18"
"105","IT/과학","서울경제","'5년안에 기업가치 2배'…크래프톤의 '배틀그라운드' 다음 타깃은?","2029년까지 매출 9조원 달성 배틀그라운드만으로 4조원 목표 신작 흥행으로 3조원 벌어들일 것 AI 통해 재미 극대화·생산성↑ [서울경제] 크래프톤(259960)이 2029년까지 연 매출 7조 원을 목표로 하는 성장 전략을 발표했다. 지난해 연 매출 2조 7098억 원 기록한 바 있는데 연평균 약 21.1% 성장하겠다는 계획이다. 크래프톤은 핵심 캐시카우인 ‘배틀그라운드’ 지식재산권(IP)을 더욱 강화하는 동시에 신규 대작을 매년 지속적으로 선보이며 성장세를 이어간다는 계획이다. 또 인공지능(AI) 기술을 적극 활용해 게임의 재미를 극대화하고 제작 효율성도 끌어올릴 방침이다. 2027년 매출 7조 원 돌파를 목표로 삼은 넥슨과 치열한 경쟁을 벌일 전망이다. 오진호 크래프톤 최고글로벌퍼블리싱책임자(CGPO)는 29일 2분기 실적발표 콘퍼런스콜에서 “2029년까지 매출 7조 원, 기업가치 2배를 중장기 목표로 삼고 있다”며 “기존 IP의 확장과 신규 IP의 성장이 함께 추진돼야 한다""고 밝혔다. 크래프톤은 배틀그라운드 기반의 IP로만 연 매출 4조 원을 달성하겠다는 목표를 제시했다. 이를 위해 인기있는 아티스트 및 콘텐츠와 협업을 지속하는 한편 게임 개발 엔진을 ‘언리얼5’으로 전환하고 있다. 이용자가 직접 콘텐츠를 제작할 수 있는 ‘UGC 알파’도 도입했다. 이를 통해 배틀그라운드를 ‘게임플레이 플랫폼'으로 만들겠다는 구상이다. 아울러 배틀그라운드 IP 기반의 신작도 내놓는다. ‘펍지: 블라인드스팟’이 대표적이다. 크래프톤은 이 게임을 올해 게임스컴에서 선보일 예정이다. 크래프톤은 신규 IP를 육성해 연 매출 3조 원을 이루겠다는 계획이다. 연초 제시한 ‘거대 프랜차이즈 IP’ 확보를 통한 5개년 중장기 계획에 맞춰 총 13개 게임을 포함한 신작 파이프라인을 가동 중이다. 한국 판타지 소설 ‘눈물을 마시는 새’를 기반으로 한 오픈월드 액션 역할수행게임(RPG) ‘프로젝트 윈드리스’, 익스트랙션 슈팅 장르의 ‘프로젝트 블랙버짓’, 해양 생존 어드벤처 ‘서브노티카 2’, ‘팰월드 모바일’ 등을 차기작으로 개발하고 있다. 서브컬처 게임도 개발 중이다. ’K-심즈’로 불리는 인조이를 지속해서 개선한다. 올해 3월 얼리 액세스(앞서 해보기) 버전을 내놓은 인생 시뮬레이션 게임 ‘인조이’는 출시 초반 흥행에 성공했다. 2017년 출시한 ‘펍지: 배틀그라운드’의 경우 출시 16일 만에 판매량 100만 장을 달성했는데, '인조이'는 이를 7일만에 달성했다. 글로벌 시장에서도 주목을 받았다. 크래프톤에 따르면 인조이의 지역별 판매량 비중은 북미 29%, 유럽 28%, 아시아 25% 등으로 서구권 지역이 절반 이상을 차지했다. 새 IP를 확보하기 위해 투자도 활발히 진행하고 있다. 올해 초부터 이달까지 신규 프로젝트를 위한 개발 인력 80명을 확보했다. ‘라스트 에포크’를 제작한 미국 개발사 일레븐스 아워 게임즈, 일본 애니메이션 기업 ADK그룹, 국내 게임사 넵튠 등에도 투자를 단행했다. 크래프톤은 외부 개발사와 공동 개발·육성하는 ‘세컨드 파티 퍼블리싱(2PP)’ 체제도 강화하고 있다. 이달 25일 체험판을 공개한 EF 게임즈의 차량 기반 아레나 배틀 장르 ‘라이벌즈 호버 리그’를 비롯해 다수의 2PP를 추진하고 있다. 이를 통해 내부 개발과 함께 외부 파트너와의 협업까지 아우를 수 있는 구조를 모색할 예정이다. 배동근 최고재무책임자(CFO)는 “최근 국내외 스튜디오 소수 지분 투자도 5건 진행했다""고 설명했다. AI 원천 기술을 개발해 게임 서비스에 적용하겠다는 목표다. AI를 게임 개발 과정 전반에 투입해 생산성을 끌어올리고 이용자에게는 극대화된 재미를 전하겠다는 것이다. 크래프톤은 대규모 언어 모델(LLM)을 기반으로 한 AI 에이전트의 게임 수행 능력을 평가하는 벤치마크 ‘오락'(Orak)을 공개했다. 이를 기반으로 LLM 에이전트 설계 역량의 향상을 도모할 계획이다. 또 SK텔레콤과 공동으로 개발한 포스트 트레이닝(Post-training) 기법을 공개하고, 이를 70억개 파라미터(매개변수) 규모의 오픈소스 추론 특화 언어 모델(Language Model) 3종에 적용한 결과물을 선보였다. 향후 독자적 학습 기법을 적용해 추론 정확도와 효율성을 동시에 확보하고, 고난도 추론이 필요한 게임으로 확장하는 등 게임 AI 기술 고도화에 활용할 예정이다.","김성태 기자","2025-07-30 08:08:18","https://n.news.naver.com/mnews/article/011/0004515075","2025-07-30 AM 09:42:18"
