category_id,category_name,press,title,reporter,date,link,timestamp,content,clean_title
101,경제,문화일보,"워싱턴 간 총수들, 관세협상 ‘키맨’으로 뛰었다",김성훈,2025-07-31 12:14:09,https://n.news.naver.com/mnews/article/021/0002726558,2025-07-31 PM 01:23:53,"대미투자 확대 등 힘 보태 한·미 관세협상이 30일(현지시간) 극적으로 타결된 것과 관련해 이재용 삼성전자 회장과 정의선 현대차그룹 회장, 김동관 한화그룹 부회장 등 주요 대기업 총수들의 측면 지원이 큰 역할을 했다는 평가가 나온다. 이날 재계와 외교가 등에 따르면, 협상 타결 전부터 미국 워싱턴DC에 잇따라 집결한 이 회장 등 주요 기업 총수들은 미 정부 고위급과 접촉하며 정부 협상력에 힘을 보탰다. 특히 ‘대미 투자 확대’ 지렛대를 바탕으로 도널드 트럼프 미 대통령의 요구를 충족시키는 데 긍정적인 역할을 한 것으로 분석됐다. 로이터 등 외신은 이번 협상에 따라 한국이 미국에 투자키로 한 3500억 달러(약 486조 원) 중 1500억 달러가 조선업 협력 부문에 배정됐다고 전했다. 재계 관계자는 “방미한 총수들이 나머지 2000억 달러 투자금 중 일부를 담당했을 가능성이 있다”고 말했다. 재계는 이 회장이 인공지능(AI) 반도체 협력, 미국 텍사스주 테일러 파운드리(반도체 위탁생산) 공장 추가 투자 등을 협상 카드로 제안한 것으로 추정하고 있다. 삼성전자는 최근 약 23조 원에 달하는 테슬라의 AI 칩 A16을 테일러 공장에서 생산하는 계약을 수주했는데, 칩 완성을 위해선 고대역폭메모리(HBM) 등을 연결하는 패키징 시설이 필요하다. 재계는 앞서 지난 3월 백악관에서 트럼프 대통령을 직접 만나 조지아주 생산 시설 확대, 루이지애나 제철소 신설 등 210억 달러 규모 ‘투자 보따리’를 푼 정 회장도 미 정부 고위급과 만나 관세에 따른 국내 완성차 업계의 불안감을 전달했을 것으로 보고 있다.",워싱턴 총수 관세 협상 키맨
101,경제,문화일보,"오전 11시, 3+2 협상 → 오후 4시반, 콜 받고 백악관행 → 오후 6시16분, 트럼프와 담판·타결","박준희, 민병기",2025-07-31 12:13:13,https://n.news.naver.com/mnews/article/021/0002726557,2025-07-31 PM 01:23:53,"■ 긴박했던 막판 관세협상 협상 내용 이견, 수일 줄다리기 29일 구윤철 방미뒤 상환 급변 베선트와의 회담 열리기도 전에 트럼프 면담 이뤄지며 극적 타결 트럼프 “정상아닌 각료급과 협상 내가 한국을 중요시한다는 방증” 트럼프 만나러… 구윤철(오른쪽) 부총리 겸 기획재정부 장관 등이 30일 미국 워싱턴DC 상무부 청사에서 하워드 러트닉 상무장관과 통상 협의를 위해 숙소를 나서고 있다. 아래 사진은 구 부총리 등을 태운 한국 통상협상단 차량이 도널드 트럼프 대통령과의 면담을 위해 백악관 서쪽 출입문 검문소를 통과하는 모습. 연합뉴스 박준희 기자, 워싱턴=민병기 특파원 타국에 비해 ‘진도가 늦다’는 평가를 받아오던 한·미 관세협상이 협상 시한 1일을 남겨 두고 도널드 트럼프 미국 대통령의 발표로 극적 타결되면서 지난 29일 구윤철 부총리 겸 기획재정부 장관의 방미 직후부터 변화 조짐을 보여온 양국 협상 기류가 재조명되고 있다. 구 부총리가 예정에 없던 하워드 러트닉 미 상무장관과 연이어 협의를 진행하며 양국이 입장 차이를 보여오던 협상 카드가 최종 조율된 것으로 풀이된다. 30일(이하 현지시간) 트럼프 대통령의 트루스소셜 게시글과 대통령실의 발표 등을 통해 한·미 관세협상 타결이 공식화되기 전까지만 해도 한·미 간 협상은 31일 예정된 구 부총리와 스콧 베선트 미 재무장관의 협의에서 최종 윤곽이 드러날 것으로 전망돼 왔다. 그러나 양국 경제수장인 재무장관 회담이 열리기도 전에 트럼프 대통령과 한국 협상단의 면담이 이뤄지면서 협상은 극적 타결됐다. 당초 지난 24일 미국 도착 예정이던 구 부총리는 미국 측의 일방적인 일정 취소 통보로 인해 29일에야 미국에 도착했다. 출국 당시 그의 계획은 베선트 장관과의 회담만 공지된 상태였다. 구 부총리 출국 당시만 해도 기재부 관계자는 “협상이란 것은 해봐야 아는 것”이라며 “양국 재무장관 회담이 통상 협상의 최종 담판이 될지는 예상할 수 없는 일”이라고 말했다. 그러나 구 부총리가 미국 땅을 밟은 뒤부터 상황이 급변했다. 그는 미국 도착 직후인 29일 오후 3시에 미 상무부 청사에서 러트닉 장관과 전격적으로 통상 협의를 벌였다. 앞서 러트닉 장관과 접촉을 계속 해오던 김정관 산업통상자원부 장관, 여한구 통상교섭본부장도 배석했다. 그러나 2시간 동안의 협의에서 미국 측은 한국이 제시한 ‘대미 투자 2000억 달러 + α’ 등의 협상 카드보다 더 많은 투자를 요구했다는 관측이 나왔다. 이에 기재부 측은 31일 새벽 “30일 오전 11시 구 부총리, 김 장관, 여 본부장이 러트닉 장관 및 제이미슨 그리어 미 무역대표부(USTR) 대표와 1시간 동안 통상 협의를 했다”고 재차 공지했다. 한국의 협상 3인방과 미국 측 통상 최고위 인사들이 머리를 맞대며 양국 협상 카드를 최종적으로 확정하는 순간으로 풀이된다. 특히 이날 회담 이후 30일 오후 4시 30분쯤 구 부총리 등 한국 협상단이 워싱턴DC 백악관으로 들어가는 현장이 한국 취재진에 포착됐다. 이는 사실상 양국 협상이 타결됐음을 알리는 장면이었다. 협상단은 트럼프 대통령과 만나 30~40분 정도 협상한 것으로 알려졌다. 여 본부장은 “트럼프 대통령이 ‘나는 보통 대통령이나 총리 아닌 다른 나라 협상단과 직접 협상하지 않지만 한국은 특별히 각료급인 당신들과 협상한다는 것은 내가 한국을 굉장히 존경하고 중요시한다는 걸 방증하는 거다’라고 말했다”고 전했다. 김 장관은 “트럼프 대통령이 협상의 달인이라고 느꼈다”며 “트럼프 대통령에게 복잡하지 않고 이해하기 쉽게 설명하라는 여러 조언이 도움이 됐다”고 말했다. 한국 협상단의 백악관 방문 직후 트럼프 대통령은 30일 오후 6시 16분 자신의 SNS인 트루스소셜 등을 통해 “미국이 한국과 완벽하고 완전한 통상 협상에 합의했다”고 발표했다. 한국 대표단을 만난 직후였지만, 양국의 합의 내용을 거의 대부분 SNS 글로 공개했다.",오전 협상 오후 시반 백악 관행 오후 트럼프 담판 타결
101,경제,연합뉴스,"[관세타결] 울산 차업계 ""한숨 돌렸다""…조선업은 시장 확대 기대감","김근주, 허광무",2025-07-31 12:11:20,https://n.news.naver.com/mnews/article/001/0015541009,2025-07-31 PM 01:23:53,"'지역 경제 중추' 수출 타격 일부 회복 전망…상공계 ""한시름 덜었다"" 수출 앞둔 자동차 [연합뉴스 자료사진] (울산=연합뉴스) 허광무 김근주 기자 = 대미 수출 관세 인하와 조선업 투자를 골자로 한 한미 무역협상이 타결됐다는 소식이 31일 전해지자 '자동차·조선업 도시' 울산에선 안도의 목소리가 나오고 있다. 지역 자동차 업계는 미국에 수출하는 자동차 관세가 25%에서 15%로 낮아지게 되자 ""한숨 돌렸다""는 반응이다. 미국 시장 진출의 문이 넓어지는 지역 조선 업계는 호황기 속에 ""새로운 기회가 또 생겼다""는 분위기다. 울산 자동차업계 ""이익 급감해도 버텨왔는데 다행"" 울산의 자동차 업계 관계자는 한미 무역협상 타결과 관련, ""이제 겨우 한숨 돌릴 수 있겠다""는 한 마디로 심정을 표현했다. 지난 4월부터 미국에 수출하는 자동차에 25%의 품목별 관세가 부과되면서 크게 줄어든 순이익이 다소 회복할 것으로 기대되기 때문이다. 업계 관계자는 ""관세 부과 이전에 미국으로 수출했던 재고 물량이 소진되면서 이제 미국 소비자에게도 차량을 가격을 올려서 판매하는 것이 불가피한 시기에 관세가 낮아졌다""며 ""가격 경쟁력을 방어할 수 있는 여유가 생길 것""이라고 말했다. 국내 최대 완성차 생산기지인 현대자동차 울산공장도 이번 관세 인하로 생산 현장이 바빠질 것으로 예상한다. 이번주 여름휴가로 울산 5개 공장의 가동이 멈춘 상태이지만, 다음 주 직원들이 일터로 복귀하면 관세 인하에 호응하는 생산계획 등을 논의할 것으로 보인다. 현대차 울산공장에선 팰리세이드, 투싼, 제네시스 등 대표 차종 대부분을 연간 152만대 생산할 수 있으며, 연간 110만대 이상을 미국을 포함한 200여 개 나라에 수출하고 있다. 한국무역협회 울산지역본부에 따르면 지난해 울산의 대미 자동차 수출은 150억달러로, 울산 전체 수출액(881억달러)의 17%를 차지했다. 그만큼 자동차가 울산 경제에서 차지하는 비중이 크다. HD현대중공업 전경 [HD현대중공업 제공. 재판매 및 DB 금지] 지역 조선업계 ""미국 시장, 호황 이어갈 새로운 기회"" 지역 조선 업계는 기대감을 한껏 드러내고 있다. 이번 협상에서 한국이 미국에 투자하기로 한 3천500억달러(약 487조원) 중 1천500억 달러가 조선 협력에 쓰이기 때문이다. 한 조선업체 관계자는 ""최근 수주가 회복돼 조업 현장이 바삐 돌아가는 중에 또 새로운 기회가 생겼다""며 ""무엇보다 구체적인 투자 금액이 나와 불확실성이 사라진 것이 큰 의미를 지닌다""고 평가했다. 다만, 1천500억 달러의 자금 조달과 세부 집행 계획을 마련해야 하는 후속 절차가 남아 있다. 국내 최대 규모 조선업체인 HD현대중공업은 이번 무역협상의 파급효과를 따져 대응책을 마련할 방침이다. 미국법상 아직 한국 등 외국에서 미국에 함정이나 군함 등을 수출할 수 없게 돼 있는데, 이번 협상의 후속 조치로 미국 내부에서 어떤 변화가 생길지도 업계에선 관심사다. 현대차 울산공장 근로자들 [연합뉴스 자료사진] 울산 상공계 ""일본과 관세율 같아져 긍정적"" 울산 상공계도 긍정적인 반응을 보인다. 미국이 25% 관세를 유지한다면 자동차 생산은 물론이고 전후방 연관 산업까지 큰 타격을 입을 수 있다는 우려가 컸기 때문이다. 울산지역 상공계는 관세 15%가 만족스러운 수준은 아니지만, 일본과 동일해졌다는 점에서는 긍정적으로 평가하고 있다. 조선업과 관련해선 역시 기대가 크다. 조선업 분야 투자금액이 명시된 만큼 예측 가능한 수준에서 수주와 선박 건조, MRO(유지·보수·정비), 기자재 등 조선업 생태계 전반의 활성화를 기대할 수 있다는 것이다. 최진혁 울산상공회의소 경제총괄본부장은 ""관세와 관련해 미국과 우리나라 발표에서 상호 차이가 나는 부분이 있는데, 앞으로 예고된 한미 정상회담에서 구체적인 결정이 있을 것으로 보인다""고 전망했다. 그러면서 ""울산의 경우 자동차는 한시름 덜었고 조선도 활성화가 기대되지만, 철강과 알루미늄 등 품목별 관세에 대한 정확한 관세율을 지켜봐야 하는 상황""이라고 말했다. canto@yna.co.kr",관세 타결 울산 업계 한숨 조선업 시장 확대 대감
101,경제,문화일보,민감한 쌀·소고기 놓고 엇갈린 한·미… 과제로 남은 ‘세부 조율’,"장상민, 박준희",2025-07-31 12:09:25,https://n.news.naver.com/mnews/article/021/0002726554,2025-07-31 PM 01:23:53,"■ 美 “완전개방” … 韓 “추가없다” 김용범 “정치지도자 표현일 것” ‘시장 지켰다’ 핵심성과로 꼽아 美, 또 어떤 요구할지 예측불가 미국산 과일 수입 논의 가능성 전국한우협회 회원들이 30일 서울 종로구 주한미국대사관 앞에서 ‘30개월령 이상 소고기 수입 개방 반대’ 기자회견을 하고 있다. 연합뉴스 그래픽 = 전승훈 기자 30일(현지시간) 도널드 트럼프 미국 대통령의 발표로 극적 타결된 한·미 관세 협상에서 농축산물 분야는 ‘선방했다’는 평가가 나오는 가운데 세부 내용에 있어 한·미 양국의 설명이 미묘한 차이를 노출해 여전히 논란의 여지가 있다는 지적이 나온다. 트럼프 대통령은 사실상 ‘완전한 시장 개방’이라는 취지로 언급했으나 한국 측은 이번 협상 결과에서 추가로 개방하는 품목은 없다고 강조했다. 정부는 이번 협상의 핵심 성과 중 하나로 농축산물 시장을 지켜낸 것을 꼽고 있지만 향후 미국이 어떤 요구를 해올지 예측하기 어려운 상황이다. 트럼프 대통령은 이날 양국 협상 타결을 알리는 자신의 트루스소셜 게시글에서 “한국은 무역에 있어 미국에 완벽하게 개방(completely open)하는 데 합의했다”며 “한국은 자동차와 트럭, 농축산물 등 미국의 제품을 받아들일 것”이라고 밝혔다. 반면 김용범 대통령실 정책실장은 협상 결과에 관한 브리핑에서 “미국과의 협의 과정에서 농축산물 시장 개방에 대한 강한 요구가 있었던 것이 사실”이라면서도 “그러나 식량 안보와 농업의 민감성을 감안해 국내 쌀과 소고기 시장은 추가 개방하지 않는 것으로 합의했다”고 밝혔다. 협상단은 트럼프 대통령에게 광우병 파동 당시 시위 사진을 보여주며 설득한 것으로 알려졌다. 일각에서는 쌀·소고기 시장을 지키기 위해 사과 등 미국산 과일 같은 품목에 대한 수입 여부가 논의될 수도 있다는 관측이 나온 바 있으나 이 역시 이번 협상 결과에 포함되지 않았다. 협상 결과를 놓고 보면 앞서 농축산물 수입이나 시장 개방 확대를 약속한 타국에 비해 한국은 선방한 것이라고 평가할 수 있다. 당초 정부는 미국과의 협상타결을 위해 반드시 지켜야 할 ‘레드라인’으로 설정한 쌀·소고기 시장 개방까지 ‘협상카드’ 중 하나로 고민한 것으로 알려졌다. 또 국내에서 관계 당국 간 협의에서도 이들 품목에 대한 수입 확대나 시장 개방 확대를 두고 당국자 간의 고성이 오갈 정도로 격렬한 논의가 이뤄진 것으로 전해졌다. 그럼에도 불구하고 정부는 만약 농산물 시장 개방 확대 카드를 써야 할 경우 ‘연료용 농산물’ 수입확대 등 국내 농가에 타격이 없는 방향으로 한다는 방침을 세워온 것으로 알려졌다. 바이오에탄올용 옥수수 같은 경우 현재도 수입이 가능하고 옥수수의 경우 자급률이 0.7%에 불과해 우리 농가에 미치는 영향이 거의 없기 때문이다. 그럼에도 트럼프 대통령이 시장 개방의 범위 중 하나로 농축산물을 거론한 것에 관해 김 실장은 “정치 지도자의 표현으로 이해한다”고 설명했다. 한국의 대미 농축산물 수입 시장은 한·미 자유무역협정(FTA)으로 인해 이미 99.7% 개방돼 있는데 이를 트럼프 대통령이 ‘완벽한 개방’으로 언급했다는 설명이다. 나머지 0.3%에 해당하는 10여 개 품목에 대해서는 논의가 유보돼 있다. 한편 농림축산식품부 측도 구체적인 내용을 파악 중이다. 농식품부 관계자는 “(협상단으로부터) 쌀·소고기 등은 추가 개방하지 않는 것으로 전달받았다”며 “그 외 세부 사항은 파악 중”이라고 말했다.",소고기 과제 세부 조율
101,경제,서울경제,삼성물산 시공능력평가 12년 연속 1위,박형윤,2025-07-31 12:04:30,https://n.news.naver.com/mnews/article/011/0004515702,2025-07-31 PM 01:23:53,"[서울경제] 삼성물산이 건설회사 시공 능력 평가에서 12년 연속 1위를 차지했다. 국토교통부는 전국 7만3657개 건설사를 대상으로 한 '2025년도 시공 능력 평가' 결과를 31일 공개했다. 올해 1위는 시공능력평가액 34조7219억 원을 기록한 삼성물산이다. 삼성물산은 시공능력평가 5개 항목(시공능력평가액·공사실적평가액·경영평가액·기술능력평가액·신인도평가액) 가운데 기술능력평가액을 제외하고 모두 1위를 기록하면서 2014년부터 12년째 1위를 지켰다. 현대건설과 대우건설의 시공능력평가액은 각각 2위와 3위를 차지했다. 4위와 5위는 각각 DL이앤씨와 GS건설 이다. 두 회사는 지난해 대비 한 단계씩 순위가 상승했다. 반면 올해 중대 재해 사고가 잇달아 발생해 신규 수주를 위한 활동을 잠정 중단한 현대엔지니어링은 지난해 4위에서 올해 6위로 순위가 두 단계 하락하면서 5대 건설사에서 밀려났다. 포스코이앤씨는 7위, 롯데건설은 8위, SK에코플랜트는 9위, HDC현대산업개발은 10위로 지난해와 순위가 같았다. 한화, 호반건설, DL건설, 두산에너빌리티 또한 각각 11∼14위를 차지하면서 작년과 비교해 순위 변동이 없었다. 올해 시공 능력 평가 상위 100개사 중 순위 변동이 가장 큰 곳은 76위 미래도건설로, 1년 새 172단계 뛰었다. 순위 하락 기준으로 변동이 가장 큰 건설사는 58위의 아이에스동서로 같은 기간 37단계 떨어졌다.",삼성 물산 시공 능력 평가 연속
101,경제,연합뉴스,"[관세타결] 포항 철강기업, 50% 관세 유지 부담…""하반기 악영향 우려",손대성,2025-07-31 12:00:55,https://n.news.naver.com/mnews/article/001/0015540948,2025-07-31 PM 01:23:53,"업황 불황 이어 관세부담까지 '이중고'…""정부와 소통하며 대응책 마련"" 포항 이차전지 소재기업도 관세 영향 예의주시…""관련 동향 파악 중"" 포스코 포항제철소 1고로(오른쪽)와 2고로 [촬영 손대성] (포항=연합뉴스) 손대성 기자 = 한미 간 관세협상이 타결됐지만 철강 분야는 50% 관세가 유지되면서 경북 포항지역 철강기업들이 어려움을 겪을 것으로 보인다. 일부 기업은 불황으로 구조조정에 들어간 상황에서 관세까지 우호적인 않은 상황에 놓이면서 우려감을 나타내고 있다. 포스코 등 철강기업들은 정부와 긴밀히 소통하면서 향후 대응책을 마련한다는 계획이다. 에코프로 등 이차전지 기업들도 이번 관세협상이 업계에 미칠 영향을 예의주시하고 있는 분위기다. 31일 업계와 포항시 등에 따르면 한국과 미국은 이날 발표한 무역협상에서 철강·알루미늄 등에 대한 관세와 관련해 합의점을 찾지 못했다. 이에 따라 미국이 지난달 4일 외국산 철강·알루미늄 제품 관세율을 25%에서 50%로 올린 상태가 유지된다. 포항 주력산업체인 철강기업은 관세가 50%여서 직접 수출 타격뿐만 아니라 산업 경쟁력 약화 부담을 안고 있다. 포스코는 관세 영향이 본격화되는 하반기에는 수출에 악영향이 있을 것으로 보고 있다. 포스코 관계자는 ""향후 양국 철강관세 협상과 관련해 정부와 긴밀히 소통해 나갈 계획""이라고 밝혔다. 현대제철 [촬영 손대성] 현대제철 역시 이미 경영난으로 구조조정에 들어간 상태에서 미국에서 한국산 철강 입지가 좁아질 것으로 예측한다. 이 회사는 충남 당진 사업장에서 생산한 냉연제품을 비롯해 차량용 강재를 미국에 수출하고 있다. 포항공장의 경우 '롤' 제품을 미국으로 수출하고 있지만 철강제품 분류에서는 빠져 당장 타격은 없는 상황이다. 현대제철 관계자는 ""회사 전체로 봐서는 타격이 예상되지만 포항공장으로 봐서는 직접적인 타격은 없다""고 전했다. 에코프로 [촬영 손대성] 포항의 또 다른 주력산업으로 떠오른 이차전지 소재의 경우 직접적인 미국 수출 물량이 없어서 영향이 제한적이다. 에코프로 그룹 경우 양극재 등 이차전지 소재를 만들어 전부 SK온이나 삼성SDI 등 국내 이차전지 기업에 납품하고 있다. 다만 SK온이나 삼성SDI 등이 외국에 수출할 경우 납품 물량이 수출 물량으로 잡힌다. 이에 따라 에코프로는 미국 관세가 한국 이차전지 기업에 미칠 영향을 지켜보는 상태다. 에코프로 관계자는 ""미국 관세가 회사에 미치는 영향은 제한적이라고 할 수 있지만 관련 흐름을 파악하고 있다""고 말했다. sds123@yna.co.kr",관세 타결 포항 철강 기업 관세 유지 부담 하반기 영향 우려
101,경제,문화일보,"관세 리스크 해소에… 코스피, 소폭 상승 뒤 ‘숨 고르기’","박정경, 박상훈",2025-07-31 12:00:18,https://n.news.naver.com/mnews/article/021/0002726532,2025-07-31 PM 01:23:53,"장 초반 3250대 등락 ‘혼조’ 차 4%대 하락·조선 5%대 상승 코스피 더 오를까 한·미 관세 협상 타결 소식이 전해진 31일 오전 코스피가 0.65% 상승 출발한 가운데 서울 중구 하나은행 딜링룸에서 관계자들이 주가와 환율 상황을 살펴보고 있다. 문호남 기자 한·미 관세 협상 타결 소식에 31일 코스피가 상승 출발했으나 장 초반 3250대에서 등락하며 혼조세를 보이고 있다. 특히 자동차 관세 15% 부과에 대한 실망감이 나타나면서 관련 종목들이 상대적으로 크게 하락하고 있다. 한국거래소에 따르면 이날 코스피는 전 거래일보다 0.65%(21.31포인트) 오른 3275.78로 출발해 오전 11시 현재 3252.33을 기록하고 있다. 지수는 개장 이후 잠시 하락 전환했다 상승세로 돌아섰으나, 다시 하락세로 전환하는 등 변동성을 보이고 있다. 유가증권시장에서 개인과 외국인이 각각 2014억 원, 1210억 원 순매수하고 있으며, 기관은 3758억 원 매도 우위를 보였다. 코스닥 지수는 전 거래일보다 0.32%(2.54포인트) 상승한 806.21에 거래를 시작, 오전 11시 기준 805.04를 기록하고 있다. 이날 원·달러 환율은 1390.0원으로 출발한 뒤 오전 11시 1389.10원으로 하락했다. 이날 국내 증시는 한·미 협상 타결 소식에 큰 폭의 증시 상승을 기대하는 분위기도 있었으나 코스피가 전날까지 6거래일 연속 올라 한·미 협상 타결 기대를 선반영한 만큼 이벤트 소멸 심리에 상승 폭이 제한되는 분위기다. 업종별로는 관세 영향을 피한 조선이 오전 11시 기준 전일 대비 5.33% 상승했다. 반면 자동차 관세 15% 부과에 대한 실망감이 나타나면서 자동차 업종은 -4.65%의 하락세를 보이고 있다. 현대차가 전 거래일 대비 4.48% 오른 23만3000원으로 출발했지만 차익 실현 매물이 쏟아지면서 3.3% 하락 수준으로 밀려났다. 한편, 각국 외신들은 이날 한국과 미국의 관세 협상 타결 소식을 속보로 전했다. 미 정치전문매체 폴리티코는 이번 합의를 두고 “새롭게 선출된 이재명 대통령의 국내 정치적 조기 승리를 의미한다”고 평가했다. 워싱턴포스트(WP)는 3500억 달러(약 487조 원) 규모의 대미투자펀드 중 1500억 달러가 미국의 조선 산업에 투자된다는 점과 한국이 세계 2위의 조선 강국이라는 점을 부각하며 향후 한·미 경제협력의 핵심 산업으로 조선업이 떠오를 것이라고 전망했다. 다만 블룸버그통신은 이번 합의와 관련해 “한·미 양측이 서로 다른 해석을 내놓고 있다”며 향후 합의 이행 시 갈등 가능성을 지적했다.",관세 리스크 해소 코스피 상승
