category_id,category_name,press,title,reporter,date,link,timestamp,content,clean_title
101,경제,연합뉴스,"[관세타결] 온플법·지도반출 제외…업계 ""일단 지켜봐야","김경희, 조성미",2025-07-31 10:50:03,https://n.news.naver.com/mnews/article/001/0015540588,2025-07-31 PM 01:23:53,"미국 하원 문제제기 '온라인플랫폼법' 관세협상 대상 빠져 고정밀 지도 반출 문제도 테이블 안올라…""안보 문제 확실히 한것"" 네이버 성남 본사 [연합뉴스 자료 사진. 재판매 및 DB 금지] (서울=연합뉴스) 김경희 조성미 기자 = 한미 관세 협상이 전격 타결된 31일 핵심 통상 이슈를 제외하고 온라인플랫폼법 등 그간 협상 대상으로 거론된 상당수 주제가 대상에서 빠진 것을 놓고 플랫폼 업계는 일단 지켜보자는 분위기다. 당장 이날까지 시한으로 못 박았던 관세 문제를 일단락짓는데 방점이 있다 보니 이번 논의에는 포함되지 않았지만 앞으로 한미 정상회담 등 후속 일정이 남아있는 만큼 향후 논의 과정을 지켜봐야 한다는 신중론에 무게가 실린 셈이다. 한 관계자는 연합뉴스와 통화에서 ""온라인플랫폼법의 경우 미국 의회에서 먼저 이슈를 제기했던 사안이고, 우리 정부에서도 입법 움직임 자체를 관세 협상을 앞두고는 아예 보류했던 게 사실""이라며 ""이번에도 이야기는 나왔지만 테이블에는 올라가지 않은 것인데 앞으로 상황을 면밀하게 봐야 하지 않겠느냐""고 말했다. 온라인플랫폼법은 이재명 대통령의 핵심 대선 공약 가운데 하나로 거대 온라인 사업자의 시장 지배력 남용을 막기 위해 수수료 제한, 불공정 행위 금지, 계약 투명성 강화, 분쟁 조정 기구 설치. 시장 지배적 플랫폼 규제 및 사전 지정 등 내용 등을 망라하고 있다. 지난 21대 국회에서도 추진됐지만 안팎의 논란으로 입법이 무산됐고, 이번 정부 들어서도 정부 출범 초기부터 강력하게 드라이브를 걸다 트럼프 행정부가 이 문제를 포함해 망 사용료 문제 등을 '디지털 교역 장벽'으로 여러 차례 지적하며 동력 상실 우려가 제기된 게 사실이다. 특히 미국 연방 하원 43명이 이달 초 트럼프 협상팀에 한국의 온라인 플랫폼법 문제 해결을 촉구하는 서한을 보내며 핵심 쟁점으로 부상하기도 했다. 업계 안팎에선 이번 발표 대상에서 제외된 만큼 법 추진 동력이 소실됐다고 보기는 어렵지만, 이후 후속 논의가 남아있는 만큼 향후 전개 및 결론을 쉽게 예측하기는 어렵다며 상황을 주시하는 분위기다. 구글 로고 [로이터 연합뉴스 자료 사진. 재판매 및 DB 금지] 관세 협상의 또 다른 쟁점으로 지목된 구글 등 빅테크에 대한 고정밀 지도 반출 문제 역시 이번에는 논의되지 않은 것으로 알려졌다. 김용범 대통령실 정책실장은 이날 긴급 브리핑에서 고정밀지도 데이터 반출 문제나 방위비 문제, 무기 수입 협상 등에 대해서는 ""이는 별개의 이슈로, 이번 협상 결과에는 포함되지 않았다""며 ""온라인플랫폼법·인공지능(AI) 칩 및 그래픽처리장치(GPU) 구매 요구 등도 없었다""고 밝혔다. 업계 안팎에선 고정밀지도 데이터 반출의 경우 이번에 우리 정부가 안보 문제로 구분 짓는 것이 확인된 만큼 향후 반출이 쉽지 않을 것이란 관측을 내놓는다. 앞서 구글은 지난 2월 한국 정부에 1대5천 고정밀 지도 데이터의 해외 반출을 9년 만에 다시 요청했다. 정부는 그간 안보 문제를 앞세워 고정밀 지도 해외 반출을 불허해왔으며, 이번 요청에 대해서는 일단 결정을 유보하고 내달 11일 결론을 내기로 했다. 이 문제 역시 미국 정부에서 관세 협상의 핵심 현안으로 지목한 사안이기도 하다. 국내 플랫폼업계 관계자는 ""지도나 방위비 문제의 경우 안보는 거래 대상이 될 수 없다는 방침을 확실히 정하고 협상에 임한 것 아니겠느냐""며 ""그런 부분에서는 반출 결정이 쉽지는 않을 것으로 보고 있다""고 말했다. 요청 당사자인 구글측은 ""8월 11일 결정을 기다리고 있으며, 정부로부터 통보받은 내용은 없다""며 상황을 지켜보고 있다는 입장만 확인했다. 미국과 유럽연합(EU) 관세 협상에서 EU가 철회 입장을 명시해 주목받은 망 사용료 문제 역시 이번 협상에선 제외됐다. 통신업계에서는 SK브로드밴드(SKB)와 넷플릭스 간의 망 사용료 소송 이후 잠잠해진 미국 빅테크와 망 사용료 이슈가 이번 관세 협상에서 불거지지 않은 것에 안도하는 분위기다. 한 업계 관계자는 ""유럽에서 망 사용료 분쟁은 실제로 미국 빅테크 기업에게 부담이 될 정도로 규모가 크고 중요한 현안인 건 맞지만 한국 시장에서는 상대적으로 규모가 크지 않아서 논의 대상에서 제외된 것 아니었을까 본다""고 말했다. kyunghee@yna.co.kr",관세 타결 법 지도 반출 제외 업계 일단
101,경제,서울경제,"서울, 8월 아파트 분양 351가구에 그쳐"" [집슐랭]",박경훈,2025-07-31 10:49:13,https://n.news.naver.com/mnews/article/011/0004515648,2025-07-31 PM 01:23:53,"부동산R114 8월 지역별 분양 물량 집계 전국 아파트 2만 8765가구 공급 예정 서울은 제기동아이파크 351가구만 분양 서울 시내의 아파트 단지들 모습. 연합뉴스 [서울경제] 다음 달 서울 아파트 분양 물량이 351가구에 그치는 것으로 나타났다. 새 정부 출범 후 첫 3기 신도시 본청약이 경기 남양주 왕숙지구에서 이뤄지며 주목된다. 31일 부동산R114에 따르면 8월 전국에서 37개 단지, 총 2만 8765가구(임대 포함) 분양이 이뤄질 예정이다. 7월(2만 7534가구)과 분양 물량은 비슷한 수준이다. 지난해 같은 기간(1만 6974가구)과 비교하면 1만 가구 이상 많은 규모다. 수도권 8월 분양 예정 물량은 총 1만 7229가구로 경기 1만 4884가구, 인천 1994가구, 서울 351가구 순이다. 1000가구 이상의 대단지는 경기 광명시 철산동 ‘철산역자이‘(2045가구), 안양시 만안구 안양동 ‘안양자이헤리티온’(1716가구), 인천시 강화군 선원면 ‘강화2지역주택조합‘(1325가구)이 분양 예정이다. 경기 남양주 왕숙지구의 ‘남양주왕숙A1, A2’(1030가구)는 새 정부 출범 후 첫 3기 신도시 본청약으로 주목받는다. 서울에서는 동대문구 제기동 ‘제기동역아이파크’(351가구) 1개 단지가 분양에 나선다. 지방에서는 건설사들이 분양 성과를 위해 사업성이 우수한 단지를 중심으로 선별 분양에 나서고 있다. 지방의 분양 물량 1만 1536가구 중 부산 3277가구, 충북 2351가구, 강원 1714가구, 경남 1428가구 순으로 물량이 많다. 주요 분양 단지는 부산 강서구 강동동 ‘에코델타시티푸르지오트레파크’(1370가구), 충북 청주시 사직동 ‘청주센텀푸르지오자이’(2271가구), 경남 김해시 신문동 ‘김해신문1지구공동주택2차’(695가구), 강원 원주시 무실동 ‘원주역우미린더스텔라’(927가구) 등이 있다. 부동산R114는 분양 물량이 특정 지역에 집중됐고 서울 등 수도권은 대출 규제 등의 영향으로 분양 일정이 조정됐다고 설명했다. 부동산R114 관계자는 “수도권은 분양가 상한제가 적용되는 일부 핵심지에서 상대적으로 높은 관심이 이어질 것”이라며 “8월 분양시장은 휴가철과 여름 비수기가 맞물려 수요층의 청약 집중도가 낮아질 우려로 분양 시기를 조율하는 단지가 늘어날 수 있다”고 설명했다.",서울 아파트 분양 가구 집슐랭
101,경제,파이낸셜뉴스,안팔리는 중국제품 밀려올 유럽... 내년 물가 2% 이하 우려,윤재준,2025-07-31 10:48:20,https://n.news.naver.com/mnews/article/014/0005385255,2025-07-31 PM 01:23:53,"독일 만하임의 라인-네카르 항만에 콘테이너들이 쌓여있다.EPA연합뉴스 [파이낸셜뉴스] 유로존(유로 사용 20개국)이 미국의 관세로 수출이 막힌 중국의 과잉생산된 저가 제품들이 밀려올 경우 물가를 크게 끌어내리는 것을 경계하고 있다. 30일(현지시간) 파이낸셜타임스(FT) 등 외신은 값싼 중국산 제품들이 밀려올 경우 내년에 유로존 물가가 유럽중앙은행(ECB)의 목표인 2% 이하로 떨어질 수 있는 것을 우려하고 있다고 보도했다. 미국과 무역 협상 중인 중국은 미국이 유럽연합(EU) 등과 무역 합의 타결을 한 것에서 나타났듯이 미국으로 수출할 제품이 높은 관세를 받을 것으로 예상되고 있다. ECB 이코노미스트들은 블로그에 “유로존에 내년에 중국으로부터의 수입이 최대 10%까지 증가할 수 있다며 이것은 이 지역 전체 소비재의 1.3%를 차지할 규모”라고 적었다. 또 이같은 수입 증가를 시장이 흡수하기 위해서는 전체 수입 가격이 1.6%, 비에너지 산업재는 최대 0.5%p 떨어져야 한다고 이들은 분석했다. ECB는 지난달 공개한 물가 보고서에서 내년 평균 물가상승률이 유로화 강세와 에너지 가격 하락에 힘입어 1.6%를 전망했다. 그러나 미국이 중국산 수입품에 100% 관세를 부과해 팔 수 없게된 상품들이 유럽으로 밀려올 경우 내년 유로존 물가를 0.15%p 추가로 끌어내릴 것으로 ECB 전문가들은 보고 있다. 이코노미스트들은 물가가 시나리오처럼 현실화되지 않을 수 있다면서도 물가상승(인플레이션)이 올해 1.6%까지 떨어질 것으로 전망되는 상황에서 추가 하락 가능성을 반가워하지 않고 있다. 현재 미국은 중국산에 145%, 중국은 미국산에 125% 관세 부과를 유예하면서 협상 중이다. 지난 5월 두나라는 90일간 부과를 미루면서 협상을 통해 포괄적인 무역 합의를 위해 협상해왔다. 지난 29일 공개된 2·4분기(4~6월) 유로존 경제는 무역 전쟁에도 불구하고 0.1% 성장하면서 기대치 0%를 상회했다. 독일 코메르츠방크 이코노미스트들은 고객 노트에서 유로존의 개인 소비가 회복세를 보이고 있어 올해 경제 성장률이 6월 전망치인 0.9%보다는 높을 것이며 금리 추가 인하 가능성도 높아졌다고 밝혔다. ECB 이코노미스트들은 중국산 수입 증가가 통화정책에 미칠 전망은 내놓지 않았으나 물가가 떨어질 경우 ECB의 기준금리를 추가로 인하할 구실을 제공할 것으로도 보고 있다. ECB는 지난주 열린 통화정책회의에서 금리 2%를 동결했다.",중국 제품 유럽 내년 물가 이하 우려
101,경제,동아일보,검단신도시 연내 4200가구 공급… 전량 공공택지 분상제 적용,황소영,2025-07-31 10:46:14,https://n.news.naver.com/mnews/article/020/0003651612,2025-07-31 PM 01:23:53,"올해 인천 검단신도시에서 총 4개 단지, 약 4200가구 규모의 신규 아파트 분양이 예정돼 있다. 공공택지에 해당돼 분양가상한제가 적용되며 최근 교통 인프라 개선 효과가 더해져 실수요자 중심의 청약 수요가 집중될 것으로 전망된다. 부동산정보업체 부동산인포에 따르면 검단신도시에서는 계룡건설(엘리프 검단 포레듀), 대우건설·동부건설(AB8블록), 중흥토건(AA17블록), 라인건설(AA36블록) 등 총 4곳에서 올해 4200가구가 분양될 계획이다. 검단신도시는 인천 서구 원당·당하·불로·마전동 일대에 조성 중인 대규모 택지개발지구로 총 7만5000여 가구가 계획된 지역이다. 면적은 약 1110만9000㎡이며, 현재 입주율은 43.7% 수준이다. 특히 지난 6월 28일 인천도시철도 1호선 검단 연장선의 개통되면서 서울지하철 7호선 및 공항철도와의 연계가 가능해지면서 접근성이 크게 개선됐다. 향후 수도권광역급행철도(GTX)-D 노선과 서울지하철 5호선 연장선 등도 추진 중이다. 이러한 교통 개선과 함께 공공택지의 분양가상한제 적용으로 공급가가 인근 시세 대비 상대적으로 낮아 실수요자 중심의 청약 경쟁이 이어지고 있다. 지난 7월 공급된 ‘검단호수공원역 중흥S-클래스’는 특별공급 제외 522가구 모집에 7269건의 청약이 접수돼 평균 경쟁률 13.9대 1을 기록하며 1순위에서 마감됐다. 8월에는 계룡건설이 마전동 398-2번지 일대(AA32블록)에 ‘엘리프 검단 포레듀’를 분양한다. 이 단지는 지하 3층지상 15층, 11개 동, 전용 64~110㎡, 총 669가구 규모로 소형 평면부터 펜트하우스까지 다양한 주택형이 구성된다. 분양가상한제 적용 단지로 비교적 합리적인 분양가가 기대되며 정부의 대출 규제에서도 일부 자유로운 조건이 적용된다. 9월에는 대우건설과 동부건설이 AB8블록에 1564가구를 공급할 예정이며 하반기 중으로 중흥토건이 AA17블록에서 1398가구, 라인건설이 AA36블록에서 569가구를 분양할 계획이다. 권일 부동산인포 리서치팀장은 “검단신도시는 현재 교통·생활 인프라가 빠르게 확충되고 있다”면서 “분양가상한제가 적용되는 가운데 분양가가 상대적으로 안정돼 있어 실수요자들의 관심이 이어질 가능성이 높다”고 설명했다.",신도시 연내 가구 공급 전량 택지 상제 적용
101,경제,헤럴드경제,"또 다른 ‘황제’ 즉위…한화에어로스페이스, 장중 100만원 돌파 ‘황제주’ [종목Pick]",신동윤,2025-07-31 10:42:31,https://n.news.naver.com/mnews/article/016/0002507720,2025-07-31 PM 01:23:53,"[챗GPT를 사용해 제작함] [헤럴드경제=신동윤 기자] 국내 증시 방산 ‘대장주’ 한화에어로스페이스 주가가 31일 2분기 시장 기대치를 웃도는 실적에 힘입어 100만원을 넘어서며 ‘황제주’에 올랐다. 이날 오전 10시 24분 기준 한화에어로스페이스는 전장 대비 2만5000원(2.56%) 오른 100만2000원에 거래 중이다. 장중 한화에어로스페이스 주가는 103만5000원까지 오르기도 했다. 현재 국내 증시에서 한화에어로스페이스를 포함해 100만원을 넘는 종목은 삼양식품, 효성중공업, 태광산업, 삼성바이오로직스 등 5개 종목이다. 이날 장중 한화에어로스페이스는 연결 기준 올해 2분기 영업이익이 8644억원으로 지난해 동기보다 156.3% 증가한 것으로 잠정 집계됐다고 공시했다. 이번 영업이익은 연합인포맥스가 집계한 시장 전망치 6539억원을 32.2% 상회했다. 매출은 6조2735억원으로 작년 동기 대비 168.7% 증가했다. 순이익은 2877억원으로 79.9% 늘었다. 지난달 UAE 아부다비에서 열린 ‘IDEX 2025’에 설치된 한화에어로스페이스와 한화시스템의 통합전시관 전경. [한화시스템 제공] 영업이익은 2분기 기준으로 역대 최대치이며, 매출은 모든 분기를 통틀어서 분기별 최대 실적이다. 사업별로 지방 방산 부문은 매출 1조7732억원, 영업이익 5543억원으로 지난해 같은 기간보다 각각 33%, 113% 늘었다. 특히 다연장 로켓 천무 공급에 힘입어 해외 매출이 전년 동기대비 43% 상승한 1조834억원을 나타냈다. 항공 사업은 매출(6489억원)이 20% 늘었지만, 영업에서는 120억원 손실을 내 적자로 전환됐다. 한화오션은 상선사업부의 고수익 액화천연가스(LNG)선 판매 확대로 매출 3조2941억원, 영업이익 3717억원을 달성했다. 한화시스템은 매출 7682억원, 영업이익 335억원으로 집계됐다. 한화에어로스페이스 관계자는 “2분기는 지상방산 부문 실적 호조와 한화오션의 안정적 실적에 힘입어 견조한 성장을 이어갔다”면서 “하반기는 중동과 유럽 등을 중심으로 수주를 확대하고 누리호 4차 발사의 성공을 통해 새로운 미래 성장동력을 확보해 나가겠다”고 말했다. 금융정보업체 에프앤가이드에 따르면 한화에어로스페이스 목표주가 컨센서스는 104만6824원이다. 목표주가 중 가장 높은 수치는 한국투자증권이 제시한 130만원이다. NH투자증권·미래에셋증권이 120만원, LS증권·교보증권·한화투자증권·키움증권이 110만원을 목표주가로 내놓았다.",다른 황제 즉위 한화 에어로 스페이스 장 만원 돌파 황 제주 종목
101,경제,KBS,"자동차는 ‘안도’, 쌀·소고기는 “개방 안 해”",이정민,2025-07-31 10:41:16,https://n.news.naver.com/mnews/article/056/0012000085,2025-07-31 PM 01:23:53,"[앵커] 품목별로는 어떤 영향을 받는지도 살펴보겠습니다. 15%까지 관세율이 내려간 자동차는 일단 안도하는 분위기입니다. 가장 민감했던 농축산물은 쌀과 소고기는 추가개방하지 않는데 합의했다고 정부는 밝혔습니다. 이정민 기자입니다. [리포트] 그간 대미 수출에 25% 관세율을 적용받아왔던 자동차. 이번 협상으로 관세율이 15%로 낮아지며, 일본, 유럽연합과 관세율이 같아졌습니다. 한국으로선 관세율이 경쟁국들보다 높을 경우 입게 될 막대한 피해에 대한 우려를 일단 덜게 됐습니다. 다만 트럼프 정부 이전 일본과 유럽연합산 자동차 관세가 2.5%, 우리는 FTA로 무관세였던 걸 감안하면, 아쉬운 부분이라고 정부는 밝혔습니다. [김용범/대통령실 정책실장 : ""아쉬운 부분입니다. 15%인데 저희가 최선을 다해서 12.5를 주장했으나 그건 거기까지는...""] 미국의 개방 압력이 거셌던 농산물. 트럼프 대통령은 한국이 농산물 등 미국산 제품을 받아들이기로 했다고 언급했습니다. 이에 대해 정부는 쌀과 소고기는 추가 개방하지 않는 걸로 합의했다고 밝혔습니다. [김용범/대통령실 정책실장 : ""식량 안보와 우리 농업의 민감성을 감안해 국내 쌀과 쇠고기 시장은 추가 개방하지 않는 것으로 합의하였습니다.""] 우리 정부가 협상의 카드로 내밀었던 조선업은 한미 협력을 크게 늘리기로 했습니다. 우리 정부가 미국에 투자를 약속하며 조성하기로 한 3500억 달러 규모 펀드. 이 가운데 1500억 달러가 조선업에 투입됩니다. 한국과 미국이 상호 이득을 볼 수 있는 분야로 꼽히는데, 선박 건조와 유지, 보수, 정비 등 조선업 전반에 대한 협력이 포괄적으로 이뤄질 거라고 대통령실은 밝혔습니다. 미국산 수입을 늘리기로 한 액화천연가스, LNG의 경우 우리가 통상적으로 수입하는 규모라 추가로 없는 수요를 만들 일은 없다는 게 정부 설명입니다. 한미 관세 협상 결과가 발표된 이후 열린 주식시장은 일제히 오름세로 문을 열었습니다. 코스피는 전장보다 0.65% 오른 3275.78로, 코스닥도 0.32%오른 806.21로 개장했습니다. KBS 뉴스 이정민입니다. ■ 제보하기 ▷ 전화 : 02-781-1234, 4444 ▷ 이메일 : kbs1234@kbs.co.kr ▷ 카카오톡 : 'KBS제보' 검색, 채널 추가 ▷ 네이버, 유튜브에서 KBS뉴스를 구독해주세요!",자동차 안도 소고기 개방 안
