category_id,category_name,press,title,reporter,date,link,timestamp,content,clean_title
101,경제,파이낸셜뉴스,"'재계 어르신' 손경식, 노봉법 개정 중단 촉구…""사회적 대화 필요",박경호,2025-07-31 11:33:16,https://n.news.naver.com/mnews/article/014/0005385304,2025-07-31 PM 01:23:53,"오는 4일 국회 본회의 투표 전 '노봉법' 개정 중단 촉구 경총 ""與·환노위, 경영계랑 논의 없어..민주노총 압력 작용"" 경총, 오늘 오후 법사위에 관련 입장 전달 예정 손경식 한국경영자총협회(경총) 회장이 31일 서울 마포구 경총회관에서 열린 노동조합법 개정 관련 긴급 기자회견에서 발언하고 있다. 사진=박경호 기자 [파이낸셜뉴스] 최근 국회 환경노동위원회를 통과한 일명 노란봉투법(노동조합 및 노동관계조정법 2·3조 개정안)을 대해 '재계 어르신'으로 꼽히는 손경식 한국경영자총협회(경총) 회장이 1년여 만에 기자회견을 열고 ""노란봉투법 통과 시 잦은 파업으로 인해 산업생태계를 뿌리째 흔들 것""이라면서 노봉법 개정 중단에 대한 목소리를 냈다. 노동계의 압력으로 법안이 통과된 것을 지적한 손 회장은 경영계가 제시한 대안을 깊이 있게 논의할 것을 국회와 여당에 거듭 촉구했다. 수백개 하청업체 교섭요구 가능성..피해는 근로자들이 입어 경총과 업종별 대표 기업은 31일 서울 마포구 경총회관에서 기자회견을 열어 이같은 입장과 함께 노조법 개정 중지를 촉구했다. 손 회장은 개정안이 가져올 쟁의 확대에 대해 ""대미 관세와 내수 부진, 글로벌 경쟁 심화로 어려운 상황에서 노조법이 통과되면 산업 현장의 위기감을 커질 것""이라며 ""노조법에 대해 노사 간 협의가 이뤄지길 바라는 절박한 심정""이라고 말했다. 지금까지 대법원은 근로계약상 관계가 있어야 단체 교섭 당사자로서 여부를 인정해 왔는데, 이번 노조법 개정안은 사용자의 범위를 '실질적이고 구체적으로 지배 및 결정할 수 있는 지위'로 확대하면서 하청업체로까지 교섭의 범위가 확장된 것이다. 이에 손 회장은 ""수백 개의 하청업체 노조가 교섭을 요구하면 원청사업주는 건건이 대응할 수 없어 산업현장은 혼란 상태의 빠질 것""이라며 ""하청 노조의 파업이 발생하면 원청기업은 협력업체와 거래를 단절해 그 피해는 근로자들이 입을 것""이라고 강조했다. 이날 회견에는 업종별 대표 기업도 참석해 노조법 개정 중단을 촉구했다. 정상빈 현대차 부사장은 ""저희도 노사 관계를 다르게 생각하지 않는다. 국가 경제 차원에서 같이 고민하면 좋은데 이번에는 경영계와 논의를 하지 않았다""고 말했다. 김태정 삼성전자 상무는 ""반도체를 비롯한 모든 업종의 경쟁이 치열하다. 그런데 내부에서 불확실성이 가미되면 어떻게 극복할지 우려된다""며 ""노사 협력 관계 구축을 위한 사회적 대화가 충분히 논의되기를 부탁드린다""고 말했다. 손경식 경총 회장이 31일 오전 서울 마포구 경총회관에서 열린 노동조합법 개정 관련 긴급 기자회견에서 취재진 질의에 답하고 있다. 사진=뉴시스 ""노조법, 법적 위배 사유 많아…오늘 법사위와 논의"" 여당 지도부와 환노위 국회의원들에게 손해배상액 상한과 급여 압류를 제한하는 대안을 제시했지만 민주노총의 요구만 반영해 법안이 통과됐다고 손 회장은 강조했다. 원래 노조법의 취지는 불법파업으로 인한 노동자들의 손해배상액 상한을 정하고 급여를 압류하지 못하도록 하는 것이라 강조한 경총은 경영전략까지 쟁의 대상으로 하는 노조법에 대해 헌법상 경영권과 사유재산권에 위배된다며 오늘 오후 법제사법위원회에 경영계의 입장을 피력할 예정이다. 손 회장은 ""이번 정부는 친기업 정부라 말하는데 상법개정안, 노란봉투법이 나와 우리를 매우 당혹스럽게 한다""며 ""노사관계의 안정과 균형을 위해서 경영계의 목소리를 국회에서 심도 있게 논의해야 한다""고 말했다. #삼성전자 #경총 #현대자동차 #노란봉투법",재계 어르신 손경 노봉법 개정 중단 촉구 사회 대화 필요
101,경제,헤럴드경제,"카페서 사라지는 과일음료, 왜?","박연수, 강승연",2025-07-31 11:31:16,https://n.news.naver.com/mnews/article/016/0002507797,2025-07-31 PM 01:23:53,"집중호우·폭염 겹친 이상기후에 작황 줄고 수요 늘어 과일값 ‘껑충’ 과일 들어간 카페 여름 메뉴 비상 “농산물 품종 개발·수입 다변화를” 29일 서울 중구 스타벅스 소공로점 메뉴판 멜론 프라푸치노에 솔드아웃 스티커가 붙어 있다. 박연수 기자 “멜론 프라푸치노는 매진됐습니다.” 29일 오후 서울 중구 스타벅스 소공로점 메뉴판에는 ‘솔드 아웃’ 스티커가 붙었다. 여름 한정 메뉴로 선보인 ‘더 멜론 오브 멜론 프라푸치노’ 얘기였다. 매장 직원은 “음료에 들어가는 멜론 청크 수급이 어려워 판매가 중단됐다”며 “입고 시기는 모르겠다”고 말했다. 해당 제품이 매진된 건 소공로점뿐만이 아니었다. 인근 3개 점포에서도 제품을 살 수 없었다. 음료 제작에 필요한 ‘칸탈로프 멜론 청크’가 떨어져 물량이 소진됐다는 안내만 반복됐다. 다른 매장 직원은 “(멜론 프라푸치노를) 하루에 40잔 팔았다”며 “옆 매장에 재료가 있는지 가볼 생각”이라고 했다. 스타벅스 관계자는 “지난 주말 프라푸치노 30% 할인 행사와 신규 메뉴 별 적립 행사가 겹쳐 판매량이 급증했다”며 “일부 매장에서 초도 물량이 빠르게 매진된 것”이라고 설명했다. 이어 “원활한 매장 운영을 위해 원·부재료를 추가 생산 중”이라며 “최대한 빠르게 (원재료) 물량을 확보해 판매를 재개할 계획”이라고 덧붙였다. 커피 프랜차이즈 업계의 여름철 시즌 메뉴가 이상기후의 직격탄을 맞았다. 폭염으로 식재료 물가가 치솟는 ‘히트플레이션(Heatflation)’의 영향이 뚜렷하다. 31일 한국농수산식품유통공사(aT) 농산물 유통정보(KAMIS)에 따르면 여름 메뉴의 단골 재료인 수박 중도매 가격은 꾸준한 오름세다. 29일 기준 수박 1개의 중도매 판매가격은 3만960원이었다. 이는 전월 대비 66.6%, 전년 대비 25.9% 오른 가격이다. 수박 가격은 예년보다 이른 폭염의 영향이 컸다. 농촌경제연구원 농업관측센터가 7월 고온과 수박 가격 간 관계를 분석한 결과, 최고기온이 평년보다 높았던 2018년과 2021년에 반입량 증가에도 수박 가격이 상승하거나 하락 폭이 제한적인 것으로 나타났다. 16~20일 집중호우 당시 수박의 산지인 충청도 지역에 피해가 집중된 것도 가격을 끌어올렸다. 농촌경제연구원은 “기온 상승과 참외 등 대체 품목의 가격 상승으로 앞으로도 수박 가격이 전년 대비 높을 것”으로 전망했다. 망고도 마찬가지다. 망고 5㎏ 중도매 판매가격은 22일 4만6840원에서 23일 5만6840원으로 하루 만에 1만원 급등했다. 이후 계속 오름세를 보이며 29일 5만7580원까지 치솟았다. 전월 대비 57.7% 상승한 가격이다. 전년보다 가격이 소폭 하락한 멜론도 예년보다는 비싸다. 멜론 8㎏ 중도매 판매가격은 29일 기준 3만4080원으로 집계됐다. 전년과 평년 대비 각각 37%, 32% 비싸다. 특히 카페에서 사용하는 멜론 청크의 물량이 부족한 것으로 나타났다. 폭염과 폭우로 인한 과일 가격 급등과 수급 불안은 카페의 위기로 번졌다. 5월부터 ‘생과일 수박주스’를 판매하는 이디야커피는 수박 납품업체와 논의를 이어가고 있다. 빽다방 관계자는 “이상기후로 원재료 가격 부담을 줄이기 위해 수급처 확보 노력을 이어가고 있다”고 말했다. 엄지범 순천대 농경제학과 교수는 “작황 감소와 여름철 수요 증가가 과일 가격 상승에 영향을 줬다”며 “기후 변화에 따른 농산물 품종 개발과 해외 수입 다각화 전략이 필요하다”고 제언했다. 박연수·강승연 기자",카페 과일 음료
101,경제,헤럴드경제,"[르포] “학교, 백화점 다 있고 재건축 되면 한강뷰” 자양 7구역도 ‘평당 1억’ [부동산360]","윤성현, 서정은",2025-07-31 11:30:29,https://n.news.naver.com/mnews/article/016/0002507793,2025-07-31 PM 01:23:53,"자양7구역, 학군·편의시설 등 입지 우위 부각 사업성 좋아지면서 가격 상승세 이어져 23일 찾은 자양7구역의 모습. 윤성현 기자 “자양7구역이 자양4동 보다 나은 점 많죠. 학교도 여러 개 있고, 롯데백화점, 이마트 편의시설이 더 가까워요. 용적률 높아져서 고층은 한강조망도 가능해요” (자양동 A공인중개사무소 대표) [헤럴드경제=윤성현·서정은 기자] 서울 광진구 자양3동 내 위치한 자양7구역. 기자가 지난 23일 찾은 이 곳은 오세훈 서울시장이 이달 중순 현장점검해 큰 관심을 받았던 자양4동 재개발 구역과는 도보로 불과 15분 거리다. 자양4동 재개발 구역에 비해 거리는 한산했지만, 현장 기대감의 크기는 못지 않았다. 2024년 10월 DL이앤씨를 시공사로 선정하고, 지난 4월에는 조합 정기총회를 통한 정비계획 변경 및 주거지역 종 상향이 이뤄지는 등 재건축 절차가 진행되고 있어서다. 자양7구역은 지금까지 자양1·2동 모아타운이나 자양4동 A구역에 비해 큰 관심을 받지 못했다. 하지만 교통과 학군 등 실거주 여건에서에서는 오히려 우위를 점하고 있다는게 인근 부동산들의 평가다. A공인중개사무소 대표는 “자양7구역은 2호선 건대입구역과 7호선 자양역을 모두 이용할 수 있는 더블역세권에 해당하며 인근에 유흥시설이 없어 주거 만족도가 높다”며 “동자초, 신양초, 신자초, 자양중, 자양고 등 도보권에 5개 학교가 있는 점도 강점”이라고 말했다. 특히 “다리만 건너면 강남으로 쉽게 접근이 가능해 삼성역 인근 직장을 다니는 젊은이들도 관심이 많다”고 덧붙였다. 자양7구역 내 공인중개사무소의 매물. 윤성현 기자 부동산 시장에서는 자양7구역의 거래 가격이 이미 ‘평(3.3㎡)당 1억원’ 수준에 진입했다는 전언이 나온다. 거래 자체가 워낙 없다보니 다른 곳과 단순 비교가 어렵지만 가격 상승세만큼은 이어지고 있다는 설명이다. 국토교통부 실거래가 공개시스템에 따르면 지난 6월 27일 자양7구역 내 대지권면적 81㎡ 연립주택은 18억원에 거래됐다. 자양4동 재개발 구역 내 대지면적 145㎡ 단독주택의 경우 지난 14일 28억원에 거래된 바 있다. 인근 B공인중개사무소 대표는 “오래전에 소유권 변동이 많이 이뤄져 현재 매물은 극히 드문 편”이라며 “소형지분은 실거래가 기준으로 평당 1억원에 거래되고 있다”고 설명했다. 해당 관계자는 “현재 매물로 나온 대지면적 약 132㎡ 규모의 대형지분은 25억원에 호가 중”이라며 “대형지분 평균 거래가는 평당 6000~7000만원 선”이라고 덧붙였다. 자양7구역은 주택지역이지만 해당 지역이 갖고 있는 도로, 학교 등 기반시설이 양호해 재개발이 아닌 재건축으로 진행되고 있다. 지난 4월 24일 총회를 열고 정비계획 변경안을 확정했다. 기존 구역에 동쪽 도로변 약 1만㎡를 추가 편입하고, 종상향을 통해 2종 일반주거지역에서 3종으로 바뀌게 된다. 이에 따라 용적률은 300%까지 상향되고, 최고 49층까지 건립 가능해진다. 계획 세대수는 1079세대이며, 전용 30평형 비율을 전체의 절반까지 확대할 예정이다. 조합은 오는 8월 내 광진구청에 변경안을 제출할 계획이다. 조합 관계자는 “사업성을 높이기 위한 정비계획 변경 등 절차를 차질없이 진행 중”이라며 “가능한 빠르게 사업시행계획 인가까지 이어갈 계획”이라고 밝혔다. 한편 자양7구역은 2026년 10월 12일로 일몰 기한을 앞두고 있으며, 이미 한 차례 기한 연장을 받은 상태다. 이에 조합 관계자는 “사업 진행에 진전있는 조합은 기한 연장을 더 시켜줬으면 한다”고 토로했다. 자양7구역 재건축정비사업조합은 오는 8월 내 정비계획 변경안을 제출할 예정이다. 윤성현 기자 조합은 이번 정비계획 변경을 통해 자양7구역의 경쟁력을 높인다는 방침이다. 조합 관계자는 “아직 구역의 감정평가가 이뤄지지 않았다”며 “현재 자양동 일대에 비교할만한 신축 아파트가 없어 현재로선 시세 예상은 어렵지만, 이미 실거래가가 평당 1억원에 형성된 만큼 그 이상 시세를 기대하고 있다”고 말했다. 이 지역에 실거주 중이라고 밝힌 70대 조합원은 “성수전략정비구역 제1지구 주택을 정리하고 자양7구역에 들어온 지 7년 정도 됐다”며 “당시 조합원이 400명 가량이었는데, 향후 900세대 이상으로 거듭나 사업성이 좋다는 이야기를 듣고 들어왔다”고 전했다.",르포 학교 백화점 재건축 한강 자양 구역 부동산
101,경제,헤럴드경제,스테이블코인 혁신 급한데…‘낡은 규제’ 발목,김벼리,2025-07-31 11:29:14,https://n.news.naver.com/mnews/article/016/0002507786,2025-07-31 PM 01:23:53,"2006년 제정 ‘전금법’ 전면개정 필요 높은 규제에 혁신사업자 진입 제한 “전자금융업종 기능적 재정의해야” 지급지시전달업, 은행·핀테크 대립 당국 조직개편지연, 법안처리 변수 20년 전에 제정된 ‘전자금융거래법(전금법)’이 현재 디지털 결제 환경과 동떨어져 있어 전면적인 개정이 필요하다는 목소리가 커지고 있다. 해외에서는 스테이블코인 등장 등 결제 혁신 속도가 급속도로 빨라지고 있지만, 한국은 낡은 규제에 묶여 신기술을 구현할 환경조차 조성되지 않는다는 지적이 제기된다. 31일 금융권에 따르면 최근 핀테크 업계를 중심으로 ‘전금법’ 개정의 필요성이 다시 제기되고 있다. ‘전금법’이란 전자금융거래에 대한 법령이다. 전자금융 거래의 안정성과 신뢰성을 확보하고, 산업 발전 기반을 조성하기 위해 지난 2006년 제정됐다. 하지만 약 20년이 지난 현재 전자금융거래 환경과는 동떨어져있다는 지적이 제기된다. 당시에는 전자거래도 카드 결제가 중심이었지만, 지금은 간편송금, 오픈뱅킹, 모바일결제에 이어 최근 스테이블코인까지 디지털 결제 환경이 크게 바뀌었기 때문이다. 한국금융연구원에 따르면 ‘전금법’은 제정 당시 7개 전자금융업과 전자금융보조업을 규정하고 지급수단, 전자적 장치, 접근매체에 대한 개념도 명시적으로 정의했는데, 현재까지 이 정의를 유지하고 있다. 반면 해외 주요국은 전자금융거래의 빠른 기술 변화를 반영해 규제 체계를 지속해서 개선하고 있다. 금융연구원 관계자는 “우리나라도 해외 사례처럼 ‘전금법’을 전면 개정할 필요가 있다”고 강조했다. 현행 제도에서는 전자금융산업의 규제수준과 체계가 상대적으로 높고 복잡해 혁신사업자의 진입이 어려운 상황이다. 전자금융업자 보유 선불충전금 규모가 커지는 등 디지털금융 이용자가 늘어나지만, 보호 장치가 미흡한 것도 한계로 지적된다. 금융감독원에 따르면 지난해 말 기준 전금업 매출은 10조4000억원으로 2년 새 1조9000억원 증가했다. PG선불 잔액도 2022년 9조6000억원에서 지난해 14조4000억원으로 4조8000억원 늘었다. 금융보안도 새로운 시스템에 맞춰서 고도화해야 할 필요성이 제기되고 있다. 금융권 한 관계자는 “현행 제도에서는 전자금융업종을 라이선스 위주로 규정하기 때문에 빈틈이 많고, 그걸 노리고 규제를 피해 사업을 하다가 소비자 피해로 이어진 사례가 많았다”며 “사건이 터지면 그때그때 땜질처방식으로 라이선스를 추가하는 식으로 법을 개정해왔는데, 이제는 급변하는 디지털 환경에 맞춰 전자금융업종을 보다 기능적으로 재정의하는 작업이 필요하다”고 강조했다. 지난 정부에서 금융위원회는 디지털 금융 혁신 전략의 일환으로 ‘전금법’ 전면 개정을 추진했다. 2020년 이후 머지포인트 사태, 가상자산 사고 등이 잇따르자 소비자 보호 강화를 위해 개정 필요성이 떠오르면서다. PISP(지급지시전달업) 등 새로운 업권을 신설하고, 전자지급수단의 지급 효력을 명확히 규정하는 내용 등이 핵심이었다. 지난 21대 국회에서도 김병욱 의원 등을 중심으로 관련 법안들이 발의되기도 했다. 지급지시전달업이란 이용자의 결제·송금 지시를 은행 등 금융회사에 전달하는 업종을 말한다. 기존 제도에서는 간편결제 이용 시 은행, 상점, 상점의 거래은행과 핀테크업체 등 복잡한 중개 과정을 거쳐야하는데, 이 업종이 도입되면 고객 거래은행에서 상점 거래은행으로 ‘지급 지시’만 전달해도 결제를 할 수 있다. 한마디로 이용자 자금을 보유하지 않고 이체 지시만 전달하는 전자금융업이다. 소비자 입장에서도 지급지시전달업이 도입되면 전자상거래에서 수수료 비용을 줄일 수 있고 거래상 리스크도 줄일 수 있는 장점이 있다. 현행 제도에서는 전자상거래 시 전자금융업자를 거쳐 은행에서 출금하는 과정에서 펌뱅킹 수수료가 발생한다. 또한 은행에 자금을 계속 보관하면서 은행이 제공하는 금융서비스도 함께 이용할 수 있다는 것도 장점이다. 하지만 논의 과정에서 은행권과 핀테크업계 간 이견이 좁혀지지 않으면서 법 개정 작업에 제동이 걸렸다. 은행권에서는 고객 자금에 대한 책임은 은행에서 지고 혜택은 지급지시전달업이 누릴 것이라며 반대의 목소리를 강하게 냈다. 반면 핀테크업계에서는 최근 포럼, 세미나 등을 열면서 다시 ‘전금법’ 개정에 대한 논의의 불씨를 다시 키우고 있다. 다만 정부와 국회에서는 주요 현안들에 밀려 본격적인 논의까지는 시간이 걸릴 것으로 전망된다. 22대 국회에서 ‘전금법‘ 전면 개정과 관련한 법안은 아직 한 건도 발의되지 않았다. 여당에서는 스테이블코인 등 현안이 산적해 있어 ‘전금법‘ 전면개정은 논의선상에서 제외된 상태다. 금융당국 조직개편 향방도 관건이다. 한 핀테크업계 관계자는 “법령 전면 개정을 위해서는 정부와 국회가 같이 움직여야 하는데 현재 금융당국 수장도 공석이고, 조직개편 이슈도 있기 때문에 어려운 상황”이라며 “상황이 정리되면 의원실과 같이 TF(태스크포스)를 꾸리고 법 개정을 추진할 계획”이라고 말했다. 김벼리 기자",테이블 코인 혁신 규제 발목
101,경제,한국일보,"[단독] 미국산 에너지, 4년 동안 14.5조원어치 더 산다...현재 구매액의 10% 증가",오지혜,2025-07-31 11:28:11,https://n.news.naver.com/mnews/article/469/0000879130,2025-07-31 PM 01:23:53,"""미국산 LNG, LPG, 원유 등 1000억 달러어치 구매"" 현재 연간 약 31조원어치 사오고 있어 4년 동안 연 평균 3조6,000억원어치 더 사는 셈 ""2024년 구매 총액 기준 10% 증가"" 구윤철 경제부총리 겸 기획재정부 장관, 김정관 산업통상자원부 장관, 여한구 통상교섭본부장 등을 태운 한국 통상협상단 차량이 30일 트럼프 미 대통령과의 면담을 위해 미국 워싱턴DC 백악관 서쪽 출입문 검문소를 통과하고 있다. 워싱턴=연합뉴스 미국과 관세 협상에서 우리 측이 올해부터 4년 동안 액화천연가스(LNG), 액화석유가스(LPG), 원유 등 미국 산 에너지를 1,000억 달러(약 138조9,000억 원) 어치 사겠다고 약속했다. 이는 현재 수입량(2024년 기준 약 31조 1,480억 원)을 감안했을 때 미국에서 들여오는 에너지 수입액 규모를 4년 동안 104억 달러 가량 키운다는 뜻으로 파악됐다. 약 14조4,500억 원 어치다. 이번 협상에서는 빠르면 2030년 이후 생산이 예상되는 알래스카 LNG 구매 및 투자 내용은 담기지 않았지만 트럼프 대통령과 약속한 3,500억 달러 규모의 대(對)미 투자에서 언급될 불씨가 남아있다. 31일 도널드 트럼프 대통령의 30일(현지시간) 사회관계망서비스(SNS) 게시글과 정부 관계자의 설명을 종합하면 한국은 미국에 올해부터 4년 동안 누적 1,000억 달러 규모의 미국산 에너지 구매를 약속했다. 이는 연간 평균 250억 달러(약 34조 7,375억 원) 규모다. 이로써 한국은 4년 동안 미국으로부터 연 평균 약 26억 달러(약 3조 6,127억 원) 어치씩 수입량을 늘려갈 것으로 보인다. 한국은 이미 미국으로부터 에너지를 대량으로 사오고 있다. 관세청 수출입무역통계에 따르면 한국은 2024년 미국산 에너지를 224억 1,672만 1,000달러어치(약 31조 1,480억 원) 구매했다. 항목별로는 △원유 142억4,880만 3,000달러 △석탄 6억 1,635만 5,000달러 △ 가스 75억 5,156만 4,000달러였다. 특히 올해부터 미국산 구매를 늘려가고 있다. 한국석유공사는 올해 600만 배럴 규모의 미국산 경질유 판매·구매 계약을 세 차례에 걸쳐 마쳤다. 중동산 중질유를 대체한 것으로 서부텍사스산원유(WTI) 선물 가격(약 67달러)을 고려하면 약 4억 달러 규모였다. 또 계약에 시간이 오래 걸리는 LNG는 민관을 통틀어 늘리기로 한 미국산 구매량 중 절반은 계약을 끝냈고 절반 가량은 계약을 앞두고 있는 것으로 파악됐다. 정부는 필요한 에너지를 구매하는 것인 만큼, 우리 경제에 무리가 아니라고 설명했다. 구윤철 부총리 겸 기획재정부 장관은 이날 주미한국대사관에서 열린 브리핑에서 ""LNG 등 미국 에너지 구매의 경우 우리에게 필요한 에너지 구매처를 미국으로 확대 전환하는 것""이라며 ""우리 경제에 추가 부담을 야기하진 않을 것으로 판단된다""고 설명했다. 이번 구매 약속에는 알래스카 LNG는 포함되지 않았다. 1,300㎞ 길이의 가스관을 놓아야 하는 대규모 공사가 필요한 이 프로젝트는 2030년 이후에나 가스 생산이 가능할 것으로 보이기 때문이다. 다만 트럼프 대통령의 역점 사업인 만큼 한미 정부가 합의한 3,500억 달러의 대미 투자액을 활용해 알래스카 LNG 프로젝트에 추가 투자나 구매를 약속하라고 압박할 여지는 충분하다.",미국 에너지 동안 어치 산다 현재 증가
